channel_title,channel_id,video_publish_date,video_title,video_description,video_category,video_view_count,video_comment_count,video_like_count,video_dislike_count,video_thumbnail,video_tags,collection_date,day,day_published,publish_date
KENS 5: Your San Antonio News Source,UCVnjt9mMx46gMUeTtONXimQ,1653498629.0,"More than 17 hours after Uvalde shooting, some families still waiting to hear details","Some families are still waiting to hear what happened to their loved ones. More on the story, here: https://www.kens5.com/article/news/local/texas-active-shooter-reported-robb-elementary-uvalde-police/273-cbf0d9be-d042-4557-a360-e2a3ad944a10",25,17479,39,147,,https://i.ytimg.com/vi/XiYF9OQ2IXc/hqdefault.jpg,local|news|special-reports|texas|uvalde-school-shooting|crime|texas school shooting|school shooting|texas shooting|robb elementary school|uvalde|texas news|gun control|active shooter|gun violence|live news|uvalde shooting,2023-11-29 12:26:18.737569,2,2022-05-25,2022-05-25 17:10:29
NBC News,UCeY0bbntWzzVIaj2z3QigXg,1653498902.0,Uvalde's Community Comes Together After Robb Elementary School Mass Shooting,"Residents gathered in prayer at Ulvade's civic center as parents were reunited with students from the Robb Elementary School.

» Subscribe to NBC News: http://nbcnews.to/SubscribeToNBC
» Watch more NBC video: http://bit.ly/MoreNBCNews

NBC News Digital is a collection of innovative and powerful news brands that deliver compelling, diverse and engaging news stories. NBC News Digital features NBCNews.com, MSNBC.com, TODAY.com, Nightly News, Meet the Press, Dateline, and the existing apps and digital extensions of these respective properties.  We deliver the best in breaking news, live video coverage, original journalism and segments from your favorite NBC News Shows.

Connect with NBC News Online!
NBC News App: https://smart.link/5d0cd9df61b80
Breaking News Alerts: https://link.nbcnews.com/join/5cj/breaking-news-signup?cid=sm_npd_nn_yt_bn-clip_190621
Visit NBCNews.Com: http://nbcnews.to/ReadNBC
Find NBC News on Facebook: http://nbcnews.to/LikeNBC
Follow NBC News on Twitter: http://nbcnews.to/FollowNBC

#Uvalde #Texas #SchoolShooting",25,16224,27,116,,https://i.ytimg.com/vi/nKUuQd-rgRo/hqdefault.jpg,NBC News|NBC|news|video|Breaking News|Top Stories,2023-11-29 12:26:18.737569,2,2022-05-25,2022-05-25 17:15:02
KCENNews,UCjq9ElqnV7Df6NLb4oDHKqQ,1653556365.0,4th grade student survivor shares story on Uvalde shooting,"Right before the mayhem, 9-year-old says his class was watching a movie. They were about to break for lunch. Then loud bangs.

SUBSCRIBE | http://bit.ly/2Z6mT7N

Read more: kcentv.com

Follow 6 News:
https://www.instagram.com/kcennews/
https://twitter.com/6NewsCTX
https://ww.facebook.com/KCENNews
https://https://www.tiktok.com/@kcentv",25,16001,50,254,,https://i.ytimg.com/vi/MghunNI0g-w/hqdefault.jpg,local|news|texas|watch-utility,2023-11-29 12:26:18.737569,2,2022-05-25,2022-05-26 09:12:45
The Humanist Report,UC7Q4rvzJDbHeBHYk5rnvZeA,1653533595.0,WATCH: Beto O’Rourke Disrupts Greg Abbott’s Press Conference Following Uvalde Shooting,"Get early access to videos by supporting us on Patreon, YouTube or PayPal! Sign up here: http://www.patreon.com/humanistreport or here: http://www.humanistreport.com/support.html or here: https://www.youtube.com/channel/UC7Q4rvzJDbHeBHYk5rnvZeA/join

Read More About This Story Here:
https://thehill.com/news/campaign/3501422-orourke-confronts-abbott-at-press-conference-on-texas-school-shooting/

**************
Visit Our Website: http://www.humanistreport.com/
Like Us on Facebook: http://www.facebook.com/humanistreport
Follow Us on TikTok: https://www.tiktok.com/@humanistreport
Follow Us on Twitter: http://www.twitter.com/HumanistReport
Follow Mike on Instagram: https://www.instagram.com/mike.figueredo/
Follow Mike on Twitch: https://www.twitch.tv/humanistreport
Download the Opt-Out App: https://www.optout.news/
**************
The Humanist Report (THR) is a progressive political podcast that discusses and analyzes current news events and pressing political issues. Our analyses are guided by humanism and political progressivism. Each news story we cover is supplemented with thought-provoking, fact-based commentary that aims for the highest level of objectivity.

#HumanistReport #THR #MikeFigueredo",25,15287,676,2128,,https://i.ytimg.com/vi/ONVXSDAWz58/hqdefault.jpg,Beto O'Rourke|Greg Abbott|Uvalde|Texas|School Shooting|Breaking News|Viral Video|Politics|The Humanist Report|Mike Figueredo,2023-11-29 12:26:18.737569,2,2022-05-25,2022-05-26 02:53:15
CBS TEXAS,UCxMXl9L79X1Mq_4iwCOyPFg,1653537153.0,Senator Ted Cruz reacts to Uvalde school shooting,Senator Ted Cruz (R-Texas) comments on the Uvalde elementary school shooting.,25,12666,347,112,,https://i.ytimg.com/vi/Nok6kdCNAGI/hqdefault.jpg,CBS 11 News Evening|Senator Ted Cruz|Uvalde,2023-11-29 12:26:18.737569,2,2022-05-25,2022-05-26 03:52:33
NewsNation,UCCjG8NtOig0USdrT5D1FpxQ,1653534643.0,‘Warning signs’ on social media before Uvalde shooting  |  Rush Hour,"New details are emerging about the second deadliest elementary school shooting in U.S. history, including chilling messages from the gunman on social media. Emotions are raw in the tight-knit town after 19 children and two adults lost their lives.

Rush Hour is a no fluff, no filler newscast hosted by Nichole Berlie that taps into a nationwide network of thousands of journalists to get you up-to-the-minute news from across the country.

NewsNation is your source for fact-based, unbiased news for all America. 

Find us online: https://www.newsnationnow.com/
Get our app: https://bit.ly/3AbFrG3
Watch us on TV or via streaming: https://bit.ly/3oxRmf5",25,9797,72,202,,https://i.ytimg.com/vi/sz-Mh9IIijQ/hqdefault.jpg,video|news|WatchRushHour,2023-11-29 12:26:18.737569,2,2022-05-25,2022-05-26 03:10:43
Hasan Reactions,UC1hW1iEFDsW-6V0zC8jqVQA,1653519044.0,"Hasanabi Reacts to Uvalde, Texas School Shooting Tragedy","Hasan reacts to the news of yet another mass shooting event in America, this time at an elementary school in Texas.

Edited By: https://twitter.com/HasanReactions
Intro Animation By: https://twitter.com/HasanReactions
Outro Animation By: https://twitter.com/HasanReactions
Music Composition By: https://twitter.com/HasanReactions
(Yes, right now it's just me making everything)

Editor's Note: My edits were all made to keep the video on one, central topic by editing together relevant commentary from many parts of Hasan's streams to create a storyline that is still followable by the viewer. I also edited in commentary of my own in places, in addition to relevant external information that improves the viewing experience. A lot of edits were made for comedy purposes, or to enhance the comedic timing of certain beats, but never to misrepresent Hasan's point of view.

Subscribe and Like for Daily Reactions!

Unless otherwise stated, all visuals, audio, and commentary added during the editing process is created and owned by Hasan Reactions.

Find Hasan Live at: https://www.twitch.tv/hasanabi

#hasanabi #MassShooting #Tragedy #HasanReactions #reacts

About Hasan:
Hasan Piker is Political Commentator turned Twitch Streamer (#13) known for his Turkish heritage and leftist takes, often speaking on topics like Socialism, Communism, Capitalism, and Marxism (and occasionally 9/11). He loves reacting to political news, and occasionally goes on IRL adventures with his friends such as Ludwig, TinaKitten, Sykkuno, Pokimane, Valkyrae, xQc, and many others. He likes to react to popular media content with his audience as well, such as Jubilee, JCS (Jim Can't Swim), Joe Rogan, WWE, Ben Shapiro, Tucker Carlson, MasterChef, Channel 5, trending twitter posts or TikToks, and other creative videos. He also co-hosts two podcasts, Leftovers, with Ethan Klein of H3H3 fame, and Fear & Malding, with Will Neff. He allegedly sometimes plays games like GTA 5, Dark Souls, Elden Ring, and whatever excites him on the PS5, Switch, or the PC side of gaming.",24,9758,28,275,,https://i.ytimg.com/vi/PFhbne-IOog/hqdefault.jpg,,2023-11-29 12:26:18.737569,2,2022-05-25,2022-05-25 22:50:44
HasanAbi Industries,UCz2n05fvYYoVTrhq1ZUnyHA,1653530910.0,"Hasanabi Reacts to Uvalde, Texas School Shooting","Main Channel ► https://bit.ly/3pPq02f 
Watch live EVERYDAY ► https://www.twitch.tv/hasanabi

Hasan Piker does not own this channel. 
This is a fan channel for highly edited content from Hasan’s twitch stream. 

Outro song - https://www.youtube.com/watch?v=dLdN_7IswJk&ab_channel=Kijugo

Pfp Artist - https://twitter.com/MattsStupidArt

If you own the copyright of the content shown in this video and would like it to be removed please contact me at hasanabiindustries@gmail.com

#reacts #HasanAbi #HasanPiker #twitch #Texas #SchoolShooting",25,8818,12,134,,https://i.ytimg.com/vi/wTvoUs1PZ2Q/hqdefault.jpg,hasanabi|hasanabi clips|hasanabi highlights|hasan piker|hasan|hasan piker tyt|twitch|top twitch fails|twitch fails|funny twitch moments|livestream fails|livestream|drama|lsf|live stream fails|best twitch clips|funny twitch clips|streamer|react|twitch streamer|streamers|best twitch fails|tyt|hasanabi reacts|daily dose of hasanabi|texas|school shooting|robb elementary school|mass shooting|uvalde texas,2023-11-29 12:26:18.737569,2,2022-05-25,2022-05-26 02:08:30
News Now Community,UCQMKbWbHV68IxjVYza_Qm-Q,1653520900.0,Uvalde Shooter running into school,"Video shows Uvalde Shooter fleeing Police and running into a school.
Shooter had killed his Grandmother and was being chased by Police and Border Patrol Agents. Shooter crashed his vehicle and fled on foot while exchanging gunfire with Police. He then ran into a local school.",25,6776,55,159,,https://i.ytimg.com/vi/VrxaGjXiiI0/hqdefault.jpg,,2023-11-29 12:26:18.737569,2,2022-05-25,2022-05-25 23:21:40
The Dallas Morning News,UCACRim7l0tmc5lhNnDQyUvQ,1653525025.0,Dallas kids process Uvalde shooting,"A third grade class at F. P. Caillet Elementary School expresses fear and ideas after the Uvalde Elementary School shooting 

Subscribe to The Dallas Morning News: 
https://www.dallasnews.com/subscribe/main/

Site: http://dallasnews.com
Twitter: http://twitter.com/dallasnews
Instagram: http://instagram.com/dallasnews
TikTok: https://www.tiktok.com/@dallasmorningnews",17,6654,34,51,,https://i.ytimg.com/vi/2jCOGGjHcqs/hqdefault.jpg,dallas morning news|dallasnews|dallas|texas|newspaper|dallas newspaper|dallas news,2023-11-29 12:26:18.737569,2,2022-05-25,2022-05-26 00:30:25
KENS 5: Your San Antonio News Source,UCVnjt9mMx46gMUeTtONXimQ,1653493756.0,"DNA tests to match parents, kids following Uvalde shooting","Teachers will be reporting to the school although classes have been canceled for the remainder of the school year. More on the story, here: https://www.kens5.com/article/news/local/texas-active-shooter-reported-robb-elementary-uvalde-police/273-cbf0d9be-d042-4557-a360-e2a3ad944a10",25,6522,15,74,,https://i.ytimg.com/vi/w1MkR8CROPs/hqdefault.jpg,local|news|special-reports|texas|uvalde-school-shooting|crime|texas school shooting|school shooting|texas shooting|robb elementary school|uvalde|texas news|gun control|active shooter|gun violence|live news|uvalde shooting,2023-11-29 12:26:18.737569,2,2022-05-25,2022-05-25 15:49:16
Waldorf Nation,UCIAXaU6LIcZyoHYWqVLM4wg,1653544810.0,Paul Gosar & Candace Owens Blame Uvalde Shooting On Trans People,"Support our Channel:  http://www.patreon.com/JeffWaldorf

Following Tuesday's mass shooting at a Texas elementary school, Rep. Paul Gosar, an Arizona Republican, spread a false and transphobic claim that the suspected shooter was a ""transsexual leftist illegal alien.""

https://www.businessinsider.com/texas-shooting-uvalde-paul-gosar-touts-false-claim-transgender-woman-2022-5?fbclid=IwAR2onDK42F77H67rX_RzcuEfqkr0Byxy6rb84p9SrkaCpShqlL5uIaJeddc

Or become a channel member: https://www.youtube.com/channel/UCIAXaU6LIcZyoHYWqVLM4wg/join

Subscribe for daily videos!

Reddit: https://www.reddit.com/r/WaldorfNation/
Like Our Facebook Page! http://www.Facebook.com/JeffWaldorfShow
Find me on Twitch! https://www.twitch.tv/jeff_waldorf
Follow me on Twitter: @JeffsPolitics",25,6338,173,418,,https://i.ytimg.com/vi/59Bo7GcQL1c/hqdefault.jpg,News|Politics|Democratic Party|Republican Party|Liberalism|Right-Wing Politics|TYT Nation|Waldorf Nation|The Young Turks|Trump's America,2023-11-29 12:26:18.737569,2,2022-05-25,2022-05-26 06:00:10
ABC10,UCT350j4u6alUKyF9eu2bGug,1653550731.0,"Stockton 1989 mass school shooting memories re-emerge after Uvalde, Texas","Stockton 1989 mass school shooting memories re-emerge after Uvalde, Texas

Five kids ages 6 to 9 years old were killed by a gunman in 1989 at a Stockton school, along with 32 others injured in the gunfire. Survivors are calling for change in gun control policy.

Check out the full story here: https://www.abc10.com/article/news/local/stockton/uvalde-massacre-stockton-1989-shooting/103-c4e16844-aa49-4b0c-86e7-210bc55df6e4

Subscribe at: https://goo.gl/vai8Eu
Find ABC10 online: https://www.abc10.com/
Sign up for our newsletter: https://www.abc10.com/email 
Stream ABC10 on Roku: https://channelstore.roku.com/details/63398/abc10
Stream ABC10 on Amazon Fire: https://www.amazon.com/Gannett-Broadcasting-ABC-10-Fire/dp/B01E0H2KZQ
Stream ABC10 on AppleTV: https://itunes.apple.com/us/app/abc10-news-weather-traffic/id469397853?mt=8
Like ABC10 on Facebook: https://www.facebook.com/ABC10tv/ 
Like ABC10 on Instagram: https://www.instagram.com/abc10tv
Follow ABC10 on Twitter: https://twitter.com/ABC10
App download Android: https://play.google.com/store/apps/details?id=com.gannett.local.library.news.kxtv&hl=en_US
App download iPhone: https://apps.apple.com/us/app/abc10-news-weather-traffic/id469397853",25,5917,6,56,,https://i.ytimg.com/vi/vLXurn-21aM/hqdefault.jpg,1989|Cleveland|abc10|anxiety|calling|cdc|change|depression|emergency room|firearms|guns|killing|mass shooting|mental health|pandemic|research|stockton|survivors|teachers,2023-11-29 12:26:18.827371,2,2022-05-25,2022-05-26 07:38:51
Marcus Tinsley Music,UCxKzzQh208Vi-XUggrD_pOw,1653550242.0,"Uvalde, Texas School Shooting | Tribute Song","I dont want to even begin to understand what the parents of these poor little ones are going through. 
A parent should never outlive their child.
Trageties like this should never happen.
& songs like this shouldn't exist. 

That being said, as a songwriter, after hearding the news (like the every other parent out there) my heart broke, & that energy was then channeled into a song. 

I can only hope that it will help those who need it, and we all remember to hold our little ones a little tighter tonight.
If you are able to help the families affected, just click the link in the comments.
✌🏼❤️ ya’ll",22,2585,8,94,,https://i.ytimg.com/vi/yw4XGlBhezU/hqdefault.jpg,,2023-11-29 12:26:18.827371,2,2022-05-25,2022-05-26 07:30:42
Storyful News & Weather,UCBU0SoyQRFlxZdxoOiHPTYw,1653533168.0,Beto O'Rourke Confronts Texas Governor Greg Abbott at Uvalde Shooting Press Conference,"Beto O'Rourke Confronts Texas Governor Greg Abbott at Uvalde Shooting Press Conference
Texas gubernatorial candidate Beto O’Rourke interrupted the state governor’s press conference on Wednesday, May 25, one day after a mass shooting left 21 people dead in Uvalde, Texas.
Video taken by Carlos Eduardo Espina shows O’Rourke approaching the stage where Texas Gov Greg Abbott was holding a press conference on Tuesday afternoon.
“Governor, I have to say something,” O’Rourke can be heard saying in the footage. “The time you needed to have stopped this was after Santa Fe High School.”
Abbott and others onstage engaged verbally with O’Rourke, telling him to “sit down” and “leave,” with one calling him a “sick son of a b***h.”
“You’re doing nothing. You’re all doing nothing … this is totally predictable when you choose not to do anything,” O’Rourke said.
“This is on you until you choose to do something different. This will continue to happen,” O’Rourke said as he was ushered away from the stage. “Somebody needs to stand up for the children of the state, or they will continue to be killed just like they were killed in Uvalde yesterday.”
The press conference was streamed live to the governor’s Facebook page for only 35 seconds before the stream ended.
O’Rourke, a Democrat, is running against Abbott, a Republican, in Texas’s gubernatorial election in November.
Nineteen students and two adults were killed on May 24 after an 18-year-old local resident pushed past officers and barricaded himself inside a fourth grade classroom at Robb Elementary School in Uvalde, according to officials’ latest updates.
Credit: Carlos Eduardo Espina via Storyful

Credit: Carlos Eduardo Espina via Storyful
Original video: https://twitter.com/cespina1998/status/1529553564317716487?s=20&t=ts4AX_B0fAQU8GMKnyDOWg

To download this video for news use you must go to: http://newswire.storyful.com To obtain a Storyful subscription, contact sales@storyful.com.

This video has been uploaded for use by Storyful's subscription clients with the permission of the content owner. 

Clients can see and search Storyful Licensed Videos here: http://newswire.storyful.com",25,2511,35,60,,https://i.ytimg.com/vi/QwHYNL_kiZA/hqdefault.jpg,news|viral|dramatic|breaking news|storyful|viral video|world news|report|journalism|video|international news|election|news today|viral video 2022|viral moment 2022|live news 2022|best videos 2022|top video 2022|top news stories 2022|beto o'rourke|greg abbott|beto texas shooting video|greg abbott beto o'rourke video|beto texas video|beto school shooting,2023-11-29 12:26:18.827371,2,2022-05-25,2022-05-26 02:46:08
"Marine-X, AfterThoughts",UCdcBQLY3DQ1zeK-3H1wKgVg,1653479953.0,Thoughts on Uvalde Shooting,"This was a really tough event to follow. Check out my other channel for suggestions on an Active Shooter Bag for your kiddo. https://youtu.be/TjX4TcPJSX0

Check out my other channel

www.youtube.com/marinex

Cigar Bible: https://amzn.to/3J0BuZF
Cutter: https://amzn.to/3plYedM
Whisky Glasses: https://amzn.to/3h5mcpX
Whisky Glass Cover: https://amzn.to/3jeunT4
Torch: https://amzn.to/35U9eGw
Zippo Molle Pouch: https://amzn.to/3roszbd
Spec Ops Box Cutter: https://amzn.to/2QtsLZN
Favorite Lighter: https://amzn.to/39e7F8v",22,1939,47,82,,https://i.ytimg.com/vi/Csc0JPEWhAU/hqdefault.jpg,uvalde|elementary shooting|thoughts on uvalde,2023-11-29 12:26:18.827371,2,2022-05-25,2022-05-25 11:59:13
The Hood Conspiracy Theorist,UCPAhn4dA5gH7VIl3eDOXYlw,1653517820.0,#Robelementaryschool #Robelementary #texas #schoolshooting #shorts #massshooting #uvalde #shooting,,27,1872,3,33,,https://i.ytimg.com/vi/bareQt71Xv8/hqdefault.jpg,,2023-11-29 12:26:18.827371,2,2022-05-25,2022-05-25 22:30:20
Podcast For Humans,UC6Tj739ymgNDP0hKQRpmGcw,1653524359.0,Armed Guards in Schools #gunviolence #shooting #uvalde,,22,1769,38,92,,https://i.ytimg.com/vi/GVJNcChr6yE/hqdefault.jpg,,2023-11-29 12:26:18.834864,2,2022-05-25,2022-05-26 00:19:19
Top news,UCOY3OBDrQM7KqpNdizzVUOw,1653506097.0,".. We know it will not stop.#Mast #shooting in #Uvalde , #Texas",,25,1398,1,46,,https://i.ytimg.com/vi/WT3qWuhCzVQ/hqdefault.jpg,,2023-11-29 12:26:18.834864,2,2022-05-25,2022-05-25 19:14:57
It’s Recording Time Media,UClEmqHQ2j7LqrCoFp0AT5Cg,1653536722.0,My Condolences to the Victims of the Uvalde Shooting #shorts,"My condolences to 

Alithia Ramirez

Jackie Cazares and Annabell Rodriguez

Eva Mireles

Uziyah Garcia

Xavier Lopez

Amerie Jo Garza

Irma Garcia

Alexandria 'Lexi' Rubio

Tess Marie Mata

Maite Rodriguez

Nevaeh Bravo

Ellie Lugo

Rojelio Torres

Jose Flores Jr.

Eliahana Cruz Torres

Jayce Carmelo Luevanos and Jailah Nicole Silguero

Makenna Lee Elrod

Rest In Peace! 
#uvalde #texas",24,846,2,40,,https://i.ytimg.com/vi/nownPj9mLxQ/hqdefault.jpg,,2023-11-29 12:26:18.834864,2,2022-05-25,2022-05-26 03:45:22
KXAN,UCgBVz3EzHYKpPS0BITvLRsg,1653541083.0,Renewed calls for gun control and push back after Uvalde shooting,"KXAN's Matt Grant reports on renewed calls for gun reform, and those who are still pushing back.

Stay informed about Austin and Central Texas news, weather, investigations and sports on our website and social media:

https://www.kxan.com/
https://www.youtube.com/c/KXANAustinNews?sub_confirmation=1
https://www.facebook.com/KXANnews/
https://twitter.com/KXAN_News
https://www.instagram.com/kxan_news",25,759,17,17,,https://i.ytimg.com/vi/uHxD9V4eEmo/hqdefault.jpg,kxanaustin|kxanaustinnews|KXAN_News,2023-11-29 12:26:18.834864,2,2022-05-25,2022-05-26 04:58:03
7UMMIT MAGAZINE,UCtNLSChUxKHCOTkpqov1VPQ,1653534847.0,Joe Biden Confirms Texas Trip to ‘Comfort’ Families of Uvalde shooting,"President Biden said Wednesday that he and first lady Jill Biden will visit Texas to “comfort” the families of 21 people murdered in a horrific school shooting — as he again called for stricter gun control laws.

#Texas #JoeBiden #uvalde",25,733,4,6,,https://i.ytimg.com/vi/l74RxRmk1Yc/hqdefault.jpg,Joe Biden|Biden|Hunter Biden|Ukraine|Ukrainian|USA|breaking|breaking news|world economic forum|war|WW3|world war 3|Europe|European|news|Europe news|USA news|Canada news|Justin Trudeau|NATO|Moscow|kyiv|Donbas|Mariupol|7ummit|7ummit magazine|attack|Zelenskyy|Putin|Vladimir putin|Kremlin|Nancy Pelosi|Pelosi|American|baby|WEF|China|Beijing|NATO forces|US Army|Monkeypox|shortages|food shortages|scotus|baby formula|inflation|world economic forum davos|Davos,2023-11-29 12:26:18.834864,2,2022-05-25,2022-05-26 03:14:07
Jerry Shannon,UCGyEFv0UcVwPkNUOoZJs0EQ,1653519020.0,Gun Reform in America following Uvalde Shooting,Gabriela Diaz with Moms Demand Action and Maj Touré with Black Guns Matter discuss gun reform following the mass shooting in Uvalde.,25,714,9,29,,https://i.ytimg.com/vi/2BxJW2GnotI/hqdefault.jpg,,2023-11-29 12:26:18.834864,2,2022-05-25,2022-05-25 22:50:20
Jussmonty tha1,UCzBPnL_4E9Am01KHcVnxZQQ,1653528506.0,Uvalde shooter killed by police on body cam ..😳😳👀💥💥#uvaldetexas,#massshootings #trending #uvaldatexas #2022news #explore #cbsnews #live #news #texas #youtube #massshooter #uvalda  #worldnewstonight #uvaldamassshooting,24,679,2,7,,https://i.ytimg.com/vi/MK-AmHGgpkE/hqdefault.jpg,Uvalde|Uvalde Texas|Texas|Mass shooting texas 2022|Mass shooter|Trending|Explore|Million views|Jussmonty tv|Subscribe|Uvalde shooting video|Viral videos 2022|Tragedy 2022,2023-11-29 12:26:18.834864,2,2022-05-25,2022-05-26 01:28:26
KIII 3 News,UCPjgzQgWuPsrYDSuP_CENOw,1653537997.0,Stories of survival come from Uvalde shooting,One student and his mother share his story of what he witnessed,25,439,2,5,,https://i.ytimg.com/vi/fTwKCp2LBbM/hqdefault.jpg,home|local|news,2023-11-29 12:26:18.834864,2,2022-05-25,2022-05-26 04:06:37
🤎 Clone Tatiana 🤎,UCMQpkSN7Ap893wTCOW382dQ,1653505535.0,Blame AMERICA! Uvalde Shooting!,,22,432,1,28,,https://i.ytimg.com/vi/fLq2xElu8xY/hqdefault.jpg,,2023-11-29 12:26:18.834864,2,2022-05-25,2022-05-25 19:05:35
The Wrants Show,UC67j5A9ErgsTOP8fpxeZ3Wg,1653481924.0,Uvalde Shooting: Latest News & Thoughts,"An 18-year-old gunman opened fire Tuesday at a Texas elementary school, killing at least 19 children as he went from classroom to classroom, officials said, in the deadliest school shooting in nearly a decade and the latest gruesome moment for a country scarred by a string of massacres. The attacker was killed by law enforcement.

The death toll also included two adults, authorities said. Gov. Greg Abbott said one of the two was a teacher.


https://TheWrants.com

Follow The Wrants Show
Twitter: https://Twitter.com/TheWrants
TikTok: https://www.tiktok.com/@thewrants
Instagram: https://Instagram.com/TheWrantsShow 
YouTube: https://youtube.com/channel/UC67j5A9ErgsTOP8fpxeZ3Wg",25,411,9,21,,https://i.ytimg.com/vi/atKoVRqQY70/hqdefault.jpg,Uvalde|School shooting|Sandy hook|Uvalde Texas|Robb elementary|Ramos|Listen|Latest news|Breaking news,2023-11-29 12:26:18.834864,2,2022-05-25,2022-05-25 12:32:04
JC Dom_Bai,UCQ5cp7yZdQsC-zyFFmMigsA,1653552991.0,Always in our heart #uvalde #Uvalde #TX #Texas #tragedy #scary #sad #shooting #school,,22,285,1,12,,https://i.ytimg.com/vi/rknfZiD1KNk/hqdefault.jpg,,2023-11-29 12:26:18.834864,2,2022-05-25,2022-05-26 08:16:31
act.tv,UC7yoXZ7c8ZZAimgcqHBtHoQ,1653523958.0,The Benjamin Dixon Show: The Uvalde Shooting,"Ben Dixon talks about mass hooting at Robb elementary School in Texas and our insane gun worship.
——— 
act.tv is a progressive media company specializing in next generation live streaming and digital strategy. Our YouTube channel focuses on interviews with noted progressive voices, animated explainers, livestreams from protests around the country, and original political commentary.
Main site: http://act.tv 
Facebook: http://facebook.com/actdottv 
Twitter: http://www.twitter.com/actdottv 
Instagram: http://www.instagram.com/actdottv
YouTube: https://www.youtube.com/actdottv
Twitch: https://www.twitch.tv/actdottv
@act.tv
#DoMoreThanWatch",25,274,1,29,,https://i.ytimg.com/vi/wzWNlV_uF0E/hqdefault.jpg,act.tv|progressive|media|company|activist|activism|lefty|politics|The Uvalde Shooting|texas|school shooting|mass shooting|robb elementary|gun control|gun safety|nra,2023-11-29 12:26:18.834864,2,2022-05-25,2022-05-26 00:12:38
P.I.M. Reacts,UCw8H9zzSsejfsHiblTP9G1A,1653540602.0,PIM Reacts to the Uvalde Shooting in Texas,"This a different type of video gang. Giving my thoughts and prayers to those who lost their lives during this horrific incident. 

https://www.youtube.com/watch?v=xrtBtl8BVAU&t=186s",22,180,2,7,,https://i.ytimg.com/vi/aKv5BHXIZH4/hqdefault.jpg,,2023-11-29 12:26:18.834864,2,2022-05-25,2022-05-26 04:50:02
