channel_title,channel_id,video_publish_date,video_title,video_description,video_category,video_view_count,video_comment_count,video_like_count,video_dislike_count,video_thumbnail,video_tags,collection_date,day,day_published,publish_date
Scripps News,UCTln5ss6h6L_xNfMeujfPbg,1653461520.0,"Eyewitness Says He Knew Suspect In Uvalde, TX School Shooting, Saw What Happened Moments Before","UPDATE: Authorities say the victim death toll from the Texas school shooting now stands at 19 children and two adults.

PREVIOUS: Newsy's JohnMone is on the ground in Uvalde, TX and spoke to an eyewitness who says he knew the shooter, the shooter's grandmother, and saw what happened in the moments before the shooter entered the school. #texas #schoolshooting #newsy 
-------------------------------------

Newsy is your source for news and analysis covering the top stories from around the world. With persistent curiosity and no agenda, we strive to fuel meaningful conversations by highlighting multiple sides of every story. It’s news with the why.

Join our newsletter at http://bit.ly/2q1tepr
See more at http://www.newsy.com/
Like Newsy on Facebook: http://www.facebook.com/newsy/
Follow us on Twitter: http://www.twitter.com/newsy",25,3158207,11914,20480,,https://i.ytimg.com/vi/eejjbgbMOc8/hqdefault.jpg,Newsy|fact-based journalism|facts|news|breaking news|unbiased|no agenda news|top story|what really happened|unbiased news|unbiased news on youtube|fair news|fact based|news today|unbiased reporting,2023-11-29 12:26:18.618179,1,2022-05-24,2022-05-25 06:52:00
Bleacher Report,UC9-OpMMVoNP5o10_Iyq7Ndw,1653455596.0,Steve Kerr Delivers Powerful Message After Mass Shooting At Elementary School,"Steve Kerr spoke on the mass shooting at Robb Elementary School in Uvalde, Texas

Subscribe: https://www.youtube.com/user/BleacherReport?sub_confirmation=1
Follow on IG: http://www.instagram.com/f/bleacherreport
Follow us on Twitter: http://www.twitter.com/bleacherreport
Like us on Facebook: http://www.facebook.com/bleacherreport",17,2987990,15695,95133,,https://i.ytimg.com/vi/Q5x4eHn_3tA/hqdefault.jpg,bleacher report|br|nba|steve kerr|steve kerr warriors|steve kerr interview,2023-11-29 12:26:18.618179,1,2022-05-24,2022-05-25 05:13:16
House of Highlights,UCqQo7ewe87aYAe7ub5UqXMw,1653456290.0,Inside the NBA talk about Tragic Shooting in Texas,"📌 SHOP OUR MERCH: https://hoh.world
📌 Follow our Instagram: https://www.instagram.com/houseofhighlights
📌 Follow our TikTok: https://www.tiktok.com/@houseofhighlights
📌 Follow our Facebook: https://www.facebook.com/houseofhighlights

#HouseofHighlights #NBA #HoH",17,1878300,8371,33942,,https://i.ytimg.com/vi/diLv4LFeO2s/hqdefault.jpg,,2023-11-29 12:26:18.618179,1,2022-05-24,2022-05-25 05:24:50
ABC7,UCVxBA3Cbu3pm8w8gEIoMEog,1653450301.0,Uvalde Texas: School shooting suspect shot and wounded grandmother before entering campus: Officials,"UPDATE: Officials initially said the suspect's mother was killed. Authorities later confirmed she survived after being shot.

Fourteen students and a teacher are dead after a shooting at Robb Elementary School in Uvalde, Texas, on Tuesday, according to Gov. Greg Abbott. The 18-year-old suspect, a student at Uvalde High School, is also dead, he said. MORE: https://abc7.com/uvalde-texas-robb-elementary-school-active-shooter-district-lockdown/11889693/",25,1849549,11276,13648,,https://i.ytimg.com/vi/Rs2acoRRqlg/hqdefault.jpg,news|texas|mass shooting|elementary school|shooting|grandma|robb|greg abbott|uvalde,2023-11-29 12:26:18.618179,1,2022-05-24,2022-05-25 03:45:01
WFAA,UCBu0KdNokE4MqdkacvH37_A,1653448129.0,"19 students and 2 adults are dead after a school shooting in Uvalde, Texas","UPDATE: At least 20 people, including 19 children, were killed in a shooting at Robb Elementary in Uvalde, according to law enforcement officials. Several others, both students and adults, are being treated for injuries.

The alleged shooter was also killed, local police confirmed. It is believed that the shooter acted alone. He has been identified as 18-year-old Salvador Ramos. Department of Public Safety officials have told KENS 5 that there are two adult fatalities, a teacher and the gunman. However, Sen. Roland Gutierrez told the Associated Press there are a total of three adult fatalities.  

MORE: https://www.wfaa.com/article/news/local/texas-active-shooter-reported-robb-elementary-uvalde-police/273-cbf0d9be-d042-4557-a360-e2a3ad944a10

FULL UVALDE COVERAGE: https://www.wfaa.com/uvalde",25,1673281,8571,14337,,https://i.ytimg.com/vi/paFHkrkhmzA/hqdefault.jpg,school shooting|greg abbott|14 kids|uvalde texas|gov abbott|texas school shootings|texas mass shooting|school shootings|texas shooting|texas school shooting|shooting in texas|uvalde active shooter|uvalde shooting|elementary school shooting texas|texas elementary school shooting|elementary school shooting|uvalde tx|robb elementary school|robb elementary school texas|uvalde school shooting|Salvador ramos,2023-11-29 12:26:18.618179,1,2022-05-24,2022-05-25 03:08:49
WFAA,UCBu0KdNokE4MqdkacvH37_A,1653466750.0,"At least 21 dead after Uvalde school shooting, officials confirm","At least 21 people, including 19 children, were killed in a shooting at Robb Elementary in Uvalde.

The 18-year-old gunman who slaughtered 19 children and two teachers at a Texas elementary school barricaded himself inside a single classroom and “began shooting anyone that was in his way,” authorities said Wednesday in detailing the latest mass killing to rock the U.S.

Law enforcement officers eventually broke into the classroom and killed the gunman. Police and others responding to Tuesday’s attack also went around breaking windows at the school to enable students and teachers to escape, Lt. Christopher Olivarez of the Texas Department of Public Safety said Wednesday on NBC’s “Today.”

Olivarez told CNN that all the victims were in the same fourth-grade classroom at Robb Elementary.

The killer ""barricaded himself by locking the door and just started shooting children and teachers that were inside that classroom,” he said. ""It just shows you the complete evil of the shooter.”

MORE:  https://www.wfaa.com/article/news/nation-world/texas-school-shooting-uvalde-what-we-know/507-1ef528ec-3309-435f-a9dc-7563cf28d688

FULL UVALDE COVERAGE: https://www.wfaa.com/uvalde",25,841830,3917,9463,,https://i.ytimg.com/vi/pluQ4CNY684/hqdefault.jpg,school shooting|uvalde high school|school shooter|texas shooting|uvalde texas|14 kids|elementary school shooting|elementary school shooting texas|gov abbott|greg abbott|robb elementary school|robb elementary school texas|salvador ramos|school shootings|shooting in texas|texas elementary school shooting|texas mass shooting|texas school shooting|texas school shootings|uvalde active shooter|uvalde school shooting|uvalde shooting|uvalde tx,2023-11-29 12:26:18.618179,1,2022-05-24,2022-05-25 08:19:10
LiveNOW from FOX,UCJg9wBPyKMNA5sRDnvzmkdg,1653469295.0,Uvalde school shooting: New details on suspect | LiveNOW from FOX,"A shooting at an elementary school in Uvalde, Texas left 19 children and two adults dead on Tuesday. Governor Greg Abbott later said authorities killed the 18-year-old lone gunman. The suspect, identified by Abbott as Salvador Ramos, entered Robb Elementary School after abandoning his vehicle with a handgun and possibly a rifle. Authorities add that many of the victims were in the second through fourth grades.

Subscribe to LiveNOW from FOX! https://www.youtube.com/livenowfox?sub_confirmation=1
Where to watch LiveNOW from FOX: https://www.livenowfox.com/
Follow us @LiveNOWFOX on Twitter: https://twitter.com/livenowfox

Raw and unfiltered. Watch a non-stop stream of breaking news, live events and stories across the nation. Limited commentary. No opinion. Experience LiveNOW from FOX.",25,837649,4069,5081,,https://i.ytimg.com/vi/GWcRslaqf38/hqdefault.jpg,livenow-from-fox|news|uvalde shooting|school shooting|texas shooting|salvador ramos|abbott|guns|shooting,2023-11-29 12:26:18.618179,1,2022-05-24,2022-05-25 09:01:35
Golden State Warriors,UCeYc_OjHs3QNxIjti2whKzg,1653453846.0,"Steve Kerr Comments on the Tragic Shooting in Uvalde, Texas","Steve Kerr on today's tragic shooting in Uvalde, Texas.",17,793573,4690,28430,,https://i.ytimg.com/vi/vPvf5RgCU08/hqdefault.jpg,Golden State Warriors|Golden State|Warriors|GSW|Dubs|DubNation|Dub Nation,2023-11-29 12:26:18.618179,1,2022-05-24,2022-05-25 04:44:06
KENS 5: Your San Antonio News Source,UCVnjt9mMx46gMUeTtONXimQ,1653460174.0,"Uvalde School Shooting: 18 kids, three adults killed",WATCH: We are on the scene at Robb Elementary following reports of an active shooter situation Tuesday afternoon.,24,429656,529,3133,,https://i.ytimg.com/vi/jjXklN8HKfw/hqdefault.jpg,,2023-11-29 12:26:18.618179,1,2022-05-24,2022-05-25 06:29:34
Denver7,UC-2MJlKSq9_pYk5-bdvMhnw,1653459248.0,President Biden addresses nation after Uvalde shooting,"President Joe Biden addressed the nation after at least 20 people were killed by a gunman in Uvalde, Texas, including 18 children. He said it was time to actually pass measures to address the rampant gun violence in the U.S.",25,282399,5405,2354,,https://i.ytimg.com/vi/d5Qu87qjXT8/hqdefault.jpg,20 dead uvalde texas shooting|president joe biden|texas shooting|uvalde shooting,2023-11-29 12:26:18.618179,1,2022-05-24,2022-05-25 06:14:08
Senator Chris Murphy,UCbcEa40PIFpLpdDe06n3F3Q,1653446021.0,Senator Murphy Responds To The Shooting At Robb Elementary School in Uvalde Texas,,25,159223,2374,4973,,https://i.ytimg.com/vi/L4OauUiHRsU/hqdefault.jpg,,2023-11-29 12:26:18.618179,1,2022-05-24,2022-05-25 02:33:41
NewsNation,UCCjG8NtOig0USdrT5D1FpxQ,1653461988.0,"Police: Uvalde shooter wore body armor, fired at police on scene","Lt. Christopher Olivarez gives details of what happened when local police met the 18-year-old shooter on the scene of the mass shooting. 

He says police were shot and hurt upon pursuit and that Ramos was wearing body armor. 

#UvaldeTexas #Uvalde #Texas #RobbElementary #SalvadorRamos #massshooting #TexasSchoolShooting #TexasMassShooting #ElementarySchoolShooting #RobbElementaryShooting 

Watch NewsNation for unbiased national and international news. Get the latest news 24/7 at newsnationnow.com.

NewsNation is your source for fact-based, unbiased news for all America. 

Find us online: https://www.newsnationnow.com/
Get our app: https://bit.ly/3AbFrG3
Watch us on TV or via streaming: https://bit.ly/3oxRmf5",25,155908,1090,1653,,https://i.ytimg.com/vi/7OfgDO9POOw/hqdefault.jpg,video|Prime|news|WatchNewsNationPrime|Uvalde|Uvalde Texas|Texas|Robb Elementary|Salvador Ramos,2023-11-29 12:26:18.618179,1,2022-05-24,2022-05-25 06:59:48
News 19 WLTX,UCVaXclURQZlakiTMzuwHvRw,1653443737.0,"School shooting in Uvalde, Texas: raw video","A shooting on the campus of Robb Elementary in Uvalde, Texas has left 14 students and one teacher dead. Texas Governor Greg Abbott confirmed the news.
Follow us on Twitter: @WLTX
Follow us on Facebook: @WLTXNews19
Check out our website: WLTX.com",25,132665,666,529,,https://i.ytimg.com/vi/Ay-xPhtWyFE/hqdefault.jpg,wltx|news19|trending|viral|latest|newest|columbia|sc|midlands|news|weather|sports|scsouthcarolina19,2023-11-29 12:26:18.618179,1,2022-05-24,2022-05-25 01:55:37
ESPN,UCiWLfSweyRNmLpgEHekhoAg,1653455039.0,"Steve Kerr spoke about the mass shooting at a school in Uvalde, Texas.","✔️Subscribe to ESPN+ http://espnplus.com/youtube
✔️ Get the ESPN App: http://www.espn.com/espn/apps/espn
✔️Subscribe to ESPN on YouTube: http://es.pn/SUBSCRIBEtoYOUTUBE
✔️ Subscribe to NBA on ESPN on YouTube: http://bit.ly/SUBSCRIBEtoNBAonESPN
✔️ Watch ESPN on YouTube TV: http://es.pn/YouTubeTV",17,122481,1214,4237,,https://i.ytimg.com/vi/T4k-qkJMyWU/hqdefault.jpg,espn|viral|sports|sports news,2023-11-29 12:26:18.618179,1,2022-05-24,2022-05-25 05:03:59
WFAA,UCBu0KdNokE4MqdkacvH37_A,1653459374.0,"After Uvalde shooting, Golden State Warriors coach Steve Kerr blasts politicians for lack of action","Before Game 4 of the NBA Western Conference Finals, Kerr delivered an impassioned plea, calling for change: ""When are we going to do something?""",25,111969,623,2942,,https://i.ytimg.com/vi/kHP98QVtQKE/hqdefault.jpg,nation-world|nba|news|politics|sports,2023-11-29 12:26:18.618179,1,2022-05-24,2022-05-25 06:16:14
WFAA,UCBu0KdNokE4MqdkacvH37_A,1653467309.0,"What we know about the Uvalde, Texas, school shooting so far","At least 21 people, including 19 children, were shot and killed at an elementary school in Uvalde, Texas, on Tuesday.  

The 18-year-old gunman who slaughtered 19 children and two teachers at a Texas elementary school barricaded himself inside a single classroom and “began shooting anyone that was in his way,” authorities said Wednesday in detailing the latest mass killing to rock the U.S. 

MORE: https://www.wfaa.com/article/news/nation-world/texas-school-shooting-uvalde-what-we-know/507-1ef528ec-3309-435f-a9dc-7563cf28d688",25,99914,315,686,,https://i.ytimg.com/vi/1J8sNrHOJoQ/hqdefault.jpg,14 kids|19 kids|uvalde tx|21 killed|elementary school shooting|elementary school shooting texas|gov abbott|greg abbott|robb elementary school|robb elementary school texas|salvador ramos|school shooting|school shootings|shooting in texas|texas elementary school shooting|texas mass shooting|texas school shooting|texas school shootings|texas shooting|uvalde active shooter|uvalde school shooting|uvalde shooting|uvalde texas,2023-11-29 12:26:18.618179,1,2022-05-24,2022-05-25 08:28:29
KSAT 12,UCETE4rKzRRjqM0JaB7TlPpQ,1653457924.0,UVALDE MASS SHOOTING INVESTIGATION- LIVE COVERAGE FROM KSAT12,"LIVE COVERAGE- Active shooter of Uvalde elementary school now in custody- at least 2 children are reported dead 

https://www.ksat.com/news/local/2022/05/24/active-shooter-reported-at-uvalde-elementary-school-district-says/

*WARNING THIS IS A LIVE FEED OF AN ACTIVE SITUATION AND MAY NOT BE SUITABLE FOR ALL AUDIENCES**",25,72801,61,502,,https://i.ytimg.com/vi/jc3F8PBSULI/hqdefault.jpg,,2023-11-29 12:26:18.618179,1,2022-05-24,2022-05-25 05:52:04
FOX 5 Atlanta,UCjHWv2DU5-HLpogAAr386DQ,1653458807.0,"Uvalde, Texas elementary school shooting: President Joe Biden delivers remarks","President Joe Biden addresses the nation about the Uvalde, Texas school shooting.  Biden's heartfelt speech discusses the feeling of losing a child and asks the nation to pray for the parents and families that are hurting.

Subscribe to FOX 5 Atlanta!: https://bit.ly/3vpFpcm

Watch FOX 5 Atlanta Live: https://www.fox5atlanta.com/live

FOX 5 Atlanta delivers breaking news, live events, investigations, politics, entertainment, business news and local stories from metro Atlanta, north Georgia and across the nation.

Watch more from FOX 5 Atlanta on YouTube:
FOX 5 News: https://www.youtube.com/playlist?list=PLUgtVJuOxfqkmrF1fONNmi8nKI0Z-FPE-
FOX 5 Atlanta I-Team: https://www.youtube.com/playlist?list=PLUgtVJuOxfqlb_I16wBwizoAoUsfKEeWB
Good Day Atlanta: https://www.youtube.com/playlist?list=PLUgtVJuOxfqlKT5xsbsPFgr5EBzdsWTvG
FOX 5 Extras: https://www.youtube.com/playlist?list=PLUgtVJuOxfqli-5MS_2X-i6bNGWvV0RYP
You Decide: https://www.youtube.com/playlist?list=PLUgtVJuOxfqnCKb7UkRde2NXuaoPEAXut

Download the FOX 5 Atlanta app: https://www.fox5atlanta.com/app

Download the FOX 5 Storm Team app: https://www.fox5atlanta.com/storm

Follow FOX 5 Atlanta on Facebook: https://facebook.com/fox5atlanta

Follow FOX 5 Atlanta on Twitter: https://twitter.com/FOX5Atlanta

Follow FOX 5 Atlanta on Instagram: https://www.instagram.com/fox5atlanta/

Subscribe to the Morning Brief and other newsletters from FOX 5 Atlanta: https://www.fox5atlanta.com/email",25,28790,755,298,,https://i.ytimg.com/vi/8EPR47HW3M4/hqdefault.jpg,uvalde-texas|school-shooting|mass-shooting|children|president-joe-biden|biden|elementary|tragedy|gun-violence,2023-11-29 12:26:18.618179,1,2022-05-24,2022-05-25 06:06:47
MeidasTouch,UC9r9HYFxEQOBXSopFS61ZWg,1653451825.0,Top Democrat delivers EMOTIONAL speech in response to Uvalde Shooting,"In the wake of the horrific shooting at an elementary school in Uvalde, Texas, Sen. Chris Murphy delivered an impassioned speech about gun violence pleading his colleagues to take action. Francis Maxwell discusses.
 
Donate to MeidasTouch: https://secure.actblue.com/donate/meidastouch
Buy MeidasTouch Merch: https://store.meidastouch.com

Follow MeidasTouch on Twitter: https://twitter.com/meidastouch
Follow MeidasTouch on Facebook: https://facebook.com/meidastouch
Follow MeidasTouch on Instagram: https://instagram.com/meidastouch",25,13362,503,1381,,https://i.ytimg.com/vi/Bmuy9zD5Uqo/hqdefault.jpg,meidastouch|meidas touch|politics|political videos|political advertising|uvalde|texas|uvalde texas|school shooting|emotional speech|chris murphy|senator|democratic senator|democrat|democrats|republicans|gun control|mass shooting|school|elementary school|what are we doing|gop|nra|senate|us senate|united states senate,2023-11-29 12:26:18.618179,1,2022-05-24,2022-05-25 04:10:25
USA TODAY,UCP6HGa63sBC7-KHtkme-p-g,1653453150.0,Uvalde shooting: Sen. Chris Murphy pleads for action on Senate floor | USA TODAY,"Speaking on the Senate floor, Sen. Chris Murphy asks colleagues ""why are you here,"" imploring the chamber to come up with solutions to mass shootings.

RELATED: 14 children, one teacher killed in Texas elementary school mass shooting https://bit.ly/3af7exT

A gunman killed 19 children at a Texas elementary school Tuesday in the deadliest shooting at a U.S. grade school since the 2012 attack at Sandy Hook Elementary School in Newtown, Connecticut.

Wearing body armor and firing hundreds of rounds, the 18-year-old gunman killed 19 children and two adults, Texas Department of Public Safety Lt. Chris Olivarez said.  Gov. Greg Abbott said one of the two was a teacher. A U.S. Border Protection agent, one of several responding to the scene, shot and killed the gunman, a senior Department of Homeland Security official told USA TODAY on Tuesday night.

» Subscribe to USA TODAY: http://bit.ly/1xa3XAh
» Watch more on this and other topics from USA TODAY: https://bit.ly/3MQhPxJ
» USA TODAY delivers current local and national news, sports, entertainment,  finance, technology, and more through award-winning journalism, photos, videos and VR.

#Texas #MassShooting #UvaldeShooting",25,10438,231,233,,https://i.ytimg.com/vi/Awxg8C3mYwo/hqdefault.jpg,usa today|usa today news|Uvalde|Uvalde shooting|Uvalde mass shooting|Chris Murphy|sen. chris murphy|Connecticut|mass shooting|Texas shooting|Texas mass shooting|Sany Hook shooting|chris murphy senator|chris murphy texas|chris murphy uvalde|texas elementary school shooting|texas elementary shooting|Mass shooting texas|Mass shooting Uvalde|texas elementary shooting suspect|texas mass shooting today|texas mass shooting 2022|uvalde texas|us shooting,2023-11-29 12:26:18.618179,1,2022-05-24,2022-05-25 04:32:30
PoliticsGirl,UC0VTA6PQH7nKKgRO8ptMatQ,1653461767.0,Uvalde Shooting,Reposting because I don’t know what else to say. This isn’t freedom America. This is a nightmare. #Texas,22,8426,199,1181,,https://i.ytimg.com/vi/Jb-JMshrKHk/hqdefault.jpg,,2023-11-29 12:26:18.618179,1,2022-05-24,2022-05-25 06:56:07
NewsNation,UCCjG8NtOig0USdrT5D1FpxQ,1653469015.0,Uvalde shooting: What are investigators looking for? | NewsNation Special Coverage,"NewsNation security correspondent Phil Andrew says even though the suspected shooter is dead, investigators at Robb Elementary School have a lot to process.

#uvalde #texas #robbelementary

Read more: https://www.newsnationnow.com/us-news/southwest/active-shooter-reported-at-texas-elementary-school/

NewsNation is your source for fact-based, unbiased news for all America. 

Find us online: https://www.newsnationnow.com/
Get our app: https://bit.ly/3AbFrG3
Watch us on TV or via streaming: https://bit.ly/3oxRmf5",25,5893,48,96,,https://i.ytimg.com/vi/oPG7vhDsvzk/hqdefault.jpg,video|Prime|news|WatchNewsNationPrime|uvalde|texas|school shooting|robb|elementary|children|mass shooting,2023-11-29 12:26:18.624246,1,2022-05-24,2022-05-25 08:56:55
Matthew Chapman,UCR-YSMVJU45jgAoqndj7MoA,1653457314.0,Anderson Cooper breaks down discussing Uvalde shooting with Sandy Hook parent,,22,3961,8,38,,https://i.ytimg.com/vi/9W4g9GynpiU/hqdefault.jpg,,2023-11-29 12:26:18.624246,1,2022-05-24,2022-05-25 05:41:54
BB Hoop Nation,UCycBe5hgeD2eykyHK_8vhag,1653462690.0,Steve Kerr gives a very heated speech about the Uvalde shooting then storms out #shorts #basketball,,17,2298,8,67,,https://i.ytimg.com/vi/-dtHki0b4ng/hqdefault.jpg,,2023-11-29 12:26:18.624246,1,2022-05-24,2022-05-25 07:11:30
Austin American-Statesman,UCf0aMG-_d_ol_7BEllE3kRw,1653461990.0,"Steve Kerr speaks on Uvalde shooting, recent gun violence before Warriors vs. Mavericks NBA game","Before Game 4 of the Western Conference Finals, Golden State Warriors head coach Steve Kerr spoke out during a press conference against multiple recent shootings that took that lives of people at church in Laguna Woods, California, a grocery store in Buffalo, New York, and a school in Uvalde, Texas.",24,1578,8,43,,https://i.ytimg.com/vi/ASAlQFT7MUY/hqdefault.jpg,austin|texas|news|texas news|local journalism|journalism|newspaper,2023-11-29 12:26:18.624246,1,2022-05-24,2022-05-25 06:59:50
aefproductions,UCDRJU-5iB74cpxBE5vtZEPA,1653460406.0,Steve Kerr Reaction To The Uvalde Elementary School Shooting￼!,,24,1407,7,86,,https://i.ytimg.com/vi/Bj7qJiG5zEU/hqdefault.jpg,,2023-11-29 12:26:18.624246,1,2022-05-24,2022-05-25 06:33:26
KVUE,UCxXTyFekH99JnS3qaXIQW7A,1653466867.0,How to help following the Uvalde school shooting | KVUE,"So many people in Central Texas are searching for ways to turn feelings of helplessness into action. Here's how you can help from Central Texas.

Full story: https://www.kvue.com/article/news/local/heres-how-austinites-can-help-uvalde-families-after-mass-shooting/269-3fe17fdd-b4a5-408f-9cca-dc68456d8545

Subscribe to our channel: https://www.youtube.com/c/kvuetv?sub_confirmation=1

KVUE is Austin's ABC affiliate station and has been delivering local news for Central Texans since 1971. Today it is owned by TEGNA, Inc., which reaches approximately one-third of all television households in America. http://www.kvue.com",25,1143,2,9,,https://i.ytimg.com/vi/wLviNDzaSdI/hqdefault.jpg,austin|kvue|robb elementary|uvalde|uvalde shooting,2023-11-29 12:26:18.624246,1,2022-05-24,2022-05-25 08:21:07
KXAN,UCgBVz3EzHYKpPS0BITvLRsg,1653455163.0,"Remainder of school year canceled after deadly Uvalde shooting, leaders say","School leaders from Uvalde held a news conference on March 24, 2022, where they shared the remainder of the school year is canceled due to the deadly shooting that happened at an elementary school.

Stay informed about Austin and Central Texas news, weather, investigations and sports on our website and social media:

https://www.kxan.com/
https://www.youtube.com/c/KXANAustinNews?sub_confirmation=1
https://www.facebook.com/KXANnews/
https://twitter.com/KXAN_News
https://www.instagram.com/kxan_news",25,1010,6,6,,https://i.ytimg.com/vi/6SFEXuV9_FE/hqdefault.jpg,kxanaustin|kxanaustinnews|KXAN_News|uvalde|texas|shooting|school,2023-11-29 12:26:18.624246,1,2022-05-24,2022-05-25 05:06:03
Get to the Point,UCWeT2mHXt0xWdEgwPesi3mQ,1653469534.0,"#SteveKerr speaks following the #mass #shooting at #RobbElementarySchool in #Uvalde, #Texas. (2/3)","#SteveKerr speaks following the #mass #shooting at #RobbElementarySchool in #Uvalde, #Texas. (2/3)



🌟Don’t forget to Like, Subscribe, Comment & Share 

🌟TO DONATE TO Get to the Point:
PayPal: gettothepoint28
Cash App: gettothepoint28
Venmo: gettothepoint28 

🌟Business Inquiries email: gettothepoint28@gmail.com

🌟TikTok: www.tiktok.com/gettothepoint28 
🌟Instagram: gettothepoint28  
🌟Twitter: gettothepoint28



🌟We are on the road to 1,000 subscribers so please like, subscribe, comment & share. #like #subscribe #comment #share #YouTube #roadto1k #1k #1ksub #1ksubscribe #subscribers 


FAIR USE STATEMENT
This video is under Fair Use: Copyright Disclaimer Under Section 107 of the Copyright Act in 1976; Allowance is made for “Fair Use"" for purposes such as criticism, comment, news reporting, teaching, scholarship, and research. Fair use is a use permitted by copyright statute that might otherwise be infringing. Non-profit, educational or personal use tips the balance in favor of fair use. All rights and credit go directly to its rightful owners. No copyright infringement intended.",22,72,1,3,,https://i.ytimg.com/vi/DX3_JN0k9vs/hqdefault.jpg,Steve Kerr|Mass Shooting|Robb Elementary School|Uvalde|Texas|Suspect|Gunman|Children|Kids|Grades 2-4|Students|Teacher,2023-11-29 12:26:18.624246,1,2022-05-24,2022-05-25 09:05:34
Inside Edition,UC9k-yiEpRHMNVOnOi_aQK8w,1653538043.0,18-Year-Old School Shooter Dropped Hints on Social Media,"Eighteen-year-old Salvador Ramos, who was responsible for shooting and killing nearly two dozen people at Robb Elementary School in Uvalde, Texas, posted messages on social media hinting about his plans. One post read “Wait Till Tomorrow,” and “Kids Be Scared,” along with photos of two assault rifles and a high-capacity magazine. The morning of the shooting, he sent a text to someone he knew, asking, “You gonna repost my gun pics?”",25,5530753,15605,112854,,https://i.ytimg.com/vi/pv1NxIoLP0k/hqdefault.jpg,Texas|crime|school shooting|Inside edition|inside_edition|ie newsdesk|texas|uvalde|mass shooting|gun violence|elementary school children|robb elementary|active shooter|social media|bullied teen|salvador ramos|school shooter|assault rifles|gun|teen shooter,2023-11-29 12:26:18.624246,2,2022-05-25,2022-05-26 04:07:23
