id,type_of_violence,conflict_new_id,conflict_name,dyad_new_id,side_a_new_id,side_a,side_b_new_id,side_b,country_id,country,region,source_article,year,date_start,date_end,deaths_a,deaths_b,civilian_deaths,unknown,best,high,low,latitude,longitude,electoral_vio,electoral_vio_uncertainty,electoral_vio_source,electoral_purpose,electoral_side_a,electoral_side_a_2,electoral_side_a_inc,electoral_side_b,electoral_side_b_2,electoral_side_b_inc,electoral_perpetrator,electoral_targets,electoral_type,electoral_timing,relid,ucdp_ged,Afghanistan,Albania,Algeria,Angola,Bangladesh,Benin,Bolivia,Brazil,Burundi,Cambodia (Kampuchea),Central African Republic,Colombia,Congo,DR Congo (Zaire),Djibouti,Dominican Republic,Ecuador,Egypt,El Salvador,Ethiopia,Fiji,Gambia,Georgia,Ghana,Guatemala,Guinea,Guinea-Bissau,Haiti,Honduras,India,Indonesia,Iran,Iraq,Israel,Italy,Ivory Coast,Jamaica,Kenya,Kosovo,Kyrgyzstan,Lebanon,Lesotho,Libya,Madagascar (Malagasy),Malawi,Malaysia,Mali,Mauritania,Mexico,Moldova,Mozambique,Myanmar (Burma),Namibia,Nepal,Nicaragua,Nigeria,Pakistan,Papua New Guinea,Peru,Philippines,Russia (Soviet Union),Senegal,Serbia (Yugoslavia),Sierra Leone,Somalia,South Africa,Spain,Sri Lanka,Sudan,Tanzania,Thailand,Tunisia,Turkey,Uganda,Ukraine,United Kingdom,Venezuela,Yemen (North Yemen),Zambia,Zimbabwe (Rhodesia),Africa,Americas,Asia,Europe,Middle East,electoral_vio_uncertainty_0,electoral_vio_uncertainty_1,electoral_vio_uncertainty_2,type_of_violence_1,type_of_violence_2,type_of_violence_3,type_of_violence_4,electoral_perpetrator_1,electoral_perpetrator_2,electoral_perpetrator_3,electoral_perpetrator_4,side_a_Civilians,side_a_ExternActors,side_a_Militia,side_a_Other,side_a_PoliticalSupporters,side_a_Politicians,Public officials,side_a_RebelGroup,side_a_SecurityForces,side_a_Unclear,side_b_Civilians,side_b_Militia,side_b_Other,side_b_PoliticalSupporters,side_b_Politicians,side_b_PublicOfficials,side_b_RebelGroup,side_b_SecurityForces,side_b_Unclear,electoral_purpose_disrupt,electoral_purpose_divergent affiliations,electoral_purpose_crack down on protest and/or riot,electoral_purpose_protect results,electoral_purpose_unclear,electoral_purpose_spell,electoral_purpose_eliminate opponent,electoral_purpose_retaliate violent acts,electoral_purpose_overturn results,electoral_purpose_secure elections,electoral_purpose_preemptive violence,electoral_purpose_prevent from voting,electoral_purpose_shape results,electoral_purpose_retaliate for voting for other candidate,electoral_purpose_repress opposition,electoral_purpose_punishment,electoral_purpose_crack down on prostest and/or riot,electoral_purpose_oppose democratic conduct,electoral_purpose_intimidate opponent,electoral_purpose_demand democratic conduct,electoral_purpose_hinder electoral misconduct,electoral_purpose_retaliate for voting for alternative candidate,electoral_purpose_crack down on riot and/or protest,electoral_purpose_retaliate for voting for candidate,electoral_purpose_forcibly displace groups in order to shape results,electoral_purpose_retaliate acts in electoral process,electoral_purpose_prevent electoral misconduct,electoral_purpose_Unknown,electoral_purpose_secure election,electoral_purpose_crackdown on protest and/or riot,electoral_purpose_call for change in electoral process,electoral_purpose_Secure elections,electoral_purpose_intimidate voters,electoral_purpose_crack down on riots and/or protests,electoral_purpose_.,electoral_purpose_crack down on protest and/or riot/retaliate violent events,electoral_purpose_Unclear,electoral_purpose_diverging affiliations,electoral_targets_2,electoral_targets_6,electoral_targets_3,electoral_targets_5,electoral_targets_10,electoral_targets_1,electoral_targets_9,electoral_targets_7,electoral_targets_11,electoral_targets_-99,electoral_targets_8,electoral_targets_4,electoral_type_2,electoral_type_1,electoral_type_3,electoral_type_4,electoral_type_5,"electoral_type_2,3","electoral_type_1,3","electoral_type_1,4",electoral_timing_2,electoral_timing_1,electoral_timing_3,electoral_timing_4,electoral_timing_8,country_new,Country_x,Abbreviation,year_string,country_year,Country_y,Year,Country Abbreviation,GDP (constant 2015 US$),GDP growth (annual %),GDP per capita (constant 2015 US$),Gini index,"Inflation, consumer prices (annual %)",Political Stability and Absence of Violence/Terrorism: Estimate,"Unemployment, total (% of total labor force) (modeled ILO estimate)"
95,1,230,Yemen (North Yemen):Government,10855,123,Government of Yemen (North Yemen),1091,Ansarallah,678,Yemen (North Yemen),Middle East,"Agence France Presse, 2012-02-21, Four killed in south as violence mars Yemen polls",2012,2012-02-21,2012-02-21,0,0,1,0,1,1,1,12.779444,45.036667,1,0,None/Unknown,disrupt,Public officials,,1,Political supporters,,0,2,2,2,2,YEM-2012-1-X2626-4,0,0,0,0,0,0,0,0,0,0,0,0,0,0,0,0,0,0,0,0,0,0,0,0,0,0,0,0,0,0,0,0,0,0,0,0,0,0,0,0,0,0,0,0,0,0,0,0,0,0,0,0,0,0,0,0,0,0,0,0,0,0,0,0,0,0,0,0,0,0,0,0,0,0,0,0,0,0,1,0,0,0,0,0,0,1,1,0,0,1,0,0,0,0,1,0,0,0,0,0,0,0,0,1,0,0,0,0,0,0,1,0,0,0,0,0,1,0,0,0,0,0,0,0,0,0,0,0,0,0,0,0,0,0,0,0,0,0,0,0,0,0,0,0,0,0,0,0,0,0,1,0,0,0,1,0,0,0,0,0,0,0,0,0,0,0,1,0,0,0,0,0,0,0,1,0,0,0,0,Yemen,Yemen,YEM,2012,YEM2012,"Yemen, Rep.",2012,YEM,56340076512.48264,2.3929902027391563,2148.4664783621097,0.0,9.88538714484871,-2.43066310882568,13.425
96,1,230,Yemen (North Yemen):Government,10855,123,Government of Yemen (North Yemen),1091,Ansarallah,678,Yemen (North Yemen),Middle East,"Agence France Presse, 2012-02-21, Four killed in south as violence mars Yemen polls",2012,2012-02-21,2012-02-21,1,0,0,0,1,1,1,12.779444,45.036667,1,0,None/Unknown,disrupt,Security forces,,1,Political supporters,,0,2,6,2,2,YEM-2012-1-X2626-5,0,0,0,0,0,0,0,0,0,0,0,0,0,0,0,0,0,0,0,0,0,0,0,0,0,0,0,0,0,0,0,0,0,0,0,0,0,0,0,0,0,0,0,0,0,0,0,0,0,0,0,0,0,0,0,0,0,0,0,0,0,0,0,0,0,0,0,0,0,0,0,0,0,0,0,0,0,0,1,0,0,0,0,0,0,1,1,0,0,1,0,0,0,0,1,0,0,0,0,0,0,0,0,0,0,1,0,0,0,0,1,0,0,0,0,0,1,0,0,0,0,0,0,0,0,0,0,0,0,0,0,0,0,0,0,0,0,0,0,0,0,0,0,0,0,0,0,0,0,0,1,0,0,0,0,1,0,0,0,0,0,0,0,0,0,0,1,0,0,0,0,0,0,0,1,0,0,0,0,Yemen,Yemen,YEM,2012,YEM2012,"Yemen, Rep.",2012,YEM,56340076512.48264,2.3929902027391563,2148.4664783621097,0.0,9.88538714484871,-2.43066310882568,13.425
175,2,5036,Supporters of General Peoples Congress - Supporters of Islah party,5646,3425,Supporters of General Peoples Congress,2374,Supporters of Islah party,678,Yemen (North Yemen),Middle East,"Reuters 1997-04-21 ""Yemeni man killed in pre-election violence",1997,1997-04-20,1997-04-20,0,0,0,1,1,1,1,13.969184,43.996728,1,0,None/Unknown,divergent affiliations,Political supporters,,1,Political supporters,,1,3,3,1,1,YEM-1997-2-X4857-1,0,0,0,0,0,0,0,0,0,0,0,0,0,0,0,0,0,0,0,0,0,0,0,0,0,0,0,0,0,0,0,0,0,0,0,0,0,0,0,0,0,0,0,0,0,0,0,0,0,0,0,0,0,0,0,0,0,0,0,0,0,0,0,0,0,0,0,0,0,0,0,0,0,0,0,0,0,0,1,0,0,0,0,0,0,1,1,0,0,0,1,0,0,0,0,1,0,0,0,0,0,1,0,0,0,0,0,0,0,0,1,0,0,0,0,0,0,1,0,0,0,0,0,0,0,0,0,0,0,0,0,0,0,0,0,0,0,0,0,0,0,0,0,0,0,0,0,0,0,0,1,0,0,0,0,0,1,0,0,0,0,0,0,0,0,0,0,1,0,0,0,0,0,0,0,1,0,0,0,Yemen,Yemen,YEM,1997,YEM1997,"Yemen, Rep.",1997,YEM,35526372966.75695,5.2311120287830875,2076.5115070388506,0.0,2.17672667372646,0.0,10.224
265,1,230,Yemen (North Yemen):Government,10855,123,Government of Yemen (North Yemen),1091,Ansarallah,678,Yemen (North Yemen),Middle East,"Agence France Presse, 2012-02-09, Two killed in south Yemen anti-election demo",2012,2012-02-09,2012-02-09,0,2,0,0,2,2,2,13.695723,44.73137,1,0,None/Unknown,crack down on protest and/or riot,Security forces,,1,Political supporters,,0,1,5,2,1,YEM-2012-1-X2626-2,0,0,0,0,0,0,0,0,0,0,0,0,0,0,0,0,0,0,0,0,0,0,0,0,0,0,0,0,0,0,0,0,0,0,0,0,0,0,0,0,0,0,0,0,0,0,0,0,0,0,0,0,0,0,0,0,0,0,0,0,0,0,0,0,0,0,0,0,0,0,0,0,0,0,0,0,0,0,1,0,0,0,0,0,0,1,1,0,0,1,0,0,0,1,0,0,0,0,0,0,0,0,0,0,0,1,0,0,0,0,1,0,0,0,0,0,0,0,1,0,0,0,0,0,0,0,0,0,0,0,0,0,0,0,0,0,0,0,0,0,0,0,0,0,0,0,0,0,0,0,1,0,0,0,0,0,0,1,0,0,0,0,0,0,0,0,1,0,0,0,0,0,0,0,0,1,0,0,0,Yemen,Yemen,YEM,2012,YEM2012,"Yemen, Rep.",2012,YEM,56340076512.48264,2.3929902027391563,2148.4664783621097,0.0,9.88538714484871,-2.43066310882568,13.425
266,1,230,Yemen (North Yemen):Government,10855,123,Government of Yemen (North Yemen),1091,Ansarallah,678,Yemen (North Yemen),Middle East,"Rueters News, 2012-02-20,WRAPUP 3-Violence hits Yemen on eve of presidential vote",2012,2012-02-20,2012-02-20,0,1,0,0,1,1,1,13.695723,44.73137,1,0,None/Unknown,crack down on protest and/or riot,Security forces,,1,Political supporters,,0,1,5,2,1,YEM-2012-1-X2626-3,0,0,0,0,0,0,0,0,0,0,0,0,0,0,0,0,0,0,0,0,0,0,0,0,0,0,0,0,0,0,0,0,0,0,0,0,0,0,0,0,0,0,0,0,0,0,0,0,0,0,0,0,0,0,0,0,0,0,0,0,0,0,0,0,0,0,0,0,0,0,0,0,0,0,0,0,0,0,1,0,0,0,0,0,0,1,1,0,0,1,0,0,0,1,0,0,0,0,0,0,0,0,0,0,0,1,0,0,0,0,1,0,0,0,0,0,0,0,1,0,0,0,0,0,0,0,0,0,0,0,0,0,0,0,0,0,0,0,0,0,0,0,0,0,0,0,0,0,0,0,1,0,0,0,0,0,0,1,0,0,0,0,0,0,0,0,1,0,0,0,0,0,0,0,0,1,0,0,0,Yemen,Yemen,YEM,2012,YEM2012,"Yemen, Rep.",2012,YEM,56340076512.48264,2.3929902027391563,2148.4664783621097,0.0,9.88538714484871,-2.43066310882568,13.425
280,2,5036,Supporters of General Peoples Congress - Supporters of Islah party,5646,3425,Supporters of General Peoples Congress,2374,Supporters of Islah party,678,Yemen (North Yemen),Middle East,"AP 2001-02-21 ""Death toll in Yemeni polling is at least 6, early results favor ruling party",2001,2001-02-20,2001-02-20,0,0,0,2,2,2,2,14.542742,44.405145,1,0,None/Unknown,divergent affiliations,Political supporters,,1,Political supporters,,0,3,3,3;4;5,2,YEM-2001-2-X4857-2,0,0,0,0,0,0,0,0,0,0,0,0,0,0,0,0,0,0,0,0,0,0,0,0,0,0,0,0,0,0,0,0,0,0,0,0,0,0,0,0,0,0,0,0,0,0,0,0,0,0,0,0,0,0,0,0,0,0,0,0,0,0,0,0,0,0,0,0,0,0,0,0,0,0,0,0,0,0,1,0,0,0,0,0,0,1,1,0,0,0,1,0,0,0,0,1,0,0,0,0,0,1,0,0,0,0,0,0,0,0,1,0,0,0,0,0,0,1,0,0,0,0,0,0,0,0,0,0,0,0,0,0,0,0,0,0,0,0,0,0,0,0,0,0,0,0,0,0,0,0,1,0,0,0,0,0,1,0,0,0,0,0,0,0,0,0,0,0,1,1,1,0,0,0,1,0,0,0,0,Yemen,Yemen,YEM,2001,YEM2001,"Yemen, Rep.",2001,YEM,43076686484.99081,3.8036458781726736,2250.2041551320017,0.0,11.9115912929855,0.0,11.727
307,2,5036,Supporters of General Peoples Congress - Supporters of Islah party,5646,3425,Supporters of General Peoples Congress,2374,Supporters of Islah party,678,Yemen (North Yemen),Middle East,"Reuters 1997-04-30 ""Four killed in more Yemen election violence",1997,1997-04-30,1997-04-30,0,0,0,4,4,4,4,16.0,43.25,1,0,None/Unknown,divergent affiliations,Political supporters,,1,Political supporters,,1,3,3,1,2,YEM-1997-2-X4857-3,0,0,0,0,0,0,0,0,0,0,0,0,0,0,0,0,0,0,0,0,0,0,0,0,0,0,0,0,0,0,0,0,0,0,0,0,0,0,0,0,0,0,0,0,0,0,0,0,0,0,0,0,0,0,0,0,0,0,0,0,0,0,0,0,0,0,0,0,0,0,0,0,0,0,0,0,0,0,1,0,0,0,0,0,0,1,1,0,0,0,1,0,0,0,0,1,0,0,0,0,0,1,0,0,0,0,0,0,0,0,1,0,0,0,0,0,0,1,0,0,0,0,0,0,0,0,0,0,0,0,0,0,0,0,0,0,0,0,0,0,0,0,0,0,0,0,0,0,0,0,1,0,0,0,0,0,1,0,0,0,0,0,0,0,0,0,0,1,0,0,0,0,0,0,1,0,0,0,0,Yemen,Yemen,YEM,1997,YEM1997,"Yemen, Rep.",1997,YEM,35526372966.75695,5.2311120287830875,2076.5115070388506,0.0,2.17672667372646,0.0,10.224
339,1,230,Yemen (North Yemen):Government,10855,123,Government of Yemen (North Yemen),1091,Ansarallah,678,Yemen (North Yemen),Middle East,"Agence France Presse, 2012-02-21, Four killed in south as violence mars Yemen polls /Reuters News, 2012-02-21, WRAPUP 5-Yemen election ensures Saleh's exit after 33 years",2012,2012-02-21,2012-02-21,0,1,0,1,2,2,2,13.056667,44.881944,1,0,None/Unknown,crack down on protest and/or riot,Security forces,,1,Political supporters,,0,1,5,2,2,YEM-2012-1-X2626-7,0,0,0,0,0,0,0,0,0,0,0,0,0,0,0,0,0,0,0,0,0,0,0,0,0,0,0,0,0,0,0,0,0,0,0,0,0,0,0,0,0,0,0,0,0,0,0,0,0,0,0,0,0,0,0,0,0,0,0,0,0,0,0,0,0,0,0,0,0,0,0,0,0,0,0,0,0,0,1,0,0,0,0,0,0,1,1,0,0,1,0,0,0,1,0,0,0,0,0,0,0,0,0,0,0,1,0,0,0,0,1,0,0,0,0,0,0,0,1,0,0,0,0,0,0,0,0,0,0,0,0,0,0,0,0,0,0,0,0,0,0,0,0,0,0,0,0,0,0,0,1,0,0,0,0,0,0,1,0,0,0,0,0,0,0,0,1,0,0,0,0,0,0,0,1,0,0,0,0,Yemen,Yemen,YEM,2012,YEM2012,"Yemen, Rep.",2012,YEM,56340076512.48264,2.3929902027391563,2148.4664783621097,0.0,9.88538714484871,-2.43066310882568,13.425
343,1,11148,Yemen (North Yemen):,11758,123,Government of Yemen (North Yemen),2374,Supporters of Islah party,678,Yemen (North Yemen),Middle East,"AFP 2001-02-25 ""Six more killed in Yemen election violence as death toll nears 30 ATTENTION - ADDS wounded, details of clashes",2001,2001-02-25,2001-02-25,3,3,0,0,6,6,6,14.0,44.166667,1,0,None/Unknown,protect results,Security forces,,1,Political supporters,,0,3,3;6,3;4;5,3,YEM-2001-1-X4850-2,0,0,0,0,0,0,0,0,0,0,0,0,0,0,0,0,0,0,0,0,0,0,0,0,0,0,0,0,0,0,0,0,0,0,0,0,0,0,0,0,0,0,0,0,0,0,0,0,0,0,0,0,0,0,0,0,0,0,0,0,0,0,0,0,0,0,0,0,0,0,0,0,0,0,0,0,0,0,1,0,0,0,0,0,0,1,1,0,0,1,0,0,0,0,0,1,0,0,0,0,0,0,0,0,0,1,0,0,0,0,1,0,0,0,0,0,0,0,0,1,0,0,0,0,0,0,0,0,0,0,0,0,0,0,0,0,0,0,0,0,0,0,0,0,0,0,0,0,0,0,1,0,0,0,0,1,1,0,0,0,0,0,0,0,0,0,0,0,1,1,1,0,0,0,0,0,1,0,0,Yemen,Yemen,YEM,2001,YEM2001,"Yemen, Rep.",2001,YEM,43076686484.99081,3.8036458781726736,2250.2041551320017,0.0,11.9115912929855,0.0,11.727
344,2,5036,Supporters of General Peoples Congress - Supporters of Islah party,5646,3425,Supporters of General Peoples Congress,2374,Supporters of Islah party,678,Yemen (North Yemen),Middle East,"Reuters 2001-02-14 ""One Yemeni killed in pre-poll political violence",2001,2001-02-14,2001-02-14,0,1,0,0,1,1,1,14.0,44.166667,1,0,None/Unknown,divergent affiliations,Political supporters,,1,Political supporters,,0,3,3,3;4;5,1,YEM-2001-2-X4857-1,0,0,0,0,0,0,0,0,0,0,0,0,0,0,0,0,0,0,0,0,0,0,0,0,0,0,0,0,0,0,0,0,0,0,0,0,0,0,0,0,0,0,0,0,0,0,0,0,0,0,0,0,0,0,0,0,0,0,0,0,0,0,0,0,0,0,0,0,0,0,0,0,0,0,0,0,0,0,1,0,0,0,0,0,0,1,1,0,0,0,1,0,0,0,0,1,0,0,0,0,0,1,0,0,0,0,0,0,0,0,1,0,0,0,0,0,0,1,0,0,0,0,0,0,0,0,0,0,0,0,0,0,0,0,0,0,0,0,0,0,0,0,0,0,0,0,0,0,0,0,1,0,0,0,0,0,1,0,0,0,0,0,0,0,0,0,0,0,1,1,1,0,0,0,0,1,0,0,0,Yemen,Yemen,YEM,2001,YEM2001,"Yemen, Rep.",2001,YEM,43076686484.99081,3.8036458781726736,2250.2041551320017,0.0,11.9115912929855,0.0,11.727
399,2,5036,Supporters of General Peoples Congress - Supporters of Islah party,5646,3425,Supporters of General Peoples Congress,2374,Supporters of Islah party,678,Yemen (North Yemen),Middle East,"AP 2001-02-24 ""Continued post-election violence claims five lives in Yemen",2001,2001-02-24,2001-02-24,1,0,0,0,1,1,1,16.164056,44.776919,1,0,None/Unknown,divergent affiliations,Political supporters,,1,Political supporters,,0,3,3,3;4;5,3,YEM-2001-2-X4857-9,0,0,0,0,0,0,0,0,0,0,0,0,0,0,0,0,0,0,0,0,0,0,0,0,0,0,0,0,0,0,0,0,0,0,0,0,0,0,0,0,0,0,0,0,0,0,0,0,0,0,0,0,0,0,0,0,0,0,0,0,0,0,0,0,0,0,0,0,0,0,0,0,0,0,0,0,0,0,1,0,0,0,0,0,0,1,1,0,0,0,1,0,0,0,0,1,0,0,0,0,0,1,0,0,0,0,0,0,0,0,1,0,0,0,0,0,0,1,0,0,0,0,0,0,0,0,0,0,0,0,0,0,0,0,0,0,0,0,0,0,0,0,0,0,0,0,0,0,0,0,1,0,0,0,0,0,1,0,0,0,0,0,0,0,0,0,0,0,1,1,1,0,0,0,0,0,1,0,0,Yemen,Yemen,YEM,2001,YEM2001,"Yemen, Rep.",2001,YEM,43076686484.99081,3.8036458781726736,2250.2041551320017,0.0,11.9115912929855,0.0,11.727
403,2,5037,Common Forum supporters - Supporters of General Peoples Congress,5647,3374,Common Forum supporters,3425,Supporters of General Peoples Congress,678,Yemen (North Yemen),Middle East,AFP 25/8,2006,2006-08-25,2006-08-25,0,0,0,3,3,3,3,16.689733,45.611557,1,0,None/Unknown,divergent affiliations,Political supporters,,0,Political supporters,,1,3,3,3,1,YEM-2006-2-X4858-1,0,0,0,0,0,0,0,0,0,0,0,0,0,0,0,0,0,0,0,0,0,0,0,0,0,0,0,0,0,0,0,0,0,0,0,0,0,0,0,0,0,0,0,0,0,0,0,0,0,0,0,0,0,0,0,0,0,0,0,0,0,0,0,0,0,0,0,0,0,0,0,0,0,0,0,0,0,0,1,0,0,0,0,0,0,1,1,0,0,0,1,0,0,0,0,1,0,0,0,0,0,1,0,0,0,0,0,0,0,0,1,0,0,0,0,0,0,1,0,0,0,0,0,0,0,0,0,0,0,0,0,0,0,0,0,0,0,0,0,0,0,0,0,0,0,0,0,0,0,0,1,0,0,0,0,0,1,0,0,0,0,0,0,0,0,0,0,0,1,0,0,0,0,0,0,1,0,0,0,Yemen,Yemen,YEM,2006,YEM2006,"Yemen, Rep.",2006,YEM,52612232625.72311,3.170409371256767,2395.1342472784036,0.0,10.8447986914257,-1.34531164169312,12.355
490,1,230,Yemen (North Yemen):Government,459,123,Government of Yemen (North Yemen),881,AQAP,678,Yemen (North Yemen),Middle East,"Associated Press Newswires, 2012-02-15, Yemeni security officials: 5 officials shot, soldier killed in car bomb",2012,2012-02-15,2012-02-15,1,0,0,0,1,1,0,15.416667,45.35,1,1,None/Unknown,disrupt,Security forces,,1,Rebel group,,0,2,6,2,1,YEM-2012-1-784-26,1,0,0,0,0,0,0,0,0,0,0,0,0,0,0,0,0,0,0,0,0,0,0,0,0,0,0,0,0,0,0,0,0,0,0,0,0,0,0,0,0,0,0,0,0,0,0,0,0,0,0,0,0,0,0,0,0,0,0,0,0,0,0,0,0,0,0,0,0,0,0,0,0,0,0,0,0,0,1,0,0,0,0,0,0,1,0,1,0,1,0,0,0,0,1,0,0,0,0,0,0,0,0,0,0,1,0,0,0,0,0,0,0,1,0,0,1,0,0,0,0,0,0,0,0,0,0,0,0,0,0,0,0,0,0,0,0,0,0,0,0,0,0,0,0,0,0,0,0,0,1,0,0,0,0,1,0,0,0,0,0,0,0,0,0,0,1,0,0,0,0,0,0,0,0,1,0,0,0,Yemen,Yemen,YEM,2012,YEM2012,"Yemen, Rep.",2012,YEM,56340076512.48264,2.3929902027391563,2148.4664783621097,0.0,9.88538714484871,-2.43066310882568,13.425
528,1,230,Yemen (North Yemen):Government,10855,123,Government of Yemen (North Yemen),1091,Ansarallah,678,Yemen (North Yemen),Middle East,"Agence France Presse, 2012-02-21, Four killed in south as violence mars Yemen polls /Reuters News, 2012-02-21, WRAPUP 5-Yemen election ensures Saleh's exit after 33 years",2012,2012-02-21,2012-02-21,1,1,0,0,2,2,2,14.542481,49.124244,1,0,None/Unknown,disrupt,Security forces,,1,Political supporters,,0,2,6;10,2,2,YEM-2012-1-X2626-6,0,0,0,0,0,0,0,0,0,0,0,0,0,0,0,0,0,0,0,0,0,0,0,0,0,0,0,0,0,0,0,0,0,0,0,0,0,0,0,0,0,0,0,0,0,0,0,0,0,0,0,0,0,0,0,0,0,0,0,0,0,0,0,0,0,0,0,0,0,0,0,0,0,0,0,0,0,0,1,0,0,0,0,0,0,1,1,0,0,1,0,0,0,0,1,0,0,0,0,0,0,0,0,0,0,1,0,0,0,0,1,0,0,0,0,0,1,0,0,0,0,0,0,0,0,0,0,0,0,0,0,0,0,0,0,0,0,0,0,0,0,0,0,0,0,0,0,0,0,0,1,0,0,0,0,1,0,0,1,1,0,0,0,0,0,0,1,0,0,0,0,0,0,0,1,0,0,0,0,Yemen,Yemen,YEM,2012,YEM2012,"Yemen, Rep.",2012,YEM,56340076512.48264,2.3929902027391563,2148.4664783621097,0.0,9.88538714484871,-2.43066310882568,13.425
534,1,230,Yemen (North Yemen):Government,10855,123,Government of Yemen (North Yemen),1091,Ansarallah,678,Yemen (North Yemen),Middle East,"Reuters News, 2012-02-23, Yemen troops kill secessionist demonstrator in south",2012,2012-02-23,2012-02-23,0,1,0,0,1,1,1,14.542481,49.124244,1,0,None/Unknown,crack down on protest and/or riot,Security forces,,1,Political supporters,,0,1,5,2,3,YEM-2012-1-X2626-8,0,0,0,0,0,0,0,0,0,0,0,0,0,0,0,0,0,0,0,0,0,0,0,0,0,0,0,0,0,0,0,0,0,0,0,0,0,0,0,0,0,0,0,0,0,0,0,0,0,0,0,0,0,0,0,0,0,0,0,0,0,0,0,0,0,0,0,0,0,0,0,0,0,0,0,0,0,0,1,0,0,0,0,0,0,1,1,0,0,1,0,0,0,1,0,0,0,0,0,0,0,0,0,0,0,1,0,0,0,0,1,0,0,0,0,0,0,0,1,0,0,0,0,0,0,0,0,0,0,0,0,0,0,0,0,0,0,0,0,0,0,0,0,0,0,0,0,0,0,0,1,0,0,0,0,0,0,1,0,0,0,0,0,0,0,0,1,0,0,0,0,0,0,0,0,0,1,0,0,Yemen,Yemen,YEM,2012,YEM2012,"Yemen, Rep.",2012,YEM,56340076512.48264,2.3929902027391563,2148.4664783621097,0.0,9.88538714484871,-2.43066310882568,13.425
535,1,230,Yemen (North Yemen):Government,10855,123,Government of Yemen (North Yemen),1091,Ansarallah,678,Yemen (North Yemen),Middle East,"Agence France Presse, 2012-02-25, Two Yemen soldiers die after clashes with southern militants",2012,2012-02-25,2012-02-25,2,0,0,0,2,2,2,14.542481,49.124244,1,0,None/Unknown,crack down on protest and/or riot,Security forces,,1,Political supporters,,0,1,5,2,3,YEM-2012-1-X2626-9,0,0,0,0,0,0,0,0,0,0,0,0,0,0,0,0,0,0,0,0,0,0,0,0,0,0,0,0,0,0,0,0,0,0,0,0,0,0,0,0,0,0,0,0,0,0,0,0,0,0,0,0,0,0,0,0,0,0,0,0,0,0,0,0,0,0,0,0,0,0,0,0,0,0,0,0,0,0,1,0,0,0,0,0,0,1,1,0,0,1,0,0,0,1,0,0,0,0,0,0,0,0,0,0,0,1,0,0,0,0,1,0,0,0,0,0,0,0,1,0,0,0,0,0,0,0,0,0,0,0,0,0,0,0,0,0,0,0,0,0,0,0,0,0,0,0,0,0,0,0,1,0,0,0,0,0,0,1,0,0,0,0,0,0,0,0,1,0,0,0,0,0,0,0,0,0,1,0,0,Yemen,Yemen,YEM,2012,YEM2012,"Yemen, Rep.",2012,YEM,56340076512.48264,2.3929902027391563,2148.4664783621097,0.0,9.88538714484871,-2.43066310882568,13.425
537,3,715,Government of Yemen (North Yemen) - Civilians,1182,123,Government of Yemen (North Yemen),1,Civilians,678,Yemen (North Yemen),Middle East,"Reuters News, 2012-02-05, UPDATE 1-Fighting over captured Yemeni city kills five",2012,2012-02-05,2012-02-05,0,0,0,1,1,1,1,14.542481,49.124244,1,0,None/Unknown,crack down on protest and/or riot,Security forces,,1,Political supporters,,0,1,5,2,1,YEM-2012-3-678-1,0,0,0,0,0,0,0,0,0,0,0,0,0,0,0,0,0,0,0,0,0,0,0,0,0,0,0,0,0,0,0,0,0,0,0,0,0,0,0,0,0,0,0,0,0,0,0,0,0,0,0,0,0,0,0,0,0,0,0,0,0,0,0,0,0,0,0,0,0,0,0,0,0,0,0,0,0,0,1,0,0,0,0,0,0,1,1,0,0,0,0,1,0,1,0,0,0,0,0,0,0,0,0,0,0,1,0,0,0,0,1,0,0,0,0,0,0,0,1,0,0,0,0,0,0,0,0,0,0,0,0,0,0,0,0,0,0,0,0,0,0,0,0,0,0,0,0,0,0,0,1,0,0,0,0,0,0,1,0,0,0,0,0,0,0,0,1,0,0,0,0,0,0,0,0,1,0,0,0,Yemen,Yemen,YEM,2012,YEM2012,"Yemen, Rep.",2012,YEM,56340076512.48264,2.3929902027391563,2148.4664783621097,0.0,9.88538714484871,-2.43066310882568,13.425
707,2,5036,Supporters of General Peoples Congress - Supporters of Islah party,5646,3425,Supporters of General Peoples Congress,2374,Supporters of Islah party,678,Yemen (North Yemen),Middle East,"Dow Jones 2001-02-23 ""Five More Killed In Yemen Post-Election Violence",2001,2001-02-23,2001-02-23,0,0,0,2,2,2,2,15.354722,44.206667,1,0,None/Unknown,divergent affiliations,Political supporters,,1,Political supporters,,0,3,3,3;4;5,3,YEM-2001-2-X4857-3,0,0,0,0,0,0,0,0,0,0,0,0,0,0,0,0,0,0,0,0,0,0,0,0,0,0,0,0,0,0,0,0,0,0,0,0,0,0,0,0,0,0,0,0,0,0,0,0,0,0,0,0,0,0,0,0,0,0,0,0,0,0,0,0,0,0,0,0,0,0,0,0,0,0,0,0,0,0,1,0,0,0,0,0,0,1,1,0,0,0,1,0,0,0,0,1,0,0,0,0,0,1,0,0,0,0,0,0,0,0,1,0,0,0,0,0,0,1,0,0,0,0,0,0,0,0,0,0,0,0,0,0,0,0,0,0,0,0,0,0,0,0,0,0,0,0,0,0,0,0,1,0,0,0,0,0,1,0,0,0,0,0,0,0,0,0,0,0,1,1,1,0,0,0,0,0,1,0,0,Yemen,Yemen,YEM,2001,YEM2001,"Yemen, Rep.",2001,YEM,43076686484.99081,3.8036458781726736,2250.2041551320017,0.0,11.9115912929855,0.0,11.727
868,1,11148,Yemen (North Yemen):,11758,123,Government of Yemen (North Yemen),2374,Supporters of Islah party,678,Yemen (North Yemen),Middle East,"AFP 2001-02-22 ""Two newly-elected opposition councillors killed in Yemen ATTENTION - INCORPORATES Yemen-vote-police",2001,2001-02-22,2001-02-22,3,0,0,0,3,3,3,15.354722,44.206667,1,0,None/Unknown,disrupt,Security forces,,1,Political supporters,,0,2,2;6,3;4;5,3,YEM-2001-1-X4850-1,0,0,0,0,0,0,0,0,0,0,0,0,0,0,0,0,0,0,0,0,0,0,0,0,0,0,0,0,0,0,0,0,0,0,0,0,0,0,0,0,0,0,0,0,0,0,0,0,0,0,0,0,0,0,0,0,0,0,0,0,0,0,0,0,0,0,0,0,0,0,0,0,0,0,0,0,0,0,1,0,0,0,0,0,0,1,1,0,0,1,0,0,0,0,1,0,0,0,0,0,0,0,0,0,0,1,0,0,0,0,1,0,0,0,0,0,1,0,0,0,0,0,0,0,0,0,0,0,0,0,0,0,0,0,0,0,0,0,0,0,0,0,0,0,0,0,0,0,0,0,1,0,0,0,1,1,0,0,0,0,0,0,0,0,0,0,0,0,1,1,1,0,0,0,0,0,1,0,0,Yemen,Yemen,YEM,2001,YEM2001,"Yemen, Rep.",2001,YEM,43076686484.99081,3.8036458781726736,2250.2041551320017,0.0,11.9115912929855,0.0,11.727
1089,1,169,XXX678,337,3764,XXX678,3764,XXX678,678,Yemen (North Yemen),Middle East,"Agence France Presse, 2012-02-20, Anti-election gunmen shoot dead Yemen soldier",2012,2012-02-20,2012-02-20,1,0,0,0,1,1,1,13.922541,44.76827,1,1,None/Unknown,disrupt,Security forces,,1,Political supporters,,0,2,10,2,1,YEM-2012-1-XXX678-7,0,0,0,0,0,0,0,0,0,0,0,0,0,0,0,0,0,0,0,0,0,0,0,0,0,0,0,0,0,0,0,0,0,0,0,0,0,0,0,0,0,0,0,0,0,0,0,0,0,0,0,0,0,0,0,0,0,0,0,0,0,0,0,0,0,0,0,0,0,0,0,0,0,0,0,0,0,0,1,0,0,0,0,0,0,1,0,1,0,1,0,0,0,0,1,0,0,0,0,0,0,0,0,0,0,1,0,0,0,0,1,0,0,0,0,0,1,0,0,0,0,0,0,0,0,0,0,0,0,0,0,0,0,0,0,0,0,0,0,0,0,0,0,0,0,0,0,0,0,0,1,0,0,0,0,0,0,0,1,1,0,0,0,0,0,0,1,0,0,0,0,0,0,0,0,1,0,0,0,Yemen,Yemen,YEM,2012,YEM2012,"Yemen, Rep.",2012,YEM,56340076512.48264,2.3929902027391563,2148.4664783621097,0.0,9.88538714484871,-2.43066310882568,13.425
1117,1,169,XXX678,337,3764,XXX678,3764,XXX678,678,Yemen (North Yemen),Middle East,"Rueters News, 2012-02-20, UPDATE 1-Blast rocks Yemeni polling station ahead of vote",2012,2012-02-20,2012-02-20,1,0,0,0,1,1,1,12.779444,45.036667,1,0,None/Unknown,disrupt,Security forces,,1,Political supporters,,0,2,6;10,2,1,YEM-2012-1-XXX678-8,0,0,0,0,0,0,0,0,0,0,0,0,0,0,0,0,0,0,0,0,0,0,0,0,0,0,0,0,0,0,0,0,0,0,0,0,0,0,0,0,0,0,0,0,0,0,0,0,0,0,0,0,0,0,0,0,0,0,0,0,0,0,0,0,0,0,0,0,0,0,0,0,0,0,0,0,0,0,1,0,0,0,0,0,0,1,1,0,0,1,0,0,0,0,1,0,0,0,0,0,0,0,0,0,0,1,0,0,0,0,1,0,0,0,0,0,1,0,0,0,0,0,0,0,0,0,0,0,0,0,0,0,0,0,0,0,0,0,0,0,0,0,0,0,0,0,0,0,0,0,1,0,0,0,0,1,0,0,1,1,0,0,0,0,0,0,1,0,0,0,0,0,0,0,0,1,0,0,0,Yemen,Yemen,YEM,2012,YEM2012,"Yemen, Rep.",2012,YEM,56340076512.48264,2.3929902027391563,2148.4664783621097,0.0,9.88538714484871,-2.43066310882568,13.425
1124,1,169,XXX678,337,3764,XXX678,3764,XXX678,678,Yemen (North Yemen),Middle East,"Dow Jones 2001-02-23 ""Five More Killed In Yemen Post-Election Violence",2001,2001-02-23,2001-02-23,1,0,2,0,3,3,3,14.34166,45.39442,1,0,None/Unknown,divergent affiliations,Political supporters,,-99,Political supporters,,-99,3,3,3;4;5,3,YEM-2001-1-XXX678-2,0,0,0,0,0,0,0,0,0,0,0,0,0,0,0,0,0,0,0,0,0,0,0,0,0,0,0,0,0,0,0,0,0,0,0,0,0,0,0,0,0,0,0,0,0,0,0,0,0,0,0,0,0,0,0,0,0,0,0,0,0,0,0,0,0,0,0,0,0,0,0,0,0,0,0,0,0,0,1,0,0,0,0,0,0,1,1,0,0,1,0,0,0,0,0,1,0,0,0,0,0,1,0,0,0,0,0,0,0,0,1,0,0,0,0,0,0,1,0,0,0,0,0,0,0,0,0,0,0,0,0,0,0,0,0,0,0,0,0,0,0,0,0,0,0,0,0,0,0,0,1,0,0,0,0,0,1,0,0,0,0,0,0,0,0,0,0,0,1,1,1,0,0,0,0,0,1,0,0,Yemen,Yemen,YEM,2001,YEM2001,"Yemen, Rep.",2001,YEM,43076686484.99081,3.8036458781726736,2250.2041551320017,0.0,11.9115912929855,0.0,11.727
1205,1,169,XXX678,337,3764,XXX678,3764,XXX678,678,Yemen (North Yemen),Middle East,AFP 12/9,2006,2006-09-12,2006-09-12,0,0,51,0,51,51,51,13.940771,44.177343,1,1,None/Unknown,unclear,Political supporters,,0,Political supporters,,1,4,3,2;3,1,YEM-2006-1-XXX678-1,0,0,0,0,0,0,0,0,0,0,0,0,0,0,0,0,0,0,0,0,0,0,0,0,0,0,0,0,0,0,0,0,0,0,0,0,0,0,0,0,0,0,0,0,0,0,0,0,0,0,0,0,0,0,0,0,0,0,0,0,0,0,0,0,0,0,0,0,0,0,0,0,0,0,0,0,0,0,1,0,0,0,0,0,0,1,0,1,0,1,0,0,0,0,0,0,1,0,0,0,0,1,0,0,0,0,0,0,0,0,1,0,0,0,0,0,0,0,0,0,1,0,0,0,0,0,0,0,0,0,0,0,0,0,0,0,0,0,0,0,0,0,0,0,0,0,0,0,0,0,1,0,0,0,0,0,1,0,0,0,0,0,0,0,0,0,1,0,1,0,0,0,0,0,0,1,0,0,0,Yemen,Yemen,YEM,2006,YEM2006,"Yemen, Rep.",2006,YEM,52612232625.72311,3.170409371256767,2395.1342472784036,0.0,10.8447986914257,-1.34531164169312,12.355
1206,2,169,XXX678 - XXX678,338,3764,XXX678,3764,XXX678,678,Yemen (North Yemen),Middle East,"AP 2001-02-21 ""Death toll in Yemeni polling is at least 6, early results favor ruling party",2001,2001-02-14,2001-02-20,0,0,0,8,8,9,8,14.0,44.166667,1,0,None/Unknown,divergent affiliations,Political supporters,,-99,Political supporters,,-99,3,3,3;4;5,1,YEM-2001-2-XXX678-3,0,0,0,0,0,0,0,0,0,0,0,0,0,0,0,0,0,0,0,0,0,0,0,0,0,0,0,0,0,0,0,0,0,0,0,0,0,0,0,0,0,0,0,0,0,0,0,0,0,0,0,0,0,0,0,0,0,0,0,0,0,0,0,0,0,0,0,0,0,0,0,0,0,0,0,0,0,0,1,0,0,0,0,0,0,1,1,0,0,0,1,0,0,0,0,1,0,0,0,0,0,1,0,0,0,0,0,0,0,0,1,0,0,0,0,0,0,1,0,0,0,0,0,0,0,0,0,0,0,0,0,0,0,0,0,0,0,0,0,0,0,0,0,0,0,0,0,0,0,0,1,0,0,0,0,0,1,0,0,0,0,0,0,0,0,0,0,0,1,1,1,0,0,0,0,1,0,0,0,Yemen,Yemen,YEM,2001,YEM2001,"Yemen, Rep.",2001,YEM,43076686484.99081,3.8036458781726736,2250.2041551320017,0.0,11.9115912929855,0.0,11.727
1221,2,169,XXX678 - XXX678,338,3764,XXX678,3764,XXX678,678,Yemen (North Yemen),Middle East,"Reuters 1997-05-01 ""Yemeni journalist killed in latest poll violence.",1997,1997-04-30,1997-04-30,0,0,1,1,2,2,2,13.166667,44.583332,1,0,None/Unknown,divergent affiliations,Political supporters,,1,Political supporters,,1,3,3,1,2,YEM-1997-2-XXX678-5,0,0,0,0,0,0,0,0,0,0,0,0,0,0,0,0,0,0,0,0,0,0,0,0,0,0,0,0,0,0,0,0,0,0,0,0,0,0,0,0,0,0,0,0,0,0,0,0,0,0,0,0,0,0,0,0,0,0,0,0,0,0,0,0,0,0,0,0,0,0,0,0,0,0,0,0,0,0,1,0,0,0,0,0,0,1,1,0,0,0,1,0,0,0,0,1,0,0,0,0,0,1,0,0,0,0,0,0,0,0,1,0,0,0,0,0,0,1,0,0,0,0,0,0,0,0,0,0,0,0,0,0,0,0,0,0,0,0,0,0,0,0,0,0,0,0,0,0,0,0,1,0,0,0,0,0,1,0,0,0,0,0,0,0,0,0,0,1,0,0,0,0,0,0,1,0,0,0,0,Yemen,Yemen,YEM,1997,YEM1997,"Yemen, Rep.",1997,YEM,35526372966.75695,5.2311120287830875,2076.5115070388506,0.0,2.17672667372646,0.0,10.224
1223,3,4428,XXX678 - Civilians,5034,3764,XXX678,1,Civilians,678,Yemen (North Yemen),Middle East,AFP 12/9,2006,2006-08-28,2006-08-28,0,0,1,0,1,1,1,13.166667,44.583332,1,0,None/Unknown,unclear,Unclear,,-99,Political supporters,,0,1,3,2,1,YEM-2006-3-XXX678-3,0,0,0,0,0,0,0,0,0,0,0,0,0,0,0,0,0,0,0,0,0,0,0,0,0,0,0,0,0,0,0,0,0,0,0,0,0,0,0,0,0,0,0,0,0,0,0,0,0,0,0,0,0,0,0,0,0,0,0,0,0,0,0,0,0,0,0,0,0,0,0,0,0,0,0,0,0,0,1,0,0,0,0,0,0,1,1,0,0,0,0,1,0,1,0,0,0,0,0,0,0,0,0,0,0,0,1,0,0,0,1,0,0,0,0,0,0,0,0,0,1,0,0,0,0,0,0,0,0,0,0,0,0,0,0,0,0,0,0,0,0,0,0,0,0,0,0,0,0,0,1,0,0,0,0,0,1,0,0,0,0,0,0,0,0,0,1,0,0,0,0,0,0,0,0,1,0,0,0,Yemen,Yemen,YEM,2006,YEM2006,"Yemen, Rep.",2006,YEM,52612232625.72311,3.170409371256767,2395.1342472784036,0.0,10.8447986914257,-1.34531164169312,12.355
1224,1,169,XXX678,337,3764,XXX678,3764,XXX678,678,Yemen (North Yemen),Middle East,"Reuters News, 2012-02-19, UPDATE 1-Yemen to seal Saleh's exit in one-candidate vote",2012,2012-02-19,2012-02-19,1,1,0,0,2,2,2,13.166667,44.583332,1,0,None/Unknown,disrupt,Security forces,,1,Political supporters,,0,2,10,2,1,YEM-2012-1-XXX678-6,0,0,0,0,0,0,0,0,0,0,0,0,0,0,0,0,0,0,0,0,0,0,0,0,0,0,0,0,0,0,0,0,0,0,0,0,0,0,0,0,0,0,0,0,0,0,0,0,0,0,0,0,0,0,0,0,0,0,0,0,0,0,0,0,0,0,0,0,0,0,0,0,0,0,0,0,0,0,1,0,0,0,0,0,0,1,1,0,0,1,0,0,0,0,1,0,0,0,0,0,0,0,0,0,0,1,0,0,0,0,1,0,0,0,0,0,1,0,0,0,0,0,0,0,0,0,0,0,0,0,0,0,0,0,0,0,0,0,0,0,0,0,0,0,0,0,0,0,0,0,1,0,0,0,0,0,0,0,1,1,0,0,0,0,0,0,1,0,0,0,0,0,0,0,0,1,0,0,0,Yemen,Yemen,YEM,2012,YEM2012,"Yemen, Rep.",2012,YEM,56340076512.48264,2.3929902027391563,2148.4664783621097,0.0,9.88538714484871,-2.43066310882568,13.425
1236,2,169,XXX678 - XXX678,338,3764,XXX678,3764,XXX678,678,Yemen (North Yemen),Middle East,"Rueters News, 2012-02-20, WRAPUP 3-Violence hits Yemen on eve of presidential vote",2012,2012-02-20,2012-02-20,0,2,0,0,2,2,2,13.882824,45.868586,1,1,None/Unknown,disrupt,Security forces,,1,Political supporters,,0,2,6;10,2,1,YEM-2012-2-XXX678-6,0,0,0,0,0,0,0,0,0,0,0,0,0,0,0,0,0,0,0,0,0,0,0,0,0,0,0,0,0,0,0,0,0,0,0,0,0,0,0,0,0,0,0,0,0,0,0,0,0,0,0,0,0,0,0,0,0,0,0,0,0,0,0,0,0,0,0,0,0,0,0,0,0,0,0,0,0,0,1,0,0,0,0,0,0,1,0,1,0,0,1,0,0,0,1,0,0,0,0,0,0,0,0,0,0,1,0,0,0,0,1,0,0,0,0,0,1,0,0,0,0,0,0,0,0,0,0,0,0,0,0,0,0,0,0,0,0,0,0,0,0,0,0,0,0,0,0,0,0,0,1,0,0,0,0,1,0,0,1,1,0,0,0,0,0,0,1,0,0,0,0,0,0,0,0,1,0,0,0,Yemen,Yemen,YEM,2012,YEM2012,"Yemen, Rep.",2012,YEM,56340076512.48264,2.3929902027391563,2148.4664783621097,0.0,9.88538714484871,-2.43066310882568,13.425
1260,2,169,XXX678 - XXX678,338,3764,XXX678,3764,XXX678,678,Yemen (North Yemen),Middle East,"AP 2001-02-21 ""Death toll in Yemeni polling is at least 6, early results favor ruling party",2001,2001-02-20,2001-02-20,0,0,0,1,1,1,1,14.797812,42.954516,1,0,None/Unknown,divergent affiliations,Political supporters,,-99,Political supporters,,-99,3,3,3;4;5,2,YEM-2001-2-XXX678-5,0,0,0,0,0,0,0,0,0,0,0,0,0,0,0,0,0,0,0,0,0,0,0,0,0,0,0,0,0,0,0,0,0,0,0,0,0,0,0,0,0,0,0,0,0,0,0,0,0,0,0,0,0,0,0,0,0,0,0,0,0,0,0,0,0,0,0,0,0,0,0,0,0,0,0,0,0,0,1,0,0,0,0,0,0,1,1,0,0,0,1,0,0,0,0,1,0,0,0,0,0,1,0,0,0,0,0,0,0,0,1,0,0,0,0,0,0,1,0,0,0,0,0,0,0,0,0,0,0,0,0,0,0,0,0,0,0,0,0,0,0,0,0,0,0,0,0,0,0,0,1,0,0,0,0,0,1,0,0,0,0,0,0,0,0,0,0,0,1,1,1,0,0,0,1,0,0,0,0,Yemen,Yemen,YEM,2001,YEM2001,"Yemen, Rep.",2001,YEM,43076686484.99081,3.8036458781726736,2250.2041551320017,0.0,11.9115912929855,0.0,11.727
1268,2,169,XXX678 - XXX678,338,3764,XXX678,3764,XXX678,678,Yemen (North Yemen),Middle East,"AP 2001-02-21 ""Death toll in Yemeni polling is at least 6, early results favor ruling party",2001,2001-02-20,2001-02-20,0,0,0,1,1,1,1,15.354722,44.206667,1,0,None/Unknown,divergent affiliations,Political supporters,,-99,Political supporters,,-99,3,3,3;4;5,2,YEM-2001-2-XXX678-6,0,0,0,0,0,0,0,0,0,0,0,0,0,0,0,0,0,0,0,0,0,0,0,0,0,0,0,0,0,0,0,0,0,0,0,0,0,0,0,0,0,0,0,0,0,0,0,0,0,0,0,0,0,0,0,0,0,0,0,0,0,0,0,0,0,0,0,0,0,0,0,0,0,0,0,0,0,0,1,0,0,0,0,0,0,1,1,0,0,0,1,0,0,0,0,1,0,0,0,0,0,1,0,0,0,0,0,0,0,0,1,0,0,0,0,0,0,1,0,0,0,0,0,0,0,0,0,0,0,0,0,0,0,0,0,0,0,0,0,0,0,0,0,0,0,0,0,0,0,0,1,0,0,0,0,0,1,0,0,0,0,0,0,0,0,0,0,0,1,1,1,0,0,0,1,0,0,0,0,Yemen,Yemen,YEM,2001,YEM2001,"Yemen, Rep.",2001,YEM,43076686484.99081,3.8036458781726736,2250.2041551320017,0.0,11.9115912929855,0.0,11.727
1338,1,169,XXX678,337,3764,XXX678,3764,XXX678,678,Yemen (North Yemen),Middle East,"Rueters News, 2012-02-20, WRAPUP 3-Violence hits Yemen on eve of presidential vote",2012,2012-02-20,2012-02-20,0,1,0,0,1,1,1,15.943333,48.793333,1,1,None/Unknown,disrupt,Security forces,,1,Unclear,,-99,2,6;10,2,1,YEM-2012-1-XXX678-9,0,0,0,0,0,0,0,0,0,0,0,0,0,0,0,0,0,0,0,0,0,0,0,0,0,0,0,0,0,0,0,0,0,0,0,0,0,0,0,0,0,0,0,0,0,0,0,0,0,0,0,0,0,0,0,0,0,0,0,0,0,0,0,0,0,0,0,0,0,0,0,0,0,0,0,0,0,0,1,0,0,0,0,0,0,1,0,1,0,1,0,0,0,0,1,0,0,0,0,0,0,0,0,0,0,1,0,0,0,0,0,0,0,0,0,1,1,0,0,0,0,0,0,0,0,0,0,0,0,0,0,0,0,0,0,0,0,0,0,0,0,0,0,0,0,0,0,0,0,0,1,0,0,0,0,1,0,0,1,1,0,0,0,0,0,0,1,0,0,0,0,0,0,0,0,1,0,0,0,Yemen,Yemen,YEM,2012,YEM2012,"Yemen, Rep.",2012,YEM,56340076512.48264,2.3929902027391563,2148.4664783621097,0.0,9.88538714484871,-2.43066310882568,13.425
1343,2,169,XXX678 - XXX678,338,3764,XXX678,3764,XXX678,678,Yemen (North Yemen),Middle East,"AP 2001-02-24 ""Continued post-election violence claims five lives in Yemen",2001,2001-02-24,2001-02-24,0,0,0,4,4,4,4,13.579522,44.020908,1,0,None/Unknown,divergent affiliations,Political supporters,,1,Political supporters,,0,3,3,3;4;5,3,YEM-2001-2-XXX678-8,0,0,0,0,0,0,0,0,0,0,0,0,0,0,0,0,0,0,0,0,0,0,0,0,0,0,0,0,0,0,0,0,0,0,0,0,0,0,0,0,0,0,0,0,0,0,0,0,0,0,0,0,0,0,0,0,0,0,0,0,0,0,0,0,0,0,0,0,0,0,0,0,0,0,0,0,0,0,1,0,0,0,0,0,0,1,1,0,0,0,1,0,0,0,0,1,0,0,0,0,0,1,0,0,0,0,0,0,0,0,1,0,0,0,0,0,0,1,0,0,0,0,0,0,0,0,0,0,0,0,0,0,0,0,0,0,0,0,0,0,0,0,0,0,0,0,0,0,0,0,1,0,0,0,0,0,1,0,0,0,0,0,0,0,0,0,0,0,1,1,1,0,0,0,0,0,1,0,0,Yemen,Yemen,YEM,2001,YEM2001,"Yemen, Rep.",2001,YEM,43076686484.99081,3.8036458781726736,2250.2041551320017,0.0,11.9115912929855,0.0,11.727
1675,3,706,Government of Algeria - Civilians,1173,109,Government of Algeria,1,Civilians,615,Algeria,Africa,"Reuters, 1991-06-27",1991,1991-06-25,1991-06-26,0,0,0,3,3,3,3,36.470039,2.827699,1,2,None/Unknown,spell,Security forces,,1,Political supporters,,0,1,5,1,1,ALG-1991-3-615-5,0,0,0,1,0,0,0,0,0,0,0,0,0,0,0,0,0,0,0,0,0,0,0,0,0,0,0,0,0,0,0,0,0,0,0,0,0,0,0,0,0,0,0,0,0,0,0,0,0,0,0,0,0,0,0,0,0,0,0,0,0,0,0,0,0,0,0,0,0,0,0,0,0,0,0,0,0,0,0,0,0,1,0,0,0,0,0,0,1,0,0,1,0,1,0,0,0,0,0,0,0,0,0,0,0,1,0,0,0,0,1,0,0,0,0,0,0,0,0,0,0,1,0,0,0,0,0,0,0,0,0,0,0,0,0,0,0,0,0,0,0,0,0,0,0,0,0,0,0,0,1,0,0,0,0,0,0,1,0,0,0,0,0,0,0,0,0,1,0,0,0,0,0,0,0,1,0,0,0,Algeria,Algeria,DZA,1991,DZA1991,Algeria,1991,DZA,79504981564.64198,-1.2000005855168183,3042.215909357671,0.0,25.8863869348513,0.0,20.6
2058,3,4262,XXX615 - Civilians,4868,3598,XXX615,1,Civilians,615,Algeria,Africa,"Reuters, 1997-10-18",1997,1997-10-17,1997-10-17,0,0,2,0,2,2,2,28.0,3,1,0,None/Unknown,eliminate opponent,Rebel group,,0,Civilians,,0,4,1,3,1,ALG-1997-3-XXX615-153,0,0,0,1,0,0,0,0,0,0,0,0,0,0,0,0,0,0,0,0,0,0,0,0,0,0,0,0,0,0,0,0,0,0,0,0,0,0,0,0,0,0,0,0,0,0,0,0,0,0,0,0,0,0,0,0,0,0,0,0,0,0,0,0,0,0,0,0,0,0,0,0,0,0,0,0,0,0,0,0,0,1,0,0,0,0,1,0,0,0,0,1,0,0,0,0,1,0,0,0,0,0,0,0,1,0,0,1,0,0,0,0,0,0,0,0,0,0,0,0,0,0,1,0,0,0,0,0,0,0,0,0,0,0,0,0,0,0,0,0,0,0,0,0,0,0,0,0,0,0,1,0,0,0,0,0,0,0,0,1,0,0,0,0,0,0,0,0,1,0,0,0,0,0,0,1,0,0,0,Algeria,Algeria,DZA,1997,DZA1997,Algeria,1997,DZA,85782302144.57027,1.099999939308077,2910.239243016479,0.0,5.73352275357187,0.0,25.43
2085,3,4262,XXX615 - Civilians,4868,3598,XXX615,1,Civilians,615,Algeria,Africa,"Reuters, 1997-09-15",1997,1997-01-01,1997-12-31,0,0,7,0,7,7,7,34.649194,.015864,1,1,None/Unknown,eliminate opponent,Rebel group,,0,Civilians,,0,4,1,3,1,ALG-1997-3-XXX615-124,0,0,0,1,0,0,0,0,0,0,0,0,0,0,0,0,0,0,0,0,0,0,0,0,0,0,0,0,0,0,0,0,0,0,0,0,0,0,0,0,0,0,0,0,0,0,0,0,0,0,0,0,0,0,0,0,0,0,0,0,0,0,0,0,0,0,0,0,0,0,0,0,0,0,0,0,0,0,0,0,0,1,0,0,0,0,0,1,0,0,0,1,0,0,0,0,1,0,0,0,0,0,0,0,1,0,0,1,0,0,0,0,0,0,0,0,0,0,0,0,0,0,1,0,0,0,0,0,0,0,0,0,0,0,0,0,0,0,0,0,0,0,0,0,0,0,0,0,0,0,1,0,0,0,0,0,0,0,0,1,0,0,0,0,0,0,0,0,1,0,0,0,0,0,0,1,0,0,0,Algeria,Algeria,DZA,1997,DZA1997,Algeria,1997,DZA,85782302144.57027,1.099999939308077,2910.239243016479,0.0,5.73352275357187,0.0,25.43
2300,4,14005,Government of Algeria - Opponents of Benjedid,10575,109,Government of Algeria,1226,Opponents of Benjedid,615,Algeria,Africa,"Reuters, 2/8/1992 FRESH SHOOTING ERUPTS IN ALGIERS.",1992,1992-02-08,1992-02-08,0,0,0,1,1,1,1,35.383333,5.366667,1,2,None/Unknown,spell,Security forces,,1,Political supporters,,0,3,3;6,1,3,ALG-1992-4-10575-5.2,0,0,0,1,0,0,0,0,0,0,0,0,0,0,0,0,0,0,0,0,0,0,0,0,0,0,0,0,0,0,0,0,0,0,0,0,0,0,0,0,0,0,0,0,0,0,0,0,0,0,0,0,0,0,0,0,0,0,0,0,0,0,0,0,0,0,0,0,0,0,0,0,0,0,0,0,0,0,0,0,0,1,0,0,0,0,0,0,1,0,0,0,1,0,0,1,0,0,0,0,0,0,0,0,0,1,0,0,0,0,1,0,0,0,0,0,0,0,0,0,0,1,0,0,0,0,0,0,0,0,0,0,0,0,0,0,0,0,0,0,0,0,0,0,0,0,0,0,0,0,1,0,0,0,0,1,1,0,0,0,0,0,0,0,0,0,0,1,0,0,0,0,0,0,0,0,1,0,0,Algeria,Algeria,DZA,1992,DZA1992,Algeria,1992,DZA,80936073063.95511,1.8000023031884638,3025.8395481745183,0.0,31.6696619117149,0.0,24.38
2408,3,706,Government of Algeria - Civilians,1173,109,Government of Algeria,1,Civilians,615,Algeria,Africa,"Reuters, 1991-06-27",1991,1991-06-25,1991-06-26,0,0,0,4,4,4,4,36.564634,3.593296,1,2,None/Unknown,spell,Security forces,,1,Political supporters,,0,1,5,1,1,ALG-1991-3-615-4,0,0,0,1,0,0,0,0,0,0,0,0,0,0,0,0,0,0,0,0,0,0,0,0,0,0,0,0,0,0,0,0,0,0,0,0,0,0,0,0,0,0,0,0,0,0,0,0,0,0,0,0,0,0,0,0,0,0,0,0,0,0,0,0,0,0,0,0,0,0,0,0,0,0,0,0,0,0,0,0,0,1,0,0,0,0,0,0,1,0,0,1,0,1,0,0,0,0,0,0,0,0,0,0,0,1,0,0,0,0,1,0,0,0,0,0,0,0,0,0,0,1,0,0,0,0,0,0,0,0,0,0,0,0,0,0,0,0,0,0,0,0,0,0,0,0,0,0,0,0,1,0,0,0,0,0,0,1,0,0,0,0,0,0,0,0,0,1,0,0,0,0,0,0,0,1,0,0,0,Algeria,Algeria,DZA,1991,DZA1991,Algeria,1991,DZA,79504981564.64198,-1.2000005855168183,3042.215909357671,0.0,25.8863869348513,0.0,20.6
2574,3,572,GIA - Civilians,1039,538,GIA,1,Civilians,615,Algeria,Africa,"Reuters News, 15 May 2002, ""UPDATE 2-Algerian political violence, bomb kill seven.",2002,2002-05-15,2002-05-15,0,0,5,0,5,5,5,36.716462,4.130081,1,1,None/Unknown,disrupt,Rebel group,,0,Civilians,,0,1,3;9,1,1,ALG-2002-3-1390-28,1,0,0,1,0,0,0,0,0,0,0,0,0,0,0,0,0,0,0,0,0,0,0,0,0,0,0,0,0,0,0,0,0,0,0,0,0,0,0,0,0,0,0,0,0,0,0,0,0,0,0,0,0,0,0,0,0,0,0,0,0,0,0,0,0,0,0,0,0,0,0,0,0,0,0,0,0,0,0,0,0,1,0,0,0,0,0,1,0,0,0,1,0,1,0,0,0,0,0,0,0,0,0,0,1,0,0,1,0,0,0,0,0,0,0,0,1,0,0,0,0,0,0,0,0,0,0,0,0,0,0,0,0,0,0,0,0,0,0,0,0,0,0,0,0,0,0,0,0,0,1,0,0,0,0,0,1,0,0,0,1,0,0,0,0,0,0,1,0,0,0,0,0,0,0,1,0,0,0,Algeria,Algeria,DZA,2002,DZA2002,Algeria,2002,DZA,105045784407.4661,5.599999996130194,3321.637760801435,0.0,1.41830192345051,-1.63456511497498,25.9
2581,4,14005,Government of Algeria - Opponents of Benjedid,10575,109,Government of Algeria,1226,Opponents of Benjedid,615,Algeria,Africa,"Reuters, 6/27/1991 ALGERIAN MILITANTS STEP UP VIOLENCE, SLIT SECURITY MAN'S THROAT.",1991,1991-06-25,1991-06-26,1,4,0,0,5,5,5,36.564634,3.593296,1,2,None/Unknown,spell,Security forces,,1,Political supporters,,0,3,5;6,1,1,ALG-1991-4-10575-7,0,0,0,1,0,0,0,0,0,0,0,0,0,0,0,0,0,0,0,0,0,0,0,0,0,0,0,0,0,0,0,0,0,0,0,0,0,0,0,0,0,0,0,0,0,0,0,0,0,0,0,0,0,0,0,0,0,0,0,0,0,0,0,0,0,0,0,0,0,0,0,0,0,0,0,0,0,0,0,0,0,1,0,0,0,0,0,0,1,0,0,0,1,0,0,1,0,0,0,0,0,0,0,0,0,1,0,0,0,0,1,0,0,0,0,0,0,0,0,0,0,1,0,0,0,0,0,0,0,0,0,0,0,0,0,0,0,0,0,0,0,0,0,0,0,0,0,0,0,0,1,0,0,0,0,1,0,1,0,0,0,0,0,0,0,0,0,1,0,0,0,0,0,0,0,1,0,0,0,Algeria,Algeria,DZA,1991,DZA1991,Algeria,1991,DZA,79504981564.64198,-1.2000005855168183,3042.215909357671,0.0,25.8863869348513,0.0,20.6
2586,1,386,Algeria:Government,830,109,Government of Algeria,539,AQIM,615,Algeria,Africa,"BBC Monitoring Middle East, 17 March 2009, Two roadside bombs kill four Algerian soldiers - paper      Agence France Presse, 17 March 2009, Algerian soldiers killed in ambush: press    BBC Monitoring Middle East, 19 March 2009, Saudi imam said urging Algerian militants to join ""policy of peace, reconciliati",2009,2009-03-16,2009-03-16,4,0,0,0,4,5,2,36.75,4.25,1,1,None/Unknown,disrupt,Security forces,,1,Rebel group,,0,2,6,2,1,ALG-2009-1-4-33,1,0,0,1,0,0,0,0,0,0,0,0,0,0,0,0,0,0,0,0,0,0,0,0,0,0,0,0,0,0,0,0,0,0,0,0,0,0,0,0,0,0,0,0,0,0,0,0,0,0,0,0,0,0,0,0,0,0,0,0,0,0,0,0,0,0,0,0,0,0,0,0,0,0,0,0,0,0,0,0,0,1,0,0,0,0,0,1,0,1,0,0,0,0,1,0,0,0,0,0,0,0,0,0,0,1,0,0,0,0,0,0,0,1,0,0,1,0,0,0,0,0,0,0,0,0,0,0,0,0,0,0,0,0,0,0,0,0,0,0,0,0,0,0,0,0,0,0,0,0,1,0,0,0,0,1,0,0,0,0,0,0,0,0,0,0,1,0,0,0,0,0,0,0,0,1,0,0,0,Algeria,Algeria,DZA,2009,DZA2009,Algeria,2009,DZA,136078288561.5132,1.5999999990051066,3866.295758284184,0.0,5.73706036145628,-1.19691348075867,10.16
2587,1,386,Algeria:Government,827,109,Government of Algeria,536,Takfir wa'l Hijra,615,Algeria,Africa,"Reuters, 12/7/1991 ALGERIA TROOPS KILL THREE IN HUNT FOR GUARD KILLERS.     BBC 2/13/1992 members of THE SECRET Al-Takfir wa al-Hijrah ORGANISATION arrested.",1991,1991-12-04,1991-12-05,0,2,1,1,4,4,4,36.763056,3.050556,1,1,"Sonkosi, Z. 1998. Scientia Militaria, South African Journal of Military Studies, Vol 28, Nr 2, 1998.",retaliate violent acts,Security forces,,1,Other,,-99,1,7,1,1,ALG-1991-1-2-1,1,0,0,1,0,0,0,0,0,0,0,0,0,0,0,0,0,0,0,0,0,0,0,0,0,0,0,0,0,0,0,0,0,0,0,0,0,0,0,0,0,0,0,0,0,0,0,0,0,0,0,0,0,0,0,0,0,0,0,0,0,0,0,0,0,0,0,0,0,0,0,0,0,0,0,0,0,0,0,0,0,1,0,0,0,0,0,1,0,1,0,0,0,1,0,0,0,0,0,0,0,0,0,0,0,1,0,0,0,1,0,0,0,0,0,0,0,0,0,0,0,0,0,1,0,0,0,0,0,0,0,0,0,0,0,0,0,0,0,0,0,0,0,0,0,0,0,0,0,0,1,0,0,0,0,0,0,0,0,0,0,1,0,0,0,0,0,1,0,0,0,0,0,0,0,1,0,0,0,Algeria,Algeria,DZA,1991,DZA1991,Algeria,1991,DZA,79504981564.64198,-1.2000005855168183,3042.215909357671,0.0,25.8863869348513,0.0,20.6
2593,4,14005,Government of Algeria - Opponents of Benjedid,10575,109,Government of Algeria,1226,Opponents of Benjedid,615,Algeria,Africa,"Reuters, 7/12/1991 ONE KILLED, 11 WOUNDED IN ALGIERS CLASH.",1991,1991-07-12,1991-07-12,0,1,0,0,1,1,1,36.763056,3.050556,1,0,"Sonkosi, Z. 1998. Scientia Militaria, South African Journal of Military Studies, Vol 28, Nr 2, 1998.",crack down on protest and/or riot,Security forces,,1,Political supporters,,0,1,5,1,1,ALG-1991-4-10575-12,0,0,0,1,0,0,0,0,0,0,0,0,0,0,0,0,0,0,0,0,0,0,0,0,0,0,0,0,0,0,0,0,0,0,0,0,0,0,0,0,0,0,0,0,0,0,0,0,0,0,0,0,0,0,0,0,0,0,0,0,0,0,0,0,0,0,0,0,0,0,0,0,0,0,0,0,0,0,0,0,0,1,0,0,0,0,1,0,0,0,0,0,1,1,0,0,0,0,0,0,0,0,0,0,0,1,0,0,0,0,1,0,0,0,0,0,0,0,1,0,0,0,0,0,0,0,0,0,0,0,0,0,0,0,0,0,0,0,0,0,0,0,0,0,0,0,0,0,0,0,1,0,0,0,0,0,0,1,0,0,0,0,0,0,0,0,0,1,0,0,0,0,0,0,0,1,0,0,0,Algeria,Algeria,DZA,1991,DZA1991,Algeria,1991,DZA,79504981564.64198,-1.2000005855168183,3042.215909357671,0.0,25.8863869348513,0.0,20.6
2715,1,386,Algeria:Government,828,109,Government of Algeria,537,AIS,615,Algeria,Africa,"Reuters, 2/13/1992 SIX SOLDIERS KILLED IN ALGIERS.",1992,1992-02-13,1992-02-13,6,0,0,0,6,6,6,36.763056,3.050556,1,1,"Sonkosi, Z. 1998. Scientia Militaria, South African Journal of Military Studies, Vol 28, Nr 2, 1998.",unclear,Security forces,,1,Political supporters,,0,2,6,1,3,ALG-1992-1-1-2,1,0,0,1,0,0,0,0,0,0,0,0,0,0,0,0,0,0,0,0,0,0,0,0,0,0,0,0,0,0,0,0,0,0,0,0,0,0,0,0,0,0,0,0,0,0,0,0,0,0,0,0,0,0,0,0,0,0,0,0,0,0,0,0,0,0,0,0,0,0,0,0,0,0,0,0,0,0,0,0,0,1,0,0,0,0,0,1,0,1,0,0,0,0,1,0,0,0,0,0,0,0,0,0,0,1,0,0,0,0,1,0,0,0,0,0,0,0,0,0,1,0,0,0,0,0,0,0,0,0,0,0,0,0,0,0,0,0,0,0,0,0,0,0,0,0,0,0,0,0,1,0,0,0,0,1,0,0,0,0,0,0,0,0,0,0,0,1,0,0,0,0,0,0,0,0,1,0,0,Algeria,Algeria,DZA,1992,DZA1992,Algeria,1992,DZA,80936073063.95511,1.8000023031884638,3025.8395481745183,0.0,31.6696619117149,0.0,24.38
2735,1,386,Algeria:Government,830,109,Government of Algeria,539,AQIM,615,Algeria,Africa,"BBC Monitoring Middle East, 16 March 2009, Five people said killed in ""terrorist"" attack east of Algiers           Agence France Presse,   16 March 2009 , Islamists kill five people in Algeria: reports        BBC Monitoring Middle East, 16 March 2009, Paper says five civilians killed by ""terrorists"" in eastern Algeria",2009,2009-03-15,2009-03-15,1,0,3,0,4,4,4,35.404167,8.124167,1,1,None/Unknown,disrupt,Rebel group,,0,Civilians,,0,1,1;9,2,1,ALG-2009-1-4-9999,1,0,0,1,0,0,0,0,0,0,0,0,0,0,0,0,0,0,0,0,0,0,0,0,0,0,0,0,0,0,0,0,0,0,0,0,0,0,0,0,0,0,0,0,0,0,0,0,0,0,0,0,0,0,0,0,0,0,0,0,0,0,0,0,0,0,0,0,0,0,0,0,0,0,0,0,0,0,0,0,0,1,0,0,0,0,0,1,0,1,0,0,0,1,0,0,0,0,0,0,0,0,0,0,1,0,0,1,0,0,0,0,0,0,0,0,1,0,0,0,0,0,0,0,0,0,0,0,0,0,0,0,0,0,0,0,0,0,0,0,0,0,0,0,0,0,0,0,0,0,1,0,0,0,0,0,0,0,0,1,1,0,0,0,0,0,1,0,0,0,0,0,0,0,0,1,0,0,0,Algeria,Algeria,DZA,2009,DZA2009,Algeria,2009,DZA,136078288561.5132,1.5999999990051066,3866.295758284184,0.0,5.73706036145628,-1.19691348075867,10.16
2783,1,386,Algeria:Government,830,109,Government of Algeria,539,AQIM,615,Algeria,Africa,"Reuters, 2006-10-13, ""Algerian rebels kill local government chief",2006,2006-10-12,2006-10-12,1,0,0,0,1,1,1,36.548285,3.894156,1,1,None/Unknown,eliminate opponent,Politicians,,0,Rebel group,,0,2,1,1,1,ALG-2006-1-4-59,1,0,0,1,0,0,0,0,0,0,0,0,0,0,0,0,0,0,0,0,0,0,0,0,0,0,0,0,0,0,0,0,0,0,0,0,0,0,0,0,0,0,0,0,0,0,0,0,0,0,0,0,0,0,0,0,0,0,0,0,0,0,0,0,0,0,0,0,0,0,0,0,0,0,0,0,0,0,0,0,0,1,0,0,0,0,0,1,0,1,0,0,0,0,1,0,0,0,0,0,0,0,1,0,0,0,0,0,0,0,0,0,0,1,0,0,0,0,0,0,0,0,1,0,0,0,0,0,0,0,0,0,0,0,0,0,0,0,0,0,0,0,0,0,0,0,0,0,0,0,1,0,0,0,0,0,0,0,0,1,0,0,0,0,0,0,0,1,0,0,0,0,0,0,0,1,0,0,0,Algeria,Algeria,DZA,2006,DZA2006,Algeria,2006,DZA,126495371616.91312,1.7000000057434903,3783.312964016031,0.0,2.31149918514424,-1.1264134645462,12.27
2790,3,572,GIA - Civilians,1039,538,GIA,1,Civilians,615,Algeria,Africa,"Reuters News, 30 May 2002, ""Algerian rebels kill 23 civilians before poll."" Second source: Reuters News, 30 May 2002, ""UPDATE 5-Algerian election marred by violence,large boycott.",2002,2002-05-30,2002-05-30,0,0,25,0,25,25,25,36.063793,1.400464,1,0,None/Unknown,disrupt,Rebel group,,0,Civilians,,0,1,3;9,1,2,ALG-2002-3-1390-30,1,0,0,1,0,0,0,0,0,0,0,0,0,0,0,0,0,0,0,0,0,0,0,0,0,0,0,0,0,0,0,0,0,0,0,0,0,0,0,0,0,0,0,0,0,0,0,0,0,0,0,0,0,0,0,0,0,0,0,0,0,0,0,0,0,0,0,0,0,0,0,0,0,0,0,0,0,0,0,0,0,1,0,0,0,0,1,0,0,0,0,1,0,1,0,0,0,0,0,0,0,0,0,0,1,0,0,1,0,0,0,0,0,0,0,0,1,0,0,0,0,0,0,0,0,0,0,0,0,0,0,0,0,0,0,0,0,0,0,0,0,0,0,0,0,0,0,0,0,0,1,0,0,0,0,0,1,0,0,0,1,0,0,0,0,0,0,1,0,0,0,0,0,0,1,0,0,0,0,Algeria,Algeria,DZA,2002,DZA2002,Algeria,2002,DZA,105045784407.4661,5.599999996130194,3321.637760801435,0.0,1.41830192345051,-1.63456511497498,25.9
2839,4,14005,Government of Algeria - Opponents of Benjedid,10575,109,Government of Algeria,1226,Opponents of Benjedid,615,Algeria,Africa,"Reuters, 2/4/1992 ALGERIAN ARMY SHOOTS DEAD TWO DEMONSTRATORS.",1992,1992-02-04,1992-02-04,0,2,0,0,2,2,2,35.555278,6.178611,1,1,"Sonkosi, Z. 1998. Scientia Militaria, South African Journal of Military Studies, Vol 28, Nr 2, 1998.",crack down on protest and/or riot,Security forces,,1,Political supporters,,0,1,5,1,3,ALG-1992-4-10575-2,0,0,0,1,0,0,0,0,0,0,0,0,0,0,0,0,0,0,0,0,0,0,0,0,0,0,0,0,0,0,0,0,0,0,0,0,0,0,0,0,0,0,0,0,0,0,0,0,0,0,0,0,0,0,0,0,0,0,0,0,0,0,0,0,0,0,0,0,0,0,0,0,0,0,0,0,0,0,0,0,0,1,0,0,0,0,0,1,0,0,0,0,1,1,0,0,0,0,0,0,0,0,0,0,0,1,0,0,0,0,1,0,0,0,0,0,0,0,1,0,0,0,0,0,0,0,0,0,0,0,0,0,0,0,0,0,0,0,0,0,0,0,0,0,0,0,0,0,0,0,1,0,0,0,0,0,0,1,0,0,0,0,0,0,0,0,0,1,0,0,0,0,0,0,0,0,1,0,0,Algeria,Algeria,DZA,1992,DZA1992,Algeria,1992,DZA,80936073063.95511,1.8000023031884638,3025.8395481745183,0.0,31.6696619117149,0.0,24.38
2883,1,386,Algeria:Government,830,109,Government of Algeria,539,AQIM,615,Algeria,Africa,"Reuters News, 11 February 2004, ""Algerian rebels kill six people - reports.",2004,2004-02-09,2004-02-09,2,0,0,0,2,2,2,36.817,4.3,1,0,None/Unknown,disrupt,Security forces,,1,Rebel group,,0,2,6,2,1,ALG-2004-1-4-22,1,0,0,1,0,0,0,0,0,0,0,0,0,0,0,0,0,0,0,0,0,0,0,0,0,0,0,0,0,0,0,0,0,0,0,0,0,0,0,0,0,0,0,0,0,0,0,0,0,0,0,0,0,0,0,0,0,0,0,0,0,0,0,0,0,0,0,0,0,0,0,0,0,0,0,0,0,0,0,0,0,1,0,0,0,0,1,0,0,1,0,0,0,0,1,0,0,0,0,0,0,0,0,0,0,1,0,0,0,0,0,0,0,1,0,0,1,0,0,0,0,0,0,0,0,0,0,0,0,0,0,0,0,0,0,0,0,0,0,0,0,0,0,0,0,0,0,0,0,0,1,0,0,0,0,1,0,0,0,0,0,0,0,0,0,0,1,0,0,0,0,0,0,0,0,1,0,0,0,Algeria,Algeria,DZA,2004,DZA2004,Algeria,2004,DZA,117451271364.13535,4.299999999769909,3612.7529803777607,0.0,3.96180030257187,-1.35918843746185,17.65
2950,4,14005,Government of Algeria - Opponents of Benjedid,10575,109,Government of Algeria,1226,Opponents of Benjedid,615,Algeria,Africa,"Reuters, 2/7/1992 VIOLENCE SWEEPS ALGERIAN CITIES, NINE REPORTED DEAD.",1992,1992-02-07,1992-02-07,0,0,0,1,1,1,1,35.555278,6.178611,1,2,None/Unknown,spell,Security forces,,1,Political supporters,,0,3,3;6,1,3,ALG-1992-4-10575-4.2,0,0,0,1,0,0,0,0,0,0,0,0,0,0,0,0,0,0,0,0,0,0,0,0,0,0,0,0,0,0,0,0,0,0,0,0,0,0,0,0,0,0,0,0,0,0,0,0,0,0,0,0,0,0,0,0,0,0,0,0,0,0,0,0,0,0,0,0,0,0,0,0,0,0,0,0,0,0,0,0,0,1,0,0,0,0,0,0,1,0,0,0,1,0,0,1,0,0,0,0,0,0,0,0,0,1,0,0,0,0,1,0,0,0,0,0,0,0,0,0,0,1,0,0,0,0,0,0,0,0,0,0,0,0,0,0,0,0,0,0,0,0,0,0,0,0,0,0,0,0,1,0,0,0,0,1,1,0,0,0,0,0,0,0,0,0,0,1,0,0,0,0,0,0,0,0,1,0,0,Algeria,Algeria,DZA,1992,DZA1992,Algeria,1992,DZA,80936073063.95511,1.8000023031884638,3025.8395481745183,0.0,31.6696619117149,0.0,24.38
2989,4,14005,Government of Algeria - Opponents of Benjedid,10575,109,Government of Algeria,1226,Opponents of Benjedid,615,Algeria,Africa,"Reuters, 6/13/1991 ALGERIAN UNREST KILLED 17, WOUNDED 219, SAYS AGENCY.",1991,1991-06-04,1991-06-10,3,0,14,0,17,50,17,28.0,3,1,0,"Sonkosi, Z. 1998. Scientia Militaria, South African Journal of Military Studies, Vol 28, Nr 2, 1998.",crack down on protest and/or riot,Security forces,,1,Political supporters,,0,2,5;6,1,1,ALG-1991-4-10575-1,0,0,0,1,0,0,0,0,0,0,0,0,0,0,0,0,0,0,0,0,0,0,0,0,0,0,0,0,0,0,0,0,0,0,0,0,0,0,0,0,0,0,0,0,0,0,0,0,0,0,0,0,0,0,0,0,0,0,0,0,0,0,0,0,0,0,0,0,0,0,0,0,0,0,0,0,0,0,0,0,0,1,0,0,0,0,1,0,0,0,0,0,1,0,1,0,0,0,0,0,0,0,0,0,0,1,0,0,0,0,1,0,0,0,0,0,0,0,1,0,0,0,0,0,0,0,0,0,0,0,0,0,0,0,0,0,0,0,0,0,0,0,0,0,0,0,0,0,0,0,1,0,0,0,0,1,0,1,0,0,0,0,0,0,0,0,0,1,0,0,0,0,0,0,0,1,0,0,0,Algeria,Algeria,DZA,1991,DZA1991,Algeria,1991,DZA,79504981564.64198,-1.2000005855168183,3042.215909357671,0.0,25.8863869348513,0.0,20.6
3082,3,572,GIA - Civilians,1039,538,GIA,1,Civilians,615,Algeria,Africa,"Reuters News, 8 May 2002, ""PRESS DIGEST - Algeria - May 8.",2002,2002-05-08,2002-05-08,0,0,3,0,3,3,3,36.8,5.766667,1,2,None/Unknown,spell,Rebel group,,0,Civilians,,0,1,9,1,1,ALG-2002-3-1390-25,1,0,0,1,0,0,0,0,0,0,0,0,0,0,0,0,0,0,0,0,0,0,0,0,0,0,0,0,0,0,0,0,0,0,0,0,0,0,0,0,0,0,0,0,0,0,0,0,0,0,0,0,0,0,0,0,0,0,0,0,0,0,0,0,0,0,0,0,0,0,0,0,0,0,0,0,0,0,0,0,0,1,0,0,0,0,0,0,1,0,0,1,0,1,0,0,0,0,0,0,0,0,0,0,1,0,0,1,0,0,0,0,0,0,0,0,0,0,0,0,0,1,0,0,0,0,0,0,0,0,0,0,0,0,0,0,0,0,0,0,0,0,0,0,0,0,0,0,0,0,1,0,0,0,0,0,0,0,0,0,1,0,0,0,0,0,0,1,0,0,0,0,0,0,0,1,0,0,0,Algeria,Algeria,DZA,2002,DZA2002,Algeria,2002,DZA,105045784407.4661,5.599999996130194,3321.637760801435,0.0,1.41830192345051,-1.63456511497498,25.9
3160,1,386,Algeria:Government,827,109,Government of Algeria,536,Takfir wa'l Hijra,615,Algeria,Africa,"BBC 12/11/1991 security forces kill 13 of ""last group"" involved in Guemar, attack.     BBC 2/13/1992 members of THE SECRET Al-Takfir wa al-Hijrah ORGANISATION arrested.",1991,1991-12-09,1991-12-09,4,13,0,0,17,17,17,33.483333,6.8,1,1,"Sonkosi, Z. 1998. Scientia Militaria, South African Journal of Military Studies, Vol 28, Nr 2, 1998.",retaliate violent acts,Security forces,,1,Other,,0,1,7,1,1,ALG-1991-1-2-3,1,0,0,1,0,0,0,0,0,0,0,0,0,0,0,0,0,0,0,0,0,0,0,0,0,0,0,0,0,0,0,0,0,0,0,0,0,0,0,0,0,0,0,0,0,0,0,0,0,0,0,0,0,0,0,0,0,0,0,0,0,0,0,0,0,0,0,0,0,0,0,0,0,0,0,0,0,0,0,0,0,1,0,0,0,0,0,1,0,1,0,0,0,1,0,0,0,0,0,0,0,0,0,0,0,1,0,0,0,1,0,0,0,0,0,0,0,0,0,0,0,0,0,1,0,0,0,0,0,0,0,0,0,0,0,0,0,0,0,0,0,0,0,0,0,0,0,0,0,0,1,0,0,0,0,0,0,0,0,0,0,1,0,0,0,0,0,1,0,0,0,0,0,0,0,1,0,0,0,Algeria,Algeria,DZA,1991,DZA1991,Algeria,1991,DZA,79504981564.64198,-1.2000005855168183,3042.215909357671,0.0,25.8863869348513,0.0,20.6
3211,3,572,GIA - Civilians,1039,538,GIA,1,Civilians,615,Algeria,Africa,"Agence France-Presse, 11 May 2002, ""Six civilians, 10 Islamic extremists killed in Algeria",2002,2002-05-08,2002-05-08,0,0,6,0,6,6,6,36.763056,3.050556,1,2,None/Unknown,spell,Rebel group,,0,Civilians,,0,1,9,1,1,ALG-2002-3-1390-26,1,0,0,1,0,0,0,0,0,0,0,0,0,0,0,0,0,0,0,0,0,0,0,0,0,0,0,0,0,0,0,0,0,0,0,0,0,0,0,0,0,0,0,0,0,0,0,0,0,0,0,0,0,0,0,0,0,0,0,0,0,0,0,0,0,0,0,0,0,0,0,0,0,0,0,0,0,0,0,0,0,1,0,0,0,0,0,0,1,0,0,1,0,1,0,0,0,0,0,0,0,0,0,0,1,0,0,1,0,0,0,0,0,0,0,0,0,0,0,0,0,1,0,0,0,0,0,0,0,0,0,0,0,0,0,0,0,0,0,0,0,0,0,0,0,0,0,0,0,0,1,0,0,0,0,0,0,0,0,0,1,0,0,0,0,0,0,1,0,0,0,0,0,0,0,1,0,0,0,Algeria,Algeria,DZA,2002,DZA2002,Algeria,2002,DZA,105045784407.4661,5.599999996130194,3321.637760801435,0.0,1.41830192345051,-1.63456511497498,25.9
3650,1,386,Algeria:Government,829,109,Government of Algeria,538,GIA,615,Algeria,Africa,"Reuters, 11/12/1997 Gunmen kill six in Algeria, six rebels die,",1997,1997-11-12,1997-11-12,1,0,0,0,1,1,1,36.38,3.901389,1,0,None/Unknown,eliminate opponent,Politicians,,-99,Unclear,,-99,2,1,3,3,ALG-1997-1-3-86,1,0,0,1,0,0,0,0,0,0,0,0,0,0,0,0,0,0,0,0,0,0,0,0,0,0,0,0,0,0,0,0,0,0,0,0,0,0,0,0,0,0,0,0,0,0,0,0,0,0,0,0,0,0,0,0,0,0,0,0,0,0,0,0,0,0,0,0,0,0,0,0,0,0,0,0,0,0,0,0,0,1,0,0,0,0,1,0,0,1,0,0,0,0,1,0,0,0,0,0,0,0,1,0,0,0,0,0,0,0,0,0,0,0,0,1,0,0,0,0,0,0,1,0,0,0,0,0,0,0,0,0,0,0,0,0,0,0,0,0,0,0,0,0,0,0,0,0,0,0,1,0,0,0,0,0,0,0,0,1,0,0,0,0,0,0,0,0,1,0,0,0,0,0,0,0,1,0,0,Algeria,Algeria,DZA,1997,DZA1997,Algeria,1997,DZA,85782302144.57027,1.099999939308077,2910.239243016479,0.0,5.73352275357187,0.0,25.43
3698,3,572,GIA - Civilians,1039,538,GIA,1,Civilians,615,Algeria,Africa,"Agence France-Presse, 2 May 2002, ""Algeria extremists kill 34 more civilians: security forces [Corrected 05/02/02]",2002,2002-05-01,2002-05-01,0,0,20,0,20,20,20,35.212222,2.318889,1,1,None/Unknown,disrupt,Rebel group,,0,Civilians,,0,1,9,1,1,ALG-2002-3-1390-23,1,0,0,1,0,0,0,0,0,0,0,0,0,0,0,0,0,0,0,0,0,0,0,0,0,0,0,0,0,0,0,0,0,0,0,0,0,0,0,0,0,0,0,0,0,0,0,0,0,0,0,0,0,0,0,0,0,0,0,0,0,0,0,0,0,0,0,0,0,0,0,0,0,0,0,0,0,0,0,0,0,1,0,0,0,0,0,1,0,0,0,1,0,1,0,0,0,0,0,0,0,0,0,0,1,0,0,1,0,0,0,0,0,0,0,0,1,0,0,0,0,0,0,0,0,0,0,0,0,0,0,0,0,0,0,0,0,0,0,0,0,0,0,0,0,0,0,0,0,0,1,0,0,0,0,0,0,0,0,0,1,0,0,0,0,0,0,1,0,0,0,0,0,0,0,1,0,0,0,Algeria,Algeria,DZA,2002,DZA2002,Algeria,2002,DZA,105045784407.4661,5.599999996130194,3321.637760801435,0.0,1.41830192345051,-1.63456511497498,25.9
3733,1,386,Algeria:Government,829,109,Government of Algeria,538,GIA,615,Algeria,Africa,"Reuters, 11/14/1995 Car bomb kills one in Algeria on eve of polls.",1995,1995-11-14,1995-11-14,0,0,1,0,1,1,1,36.6266,5.3339,1,0,None/Unknown,disrupt,Security forces,,1,Rebel group,,0,4,2,2,1,ALG-1995-1-3-178,1,0,0,1,0,0,0,0,0,0,0,0,0,0,0,0,0,0,0,0,0,0,0,0,0,0,0,0,0,0,0,0,0,0,0,0,0,0,0,0,0,0,0,0,0,0,0,0,0,0,0,0,0,0,0,0,0,0,0,0,0,0,0,0,0,0,0,0,0,0,0,0,0,0,0,0,0,0,0,0,0,1,0,0,0,0,1,0,0,1,0,0,0,0,0,0,1,0,0,0,0,0,0,0,0,1,0,0,0,0,0,0,0,1,0,0,1,0,0,0,0,0,0,0,0,0,0,0,0,0,0,0,0,0,0,0,0,0,0,0,0,0,0,0,0,0,0,0,0,0,1,0,0,0,1,0,0,0,0,0,0,0,0,0,0,0,1,0,0,0,0,0,0,0,0,1,0,0,0,Algeria,Algeria,DZA,1995,DZA1995,Algeria,1995,DZA,81507170839.1999,3.799994789840852,2862.1078682782077,35.3,29.7796264864999,0.0,31.84
3877,1,386,Algeria:Government,830,109,Government of Algeria,539,AQIM,615,Algeria,Africa,"BBC Monitoring Middle East - Political, 20 May 2002, ""Four municipal guards killed by armed group southwest of Algiers.",2002,2002-05-20,2002-05-20,4,0,0,0,4,4,4,36.306933,1.84816,1,2,None/Unknown,spell,Security forces,,1,Rebel group,,0,2,6,1,1,ALG-2002-1-4-37,1,0,0,1,0,0,0,0,0,0,0,0,0,0,0,0,0,0,0,0,0,0,0,0,0,0,0,0,0,0,0,0,0,0,0,0,0,0,0,0,0,0,0,0,0,0,0,0,0,0,0,0,0,0,0,0,0,0,0,0,0,0,0,0,0,0,0,0,0,0,0,0,0,0,0,0,0,0,0,0,0,1,0,0,0,0,0,0,1,1,0,0,0,0,1,0,0,0,0,0,0,0,0,0,0,1,0,0,0,0,0,0,0,1,0,0,0,0,0,0,0,1,0,0,0,0,0,0,0,0,0,0,0,0,0,0,0,0,0,0,0,0,0,0,0,0,0,0,0,0,1,0,0,0,0,1,0,0,0,0,0,0,0,0,0,0,0,1,0,0,0,0,0,0,0,1,0,0,0,Algeria,Algeria,DZA,2002,DZA2002,Algeria,2002,DZA,105045784407.4661,5.599999996130194,3321.637760801435,0.0,1.41830192345051,-1.63456511497498,25.9
3922,1,386,Algeria:Government,830,109,Government of Algeria,539,AQIM,615,Algeria,Africa,"BBC Monitoring Middle East, 18 April 2009, Algerian army defuses bomb in east, encircles ""terrorist"" group in west",2009,2009-04-09,2009-04-09,2,0,0,0,2,2,2,36.159444,2.660963,1,1,None/Unknown,disrupt,Security forces,,1,Rebel group,,0,2,6,2,1,ALG-2009-1-4-47,1,0,0,1,0,0,0,0,0,0,0,0,0,0,0,0,0,0,0,0,0,0,0,0,0,0,0,0,0,0,0,0,0,0,0,0,0,0,0,0,0,0,0,0,0,0,0,0,0,0,0,0,0,0,0,0,0,0,0,0,0,0,0,0,0,0,0,0,0,0,0,0,0,0,0,0,0,0,0,0,0,1,0,0,0,0,0,1,0,1,0,0,0,0,1,0,0,0,0,0,0,0,0,0,0,1,0,0,0,0,0,0,0,1,0,0,1,0,0,0,0,0,0,0,0,0,0,0,0,0,0,0,0,0,0,0,0,0,0,0,0,0,0,0,0,0,0,0,0,0,1,0,0,0,0,1,0,0,0,0,0,0,0,0,0,0,1,0,0,0,0,0,0,0,0,1,0,0,0,Algeria,Algeria,DZA,2009,DZA2009,Algeria,2009,DZA,136078288561.5132,1.5999999990051066,3866.295758284184,0.0,5.73706036145628,-1.19691348075867,10.16
4005,1,386,Algeria:Government,830,109,Government of Algeria,539,AQIM,615,Algeria,Africa,"Reuters News, 15 May 2002, ""UPDATE 2-Algerian political violence, bomb kill seven.",2002,2002-05-15,2002-05-15,0,2,0,0,2,2,2,36.470039,2.827699,1,2,None/Unknown,spell,Security forces,,1,Rebel group,,0,1,7,1,1,ALG-2002-1-4-36,1,0,0,1,0,0,0,0,0,0,0,0,0,0,0,0,0,0,0,0,0,0,0,0,0,0,0,0,0,0,0,0,0,0,0,0,0,0,0,0,0,0,0,0,0,0,0,0,0,0,0,0,0,0,0,0,0,0,0,0,0,0,0,0,0,0,0,0,0,0,0,0,0,0,0,0,0,0,0,0,0,1,0,0,0,0,0,0,1,1,0,0,0,1,0,0,0,0,0,0,0,0,0,0,0,1,0,0,0,0,0,0,0,1,0,0,0,0,0,0,0,1,0,0,0,0,0,0,0,0,0,0,0,0,0,0,0,0,0,0,0,0,0,0,0,0,0,0,0,0,1,0,0,0,0,0,0,0,0,0,0,1,0,0,0,0,0,1,0,0,0,0,0,0,0,1,0,0,0,Algeria,Algeria,DZA,2002,DZA2002,Algeria,2002,DZA,105045784407.4661,5.599999996130194,3321.637760801435,0.0,1.41830192345051,-1.63456511497498,25.9
4114,1,386,Algeria:Government,828,109,Government of Algeria,537,AIS,615,Algeria,Africa,"Reuters, 3/12/1992 ALGERIA SAYS 9,000 ARRESTED, 103 DIED IN UNREST.",1992,1992-01-01,1992-03-10,31,0,0,0,31,103,31,28.0,3,1,0,"Sonkosi, Z. 1998. Scientia Militaria, South African Journal of Military Studies, Vol 28, Nr 2, 1998.",eliminate opponent,Security forces,,1,Political supporters,,0,2,6,1,3,ALG-1992-1-1-1,1,0,0,1,0,0,0,0,0,0,0,0,0,0,0,0,0,0,0,0,0,0,0,0,0,0,0,0,0,0,0,0,0,0,0,0,0,0,0,0,0,0,0,0,0,0,0,0,0,0,0,0,0,0,0,0,0,0,0,0,0,0,0,0,0,0,0,0,0,0,0,0,0,0,0,0,0,0,0,0,0,1,0,0,0,0,1,0,0,1,0,0,0,0,1,0,0,0,0,0,0,0,0,0,0,1,0,0,0,0,1,0,0,0,0,0,0,0,0,0,0,0,1,0,0,0,0,0,0,0,0,0,0,0,0,0,0,0,0,0,0,0,0,0,0,0,0,0,0,0,1,0,0,0,0,1,0,0,0,0,0,0,0,0,0,0,0,1,0,0,0,0,0,0,0,0,1,0,0,Algeria,Algeria,DZA,1992,DZA1992,Algeria,1992,DZA,80936073063.95511,1.8000023031884638,3025.8395481745183,0.0,31.6696619117149,0.0,24.38
4127,4,14005,Government of Algeria - Opponents of Benjedid,10575,109,Government of Algeria,1226,Opponents of Benjedid,615,Algeria,Africa,"Reuters, 6/27/1991 ALGERIAN MILITANTS STEP UP VIOLENCE, SLIT SECURITY MAN'S THROAT.",1991,1991-06-27,1991-06-27,1,0,0,0,1,1,1,36.564634,3.593296,1,2,"Sonkosi, Z. 1998. Scientia Militaria, South African Journal of Military Studies, Vol 28, Nr 2, 1998.",spell,Security forces,,1,Political supporters,,0,2,6,1,1,ALG-1991-4-10575-9,0,0,0,1,0,0,0,0,0,0,0,0,0,0,0,0,0,0,0,0,0,0,0,0,0,0,0,0,0,0,0,0,0,0,0,0,0,0,0,0,0,0,0,0,0,0,0,0,0,0,0,0,0,0,0,0,0,0,0,0,0,0,0,0,0,0,0,0,0,0,0,0,0,0,0,0,0,0,0,0,0,1,0,0,0,0,0,0,1,0,0,0,1,0,1,0,0,0,0,0,0,0,0,0,0,1,0,0,0,0,1,0,0,0,0,0,0,0,0,0,0,1,0,0,0,0,0,0,0,0,0,0,0,0,0,0,0,0,0,0,0,0,0,0,0,0,0,0,0,0,1,0,0,0,0,1,0,0,0,0,0,0,0,0,0,0,0,1,0,0,0,0,0,0,0,1,0,0,0,Algeria,Algeria,DZA,1991,DZA1991,Algeria,1991,DZA,79504981564.64198,-1.2000005855168183,3042.215909357671,0.0,25.8863869348513,0.0,20.6
4136,3,573,AQIM - Civilians,1040,539,AQIM,1,Civilians,615,Algeria,Africa,"Reuters News, 11 February 2004, ""Algerian rebels kill six people - reports.",2004,2004-02-11,2004-02-11,0,0,4,0,4,4,4,36.8,5.766667,1,0,None/Unknown,disrupt,Rebel group,,0,Civilians,,0,1,3;9,2,1,ALG-2004-3-1391-4,1,0,0,1,0,0,0,0,0,0,0,0,0,0,0,0,0,0,0,0,0,0,0,0,0,0,0,0,0,0,0,0,0,0,0,0,0,0,0,0,0,0,0,0,0,0,0,0,0,0,0,0,0,0,0,0,0,0,0,0,0,0,0,0,0,0,0,0,0,0,0,0,0,0,0,0,0,0,0,0,0,1,0,0,0,0,1,0,0,0,0,1,0,1,0,0,0,0,0,0,0,0,0,0,1,0,0,1,0,0,0,0,0,0,0,0,1,0,0,0,0,0,0,0,0,0,0,0,0,0,0,0,0,0,0,0,0,0,0,0,0,0,0,0,0,0,0,0,0,0,1,0,0,0,0,0,1,0,0,0,1,0,0,0,0,0,1,0,0,0,0,0,0,0,0,1,0,0,0,Algeria,Algeria,DZA,2004,DZA2004,Algeria,2004,DZA,117451271364.13535,4.299999999769909,3612.7529803777607,0.0,3.96180030257187,-1.35918843746185,17.65
4162,1,386,Algeria:Government,829,109,Government of Algeria,538,GIA,615,Algeria,Africa,"Reuters, 2/10/1992 EIGHT ALGERIAN POLICE KILLED IN AMBUSHES.",1992,1992-02-10,1992-02-10,6,0,0,0,6,6,6,36.777328,3.056935,1,1,"Sonkosi, Z. 1998. Scientia Militaria, South African Journal of Military Studies, Vol 28, Nr 2, 1998.",disrupt,Security forces,,1,Political supporters,,0,2,6,1,3,ALG-1992-1-3-1,1,0,0,1,0,0,0,0,0,0,0,0,0,0,0,0,0,0,0,0,0,0,0,0,0,0,0,0,0,0,0,0,0,0,0,0,0,0,0,0,0,0,0,0,0,0,0,0,0,0,0,0,0,0,0,0,0,0,0,0,0,0,0,0,0,0,0,0,0,0,0,0,0,0,0,0,0,0,0,0,0,1,0,0,0,0,0,1,0,1,0,0,0,0,1,0,0,0,0,0,0,0,0,0,0,1,0,0,0,0,1,0,0,0,0,0,1,0,0,0,0,0,0,0,0,0,0,0,0,0,0,0,0,0,0,0,0,0,0,0,0,0,0,0,0,0,0,0,0,0,1,0,0,0,0,1,0,0,0,0,0,0,0,0,0,0,0,1,0,0,0,0,0,0,0,0,1,0,0,Algeria,Algeria,DZA,1992,DZA1992,Algeria,1992,DZA,80936073063.95511,1.8000023031884638,3025.8395481745183,0.0,31.6696619117149,0.0,24.38
4201,1,386,Algeria:Government,830,109,Government of Algeria,539,AQIM,615,Algeria,Africa,"Agence France Presse, 10 April 2009, Algeria's Bouteflika re-elected in landslide         ICG database (monthly summaries) 1/05/2009 http://www.crisisgroup.org/home/index.cfm?action=cw_search&l=1&t=1&cw_country=3&cw_date=",2009,2009-04-09,2009-04-09,1,0,0,0,1,1,1,35.404167,8.124167,1,1,None/Unknown,disrupt,Security forces,,1,Rebel group,,0,2,6,2,2,ALG-2009-1-4-46,1,0,0,1,0,0,0,0,0,0,0,0,0,0,0,0,0,0,0,0,0,0,0,0,0,0,0,0,0,0,0,0,0,0,0,0,0,0,0,0,0,0,0,0,0,0,0,0,0,0,0,0,0,0,0,0,0,0,0,0,0,0,0,0,0,0,0,0,0,0,0,0,0,0,0,0,0,0,0,0,0,1,0,0,0,0,0,1,0,1,0,0,0,0,1,0,0,0,0,0,0,0,0,0,0,1,0,0,0,0,0,0,0,1,0,0,1,0,0,0,0,0,0,0,0,0,0,0,0,0,0,0,0,0,0,0,0,0,0,0,0,0,0,0,0,0,0,0,0,0,1,0,0,0,0,1,0,0,0,0,0,0,0,0,0,0,1,0,0,0,0,0,0,0,1,0,0,0,0,Algeria,Algeria,DZA,2009,DZA2009,Algeria,2009,DZA,136078288561.5132,1.5999999990051066,3866.295758284184,0.0,5.73706036145628,-1.19691348075867,10.16
4216,1,386,Algeria:Government,827,109,Government of Algeria,536,Takfir wa'l Hijra,615,Algeria,Africa,"Reuters, 12/8/1991 ALGERIAN FORCES KILL NINE IN HUNT FOR, ""TAYEB THE AFGHAN"".   BBC 2/13/1992 members of THE SECRET Al-Takfir wa al-Hijrah ORGANISATION arrested.",1991,1991-12-07,1991-12-07,1,9,0,0,10,10,10,33.166667,7.25,1,1,"Sonkosi, Z. 1998. Scientia Militaria, South African Journal of Military Studies, Vol 28, Nr 2, 1998.",retaliate violent acts,Security forces,,1,Other,,0,1,7,1,1,ALG-1991-1-2-2,1,0,0,1,0,0,0,0,0,0,0,0,0,0,0,0,0,0,0,0,0,0,0,0,0,0,0,0,0,0,0,0,0,0,0,0,0,0,0,0,0,0,0,0,0,0,0,0,0,0,0,0,0,0,0,0,0,0,0,0,0,0,0,0,0,0,0,0,0,0,0,0,0,0,0,0,0,0,0,0,0,1,0,0,0,0,0,1,0,1,0,0,0,1,0,0,0,0,0,0,0,0,0,0,0,1,0,0,0,1,0,0,0,0,0,0,0,0,0,0,0,0,0,1,0,0,0,0,0,0,0,0,0,0,0,0,0,0,0,0,0,0,0,0,0,0,0,0,0,0,1,0,0,0,0,0,0,0,0,0,0,1,0,0,0,0,0,1,0,0,0,0,0,0,0,1,0,0,0,Algeria,Algeria,DZA,1991,DZA1991,Algeria,1991,DZA,79504981564.64198,-1.2000005855168183,3042.215909357671,0.0,25.8863869348513,0.0,20.6
4290,1,386,Algeria:Government,828,109,Government of Algeria,537,AIS,615,Algeria,Africa,"Reuters, 1/19/1992 GUNMEN KILL SOLDIER, IN FIRST POST-CHADLI ATTACKS.",1992,1992-01-18,1992-01-18,1,0,0,0,1,1,1,36.606366,3.087832,1,0,"Sonkosi, Z. 1998. Scientia Militaria, South African Journal of Military Studies, Vol 28, Nr 2, 1998.",overturn results,Security forces,,1,Political supporters,,0,2,6,1,3,ALG-1992-1-1-3,1,0,0,1,0,0,0,0,0,0,0,0,0,0,0,0,0,0,0,0,0,0,0,0,0,0,0,0,0,0,0,0,0,0,0,0,0,0,0,0,0,0,0,0,0,0,0,0,0,0,0,0,0,0,0,0,0,0,0,0,0,0,0,0,0,0,0,0,0,0,0,0,0,0,0,0,0,0,0,0,0,1,0,0,0,0,1,0,0,1,0,0,0,0,1,0,0,0,0,0,0,0,0,0,0,1,0,0,0,0,1,0,0,0,0,0,0,0,0,0,0,0,0,0,1,0,0,0,0,0,0,0,0,0,0,0,0,0,0,0,0,0,0,0,0,0,0,0,0,0,1,0,0,0,0,1,0,0,0,0,0,0,0,0,0,0,0,1,0,0,0,0,0,0,0,0,1,0,0,Algeria,Algeria,DZA,1992,DZA1992,Algeria,1992,DZA,80936073063.95511,1.8000023031884638,3025.8395481745183,0.0,31.6696619117149,0.0,24.38
4347,4,14005,Government of Algeria - Opponents of Benjedid,10575,109,Government of Algeria,1226,Opponents of Benjedid,615,Algeria,Africa,"Reuters, 2/7/1992 VIOLENCE SWEEPS ALGERIAN CITIES, NINE REPORTED DEAD.",1992,1992-02-07,1992-02-07,1,0,0,0,1,1,1,36.671664,2.740274,1,2,None/Unknown,spell,Security forces,,1,Political supporters,,0,3,3;6,1,3,ALG-1992-4-10575-4.5,0,0,0,1,0,0,0,0,0,0,0,0,0,0,0,0,0,0,0,0,0,0,0,0,0,0,0,0,0,0,0,0,0,0,0,0,0,0,0,0,0,0,0,0,0,0,0,0,0,0,0,0,0,0,0,0,0,0,0,0,0,0,0,0,0,0,0,0,0,0,0,0,0,0,0,0,0,0,0,0,0,1,0,0,0,0,0,0,1,0,0,0,1,0,0,1,0,0,0,0,0,0,0,0,0,1,0,0,0,0,1,0,0,0,0,0,0,0,0,0,0,1,0,0,0,0,0,0,0,0,0,0,0,0,0,0,0,0,0,0,0,0,0,0,0,0,0,0,0,0,1,0,0,0,0,1,1,0,0,0,0,0,0,0,0,0,0,1,0,0,0,0,0,0,0,0,1,0,0,Algeria,Algeria,DZA,1992,DZA1992,Algeria,1992,DZA,80936073063.95511,1.8000023031884638,3025.8395481745183,0.0,31.6696619117149,0.0,24.38
4429,3,572,GIA - Civilians,1039,538,GIA,1,Civilians,615,Algeria,Africa,"Agence France-Presse, 2 May 2002, ""Algeria extremists kill 34 more civilians: security forces [Corrected 05/02/02]",2002,2002-05-01,2002-05-01,0,0,3,0,3,3,3,36.15787,1.337795,1,1,None/Unknown,disrupt,Rebel group,,0,Civilians,,0,1,3;9,1,1,ALG-2002-3-1390-24,1,0,0,1,0,0,0,0,0,0,0,0,0,0,0,0,0,0,0,0,0,0,0,0,0,0,0,0,0,0,0,0,0,0,0,0,0,0,0,0,0,0,0,0,0,0,0,0,0,0,0,0,0,0,0,0,0,0,0,0,0,0,0,0,0,0,0,0,0,0,0,0,0,0,0,0,0,0,0,0,0,1,0,0,0,0,0,1,0,0,0,1,0,1,0,0,0,0,0,0,0,0,0,0,1,0,0,1,0,0,0,0,0,0,0,0,1,0,0,0,0,0,0,0,0,0,0,0,0,0,0,0,0,0,0,0,0,0,0,0,0,0,0,0,0,0,0,0,0,0,1,0,0,0,0,0,1,0,0,0,1,0,0,0,0,0,0,1,0,0,0,0,0,0,0,1,0,0,0,Algeria,Algeria,DZA,2002,DZA2002,Algeria,2002,DZA,105045784407.4661,5.599999996130194,3321.637760801435,0.0,1.41830192345051,-1.63456511497498,25.9
4483,4,14005,Government of Algeria - Opponents of Benjedid,10575,109,Government of Algeria,1226,Opponents of Benjedid,615,Algeria,Africa,"Reuters, 2/7/1992 VIOLENCE SWEEPS ALGERIAN CITIES, NINE REPORTED DEAD.",1992,1992-02-07,1992-02-07,0,0,0,2,2,2,2,36.763056,3.050556,1,2,None/Unknown,spell,Security forces,,1,Political supporters,,0,3,3;6,1,3,ALG-1992-4-10575-4.3,0,0,0,1,0,0,0,0,0,0,0,0,0,0,0,0,0,0,0,0,0,0,0,0,0,0,0,0,0,0,0,0,0,0,0,0,0,0,0,0,0,0,0,0,0,0,0,0,0,0,0,0,0,0,0,0,0,0,0,0,0,0,0,0,0,0,0,0,0,0,0,0,0,0,0,0,0,0,0,0,0,1,0,0,0,0,0,0,1,0,0,0,1,0,0,1,0,0,0,0,0,0,0,0,0,1,0,0,0,0,1,0,0,0,0,0,0,0,0,0,0,1,0,0,0,0,0,0,0,0,0,0,0,0,0,0,0,0,0,0,0,0,0,0,0,0,0,0,0,0,1,0,0,0,0,1,1,0,0,0,0,0,0,0,0,0,0,1,0,0,0,0,0,0,0,0,1,0,0,Algeria,Algeria,DZA,1992,DZA1992,Algeria,1992,DZA,80936073063.95511,1.8000023031884638,3025.8395481745183,0.0,31.6696619117149,0.0,24.38
4687,1,386,Algeria:Government,830,109,Government of Algeria,539,AQIM,615,Algeria,Africa,"Agence France-Presse, 6 May 2002, ""Armed Islamists kill 15 Algerian soldiers in ambush: report"" Second Source: Associated Press Newswires, 6 May 2002, ""Report: Islamic militants kill 15 Algerian soldiers in ambush",2002,2002-05-05,2002-05-05,15,3,0,0,18,18,18,36.711825,4.045914,1,2,None/Unknown,spell,Security forces,,1,Rebel group,,0,2,7,1,1,ALG-2002-1-4-33,1,0,0,1,0,0,0,0,0,0,0,0,0,0,0,0,0,0,0,0,0,0,0,0,0,0,0,0,0,0,0,0,0,0,0,0,0,0,0,0,0,0,0,0,0,0,0,0,0,0,0,0,0,0,0,0,0,0,0,0,0,0,0,0,0,0,0,0,0,0,0,0,0,0,0,0,0,0,0,0,0,1,0,0,0,0,0,0,1,1,0,0,0,0,1,0,0,0,0,0,0,0,0,0,0,1,0,0,0,0,0,0,0,1,0,0,0,0,0,0,0,1,0,0,0,0,0,0,0,0,0,0,0,0,0,0,0,0,0,0,0,0,0,0,0,0,0,0,0,0,1,0,0,0,0,0,0,0,0,0,0,1,0,0,0,0,0,1,0,0,0,0,0,0,0,1,0,0,0,Algeria,Algeria,DZA,2002,DZA2002,Algeria,2002,DZA,105045784407.4661,5.599999996130194,3321.637760801435,0.0,1.41830192345051,-1.63456511497498,25.9
4777,4,14005,Government of Algeria - Opponents of Benjedid,10575,109,Government of Algeria,1226,Opponents of Benjedid,615,Algeria,Africa,"Reuters, 2/7/1992 VIOLENCE SWEEPS ALGERIAN CITIES, NINE REPORTED DEAD.",1992,1992-02-07,1992-02-07,0,0,0,2,2,2,2,35.435833,7.143333,1,2,None/Unknown,spell,Security forces,,1,Political supporters,,0,3,3;6,1,3,ALG-1992-4-10575-4.6,0,0,0,1,0,0,0,0,0,0,0,0,0,0,0,0,0,0,0,0,0,0,0,0,0,0,0,0,0,0,0,0,0,0,0,0,0,0,0,0,0,0,0,0,0,0,0,0,0,0,0,0,0,0,0,0,0,0,0,0,0,0,0,0,0,0,0,0,0,0,0,0,0,0,0,0,0,0,0,0,0,1,0,0,0,0,0,0,1,0,0,0,1,0,0,1,0,0,0,0,0,0,0,0,0,1,0,0,0,0,1,0,0,0,0,0,0,0,0,0,0,1,0,0,0,0,0,0,0,0,0,0,0,0,0,0,0,0,0,0,0,0,0,0,0,0,0,0,0,0,1,0,0,0,0,1,1,0,0,0,0,0,0,0,0,0,0,1,0,0,0,0,0,0,0,0,1,0,0,Algeria,Algeria,DZA,1992,DZA1992,Algeria,1992,DZA,80936073063.95511,1.8000023031884638,3025.8395481745183,0.0,31.6696619117149,0.0,24.38
4780,4,14005,Government of Algeria - Opponents of Benjedid,10575,109,Government of Algeria,1226,Opponents of Benjedid,615,Algeria,Africa,"Reuters, 7/3/1991 TWO DEAD IN LAST 36 HOURS OF ALGERIAN UNREST, 172 ARRESTED.",1991,1991-07-02,1991-07-02,1,0,0,0,1,1,1,34.672787,3.262995,1,0,"Sonkosi, Z. 1998. Scientia Militaria, South African Journal of Military Studies, Vol 28, Nr 2, 1998.",crack down on protest and/or riot,Security forces,,1,Political supporters,,0,1,5,1,1,ALG-1991-4-10575-11.1,0,0,0,1,0,0,0,0,0,0,0,0,0,0,0,0,0,0,0,0,0,0,0,0,0,0,0,0,0,0,0,0,0,0,0,0,0,0,0,0,0,0,0,0,0,0,0,0,0,0,0,0,0,0,0,0,0,0,0,0,0,0,0,0,0,0,0,0,0,0,0,0,0,0,0,0,0,0,0,0,0,1,0,0,0,0,1,0,0,0,0,0,1,1,0,0,0,0,0,0,0,0,0,0,0,1,0,0,0,0,1,0,0,0,0,0,0,0,1,0,0,0,0,0,0,0,0,0,0,0,0,0,0,0,0,0,0,0,0,0,0,0,0,0,0,0,0,0,0,0,1,0,0,0,0,0,0,1,0,0,0,0,0,0,0,0,0,1,0,0,0,0,0,0,0,1,0,0,0,Algeria,Algeria,DZA,1991,DZA1991,Algeria,1991,DZA,79504981564.64198,-1.2000005855168183,3042.215909357671,0.0,25.8863869348513,0.0,20.6
4781,4,14005,Government of Algeria - Opponents of Benjedid,10575,109,Government of Algeria,1226,Opponents of Benjedid,615,Algeria,Africa,"Reuters, 2/3/1992 TWO DIED IN ALGERIA CLASHES, SAY SECURITY FORCES.",1992,1992-01-31,1992-01-31,0,0,0,2,2,2,2,33.8,2.865143,1,2,None/Unknown,spell,Security forces,,1,Political supporters,,0,1,3,1,3,ALG-1992-4-10575-1,0,0,0,1,0,0,0,0,0,0,0,0,0,0,0,0,0,0,0,0,0,0,0,0,0,0,0,0,0,0,0,0,0,0,0,0,0,0,0,0,0,0,0,0,0,0,0,0,0,0,0,0,0,0,0,0,0,0,0,0,0,0,0,0,0,0,0,0,0,0,0,0,0,0,0,0,0,0,0,0,0,1,0,0,0,0,0,0,1,0,0,0,1,1,0,0,0,0,0,0,0,0,0,0,0,1,0,0,0,0,1,0,0,0,0,0,0,0,0,0,0,1,0,0,0,0,0,0,0,0,0,0,0,0,0,0,0,0,0,0,0,0,0,0,0,0,0,0,0,0,1,0,0,0,0,0,1,0,0,0,0,0,0,0,0,0,0,1,0,0,0,0,0,0,0,0,1,0,0,Algeria,Algeria,DZA,1992,DZA1992,Algeria,1992,DZA,80936073063.95511,1.8000023031884638,3025.8395481745183,0.0,31.6696619117149,0.0,24.38
4784,4,14005,Government of Algeria - Opponents of Benjedid,10575,109,Government of Algeria,1226,Opponents of Benjedid,615,Algeria,Africa,"Reuters, 2/7/1992 VIOLENCE SWEEPS ALGERIAN CITIES, NINE REPORTED DEAD.",1992,1992-02-07,1992-02-07,0,0,0,2,2,2,2,36.264169,2.753926,1,2,None/Unknown,spell,Security forces,,1,Political supporters,,0,3,3;6,1,3,ALG-1992-4-10575-4.4,0,0,0,1,0,0,0,0,0,0,0,0,0,0,0,0,0,0,0,0,0,0,0,0,0,0,0,0,0,0,0,0,0,0,0,0,0,0,0,0,0,0,0,0,0,0,0,0,0,0,0,0,0,0,0,0,0,0,0,0,0,0,0,0,0,0,0,0,0,0,0,0,0,0,0,0,0,0,0,0,0,1,0,0,0,0,0,0,1,0,0,0,1,0,0,1,0,0,0,0,0,0,0,0,0,1,0,0,0,0,1,0,0,0,0,0,0,0,0,0,0,1,0,0,0,0,0,0,0,0,0,0,0,0,0,0,0,0,0,0,0,0,0,0,0,0,0,0,0,0,1,0,0,0,0,1,1,0,0,0,0,0,0,0,0,0,0,1,0,0,0,0,0,0,0,0,1,0,0,Algeria,Algeria,DZA,1992,DZA1992,Algeria,1992,DZA,80936073063.95511,1.8000023031884638,3025.8395481745183,0.0,31.6696619117149,0.0,24.38
4838,3,572,GIA - Civilians,1039,538,GIA,1,Civilians,615,Algeria,Africa,"Reuters News, 26 April 2002, ""Algerian rebels kill four civilians.",2002,2002-04-26,2002-04-26,0,0,4,0,4,4,4,35.375833,1.313056,1,1,None/Unknown,disrupt,Rebel group,,0,Civilians,,0,1,9,1,1,ALG-2002-3-1390-21,1,0,0,1,0,0,0,0,0,0,0,0,0,0,0,0,0,0,0,0,0,0,0,0,0,0,0,0,0,0,0,0,0,0,0,0,0,0,0,0,0,0,0,0,0,0,0,0,0,0,0,0,0,0,0,0,0,0,0,0,0,0,0,0,0,0,0,0,0,0,0,0,0,0,0,0,0,0,0,0,0,1,0,0,0,0,0,1,0,0,0,1,0,1,0,0,0,0,0,0,0,0,0,0,1,0,0,1,0,0,0,0,0,0,0,0,1,0,0,0,0,0,0,0,0,0,0,0,0,0,0,0,0,0,0,0,0,0,0,0,0,0,0,0,0,0,0,0,0,0,1,0,0,0,0,0,0,0,0,0,1,0,0,0,0,0,0,1,0,0,0,0,0,0,0,1,0,0,0,Algeria,Algeria,DZA,2002,DZA2002,Algeria,2002,DZA,105045784407.4661,5.599999996130194,3321.637760801435,0.0,1.41830192345051,-1.63456511497498,25.9
4848,3,572,GIA - Civilians,1039,538,GIA,1,Civilians,615,Algeria,Africa,"BBC Monitoring Middle East - Political, 16 May 2002, ""Three killed in ""terrorist"" attack south of Algiers.",2002,2002-05-15,2002-05-15,0,0,3,0,3,3,3,36.25,3.916667,1,2,None/Unknown,spell,Rebel group,,0,Civilians,,0,1,9,1,1,ALG-2002-3-1390-8585,1,0,0,1,0,0,0,0,0,0,0,0,0,0,0,0,0,0,0,0,0,0,0,0,0,0,0,0,0,0,0,0,0,0,0,0,0,0,0,0,0,0,0,0,0,0,0,0,0,0,0,0,0,0,0,0,0,0,0,0,0,0,0,0,0,0,0,0,0,0,0,0,0,0,0,0,0,0,0,0,0,1,0,0,0,0,0,0,1,0,0,1,0,1,0,0,0,0,0,0,0,0,0,0,1,0,0,1,0,0,0,0,0,0,0,0,0,0,0,0,0,1,0,0,0,0,0,0,0,0,0,0,0,0,0,0,0,0,0,0,0,0,0,0,0,0,0,0,0,0,1,0,0,0,0,0,0,0,0,0,1,0,0,0,0,0,0,1,0,0,0,0,0,0,0,1,0,0,0,Algeria,Algeria,DZA,2002,DZA2002,Algeria,2002,DZA,105045784407.4661,5.599999996130194,3321.637760801435,0.0,1.41830192345051,-1.63456511497498,25.9
4953,4,14005,Government of Algeria - Opponents of Benjedid,10575,109,Government of Algeria,1226,Opponents of Benjedid,615,Algeria,Africa,"Reuters, 12/29/1991 THREE KILLED IN ALGERIAN ELECTION EVE ATTACKS.",1991,1991-12-26,1991-12-26,2,1,0,0,3,3,3,36.7475,3.193056,1,1,"Sonkosi, Z. 1998. Scientia Militaria, South African Journal of Military Studies, Vol 28, Nr 2, 1998.",disrupt,Security forces,,1,Other,,0,2,6,1,1,ALG-1991-4-10575-13,0,0,0,1,0,0,0,0,0,0,0,0,0,0,0,0,0,0,0,0,0,0,0,0,0,0,0,0,0,0,0,0,0,0,0,0,0,0,0,0,0,0,0,0,0,0,0,0,0,0,0,0,0,0,0,0,0,0,0,0,0,0,0,0,0,0,0,0,0,0,0,0,0,0,0,0,0,0,0,0,0,1,0,0,0,0,0,1,0,0,0,0,1,0,1,0,0,0,0,0,0,0,0,0,0,1,0,0,0,1,0,0,0,0,0,0,1,0,0,0,0,0,0,0,0,0,0,0,0,0,0,0,0,0,0,0,0,0,0,0,0,0,0,0,0,0,0,0,0,0,1,0,0,0,0,1,0,0,0,0,0,0,0,0,0,0,0,1,0,0,0,0,0,0,0,1,0,0,0,Algeria,Algeria,DZA,1991,DZA1991,Algeria,1991,DZA,79504981564.64198,-1.2000005855168183,3042.215909357671,0.0,25.8863869348513,0.0,20.6
4962,1,386,Algeria:Government,830,109,Government of Algeria,539,AQIM,615,Algeria,Africa,"Reuters News, 13 May 2002, ""Algerian security forces kill four Islamist rebels.",2002,2002-05-12,2002-05-12,0,4,0,0,4,4,4,36.8,5.766667,1,1,None/Unknown,secure elections,Security forces,,1,Rebel group,,0,1,7,1,1,ALG-2002-1-4-34,1,0,0,1,0,0,0,0,0,0,0,0,0,0,0,0,0,0,0,0,0,0,0,0,0,0,0,0,0,0,0,0,0,0,0,0,0,0,0,0,0,0,0,0,0,0,0,0,0,0,0,0,0,0,0,0,0,0,0,0,0,0,0,0,0,0,0,0,0,0,0,0,0,0,0,0,0,0,0,0,0,1,0,0,0,0,0,1,0,1,0,0,0,1,0,0,0,0,0,0,0,0,0,0,0,1,0,0,0,0,0,0,0,1,0,0,0,0,0,0,0,0,0,0,0,1,0,0,0,0,0,0,0,0,0,0,0,0,0,0,0,0,0,0,1,0,0,0,0,0,1,0,0,0,0,0,0,0,0,0,0,1,0,0,0,0,0,1,0,0,0,0,0,0,0,1,0,0,0,Algeria,Algeria,DZA,2002,DZA2002,Algeria,2002,DZA,105045784407.4661,5.599999996130194,3321.637760801435,0.0,1.41830192345051,-1.63456511497498,25.9
5040,3,1034,AIS - Civilians,1507,537,AIS,1,Civilians,615,Algeria,Africa,"Reuters, 1992-10-19",1992,1992-02-08,1992-02-08,0,0,2,0,2,2,2,35.59,1.139,1,2,None/Unknown,spell,Security forces,,1,Political supporters,,0,3,3;6,1,3,ALG-1992-3-1389-6,0,0,0,1,0,0,0,0,0,0,0,0,0,0,0,0,0,0,0,0,0,0,0,0,0,0,0,0,0,0,0,0,0,0,0,0,0,0,0,0,0,0,0,0,0,0,0,0,0,0,0,0,0,0,0,0,0,0,0,0,0,0,0,0,0,0,0,0,0,0,0,0,0,0,0,0,0,0,0,0,0,1,0,0,0,0,0,0,1,0,0,1,0,0,0,1,0,0,0,0,0,0,0,0,0,1,0,0,0,0,1,0,0,0,0,0,0,0,0,0,0,1,0,0,0,0,0,0,0,0,0,0,0,0,0,0,0,0,0,0,0,0,0,0,0,0,0,0,0,0,1,0,0,0,0,1,1,0,0,0,0,0,0,0,0,0,0,1,0,0,0,0,0,0,0,0,1,0,0,Algeria,Algeria,DZA,1992,DZA1992,Algeria,1992,DZA,80936073063.95511,1.8000023031884638,3025.8395481745183,0.0,31.6696619117149,0.0,24.38
5079,1,386,Algeria:Government,830,109,Government of Algeria,539,AQIM,615,Algeria,Africa,"Agence France-Presse, 23 May 2002, ""Ten soldiers killed as violence sweeps Algeria before vote [Corrected 05/23/02]",2002,2002-05-22,2002-05-22,10,0,0,0,10,10,10,36.763056,3.050556,1,0,None/Unknown,secure elections,Security forces,,1,Rebel group,,0,1,7,1,1,ALG-2002-1-4-39,1,0,0,1,0,0,0,0,0,0,0,0,0,0,0,0,0,0,0,0,0,0,0,0,0,0,0,0,0,0,0,0,0,0,0,0,0,0,0,0,0,0,0,0,0,0,0,0,0,0,0,0,0,0,0,0,0,0,0,0,0,0,0,0,0,0,0,0,0,0,0,0,0,0,0,0,0,0,0,0,0,1,0,0,0,0,1,0,0,1,0,0,0,1,0,0,0,0,0,0,0,0,0,0,0,1,0,0,0,0,0,0,0,1,0,0,0,0,0,0,0,0,0,0,0,1,0,0,0,0,0,0,0,0,0,0,0,0,0,0,0,0,0,0,1,0,0,0,0,0,1,0,0,0,0,0,0,0,0,0,0,1,0,0,0,0,0,1,0,0,0,0,0,0,0,1,0,0,0,Algeria,Algeria,DZA,2002,DZA2002,Algeria,2002,DZA,105045784407.4661,5.599999996130194,3321.637760801435,0.0,1.41830192345051,-1.63456511497498,25.9
5080,1,386,Algeria:Government,829,109,Government of Algeria,538,GIA,615,Algeria,Africa,"Reuters, 2/13/1992 THREE KILLED IN ATTACK ON ALGIERS BARRACKS.",1992,1992-02-13,1992-02-13,1,2,0,0,3,3,3,36.763056,3.050556,1,2,None/Unknown,spell,Security forces,,1,Political supporters,,0,2,6,1,3,ALG-1992-1-3-2,1,0,0,1,0,0,0,0,0,0,0,0,0,0,0,0,0,0,0,0,0,0,0,0,0,0,0,0,0,0,0,0,0,0,0,0,0,0,0,0,0,0,0,0,0,0,0,0,0,0,0,0,0,0,0,0,0,0,0,0,0,0,0,0,0,0,0,0,0,0,0,0,0,0,0,0,0,0,0,0,0,1,0,0,0,0,0,0,1,1,0,0,0,0,1,0,0,0,0,0,0,0,0,0,0,1,0,0,0,0,1,0,0,0,0,0,0,0,0,0,0,1,0,0,0,0,0,0,0,0,0,0,0,0,0,0,0,0,0,0,0,0,0,0,0,0,0,0,0,0,1,0,0,0,0,1,0,0,0,0,0,0,0,0,0,0,0,1,0,0,0,0,0,0,0,0,1,0,0,Algeria,Algeria,DZA,1992,DZA1992,Algeria,1992,DZA,80936073063.95511,1.8000023031884638,3025.8395481745183,0.0,31.6696619117149,0.0,24.38
5114,1,386,Algeria:Government,830,109,Government of Algeria,539,AQIM,615,Algeria,Africa,"BBC Monitoring Middle East - Political, 21 May 2002, ""Gendarme assassinated south of Algiers.",2002,2002-05-20,2002-05-20,1,0,0,0,1,1,1,36.470039,2.827699,1,2,None/Unknown,spell,Security forces,,1,Rebel group,,0,2,6,1,1,ALG-2002-1-4-38,1,0,0,1,0,0,0,0,0,0,0,0,0,0,0,0,0,0,0,0,0,0,0,0,0,0,0,0,0,0,0,0,0,0,0,0,0,0,0,0,0,0,0,0,0,0,0,0,0,0,0,0,0,0,0,0,0,0,0,0,0,0,0,0,0,0,0,0,0,0,0,0,0,0,0,0,0,0,0,0,0,1,0,0,0,0,0,0,1,1,0,0,0,0,1,0,0,0,0,0,0,0,0,0,0,1,0,0,0,0,0,0,0,1,0,0,0,0,0,0,0,1,0,0,0,0,0,0,0,0,0,0,0,0,0,0,0,0,0,0,0,0,0,0,0,0,0,0,0,0,1,0,0,0,0,1,0,0,0,0,0,0,0,0,0,0,0,1,0,0,0,0,0,0,0,1,0,0,0,Algeria,Algeria,DZA,2002,DZA2002,Algeria,2002,DZA,105045784407.4661,5.599999996130194,3321.637760801435,0.0,1.41830192345051,-1.63456511497498,25.9
5129,1,386,Algeria:Government,828,109,Government of Algeria,537,AIS,615,Algeria,Africa,"Reuters, 2/10/1992 EIGHT ALGERIAN POLICE KILLED IN AMBUSHES.",1992,1992-02-10,1992-02-10,2,0,0,0,2,2,2,36.743276,3.717296,1,1,"Sonkosi, Z. 1998. Scientia Militaria, South African Journal of Military Studies, Vol 28, Nr 2, 1998.",unclear,Security forces,,1,Political supporters,,0,2,6,1,3,ALG-1992-1-1-4,1,0,0,1,0,0,0,0,0,0,0,0,0,0,0,0,0,0,0,0,0,0,0,0,0,0,0,0,0,0,0,0,0,0,0,0,0,0,0,0,0,0,0,0,0,0,0,0,0,0,0,0,0,0,0,0,0,0,0,0,0,0,0,0,0,0,0,0,0,0,0,0,0,0,0,0,0,0,0,0,0,1,0,0,0,0,0,1,0,1,0,0,0,0,1,0,0,0,0,0,0,0,0,0,0,1,0,0,0,0,1,0,0,0,0,0,0,0,0,0,1,0,0,0,0,0,0,0,0,0,0,0,0,0,0,0,0,0,0,0,0,0,0,0,0,0,0,0,0,0,1,0,0,0,0,1,0,0,0,0,0,0,0,0,0,0,0,1,0,0,0,0,0,0,0,0,1,0,0,Algeria,Algeria,DZA,1992,DZA1992,Algeria,1992,DZA,80936073063.95511,1.8000023031884638,3025.8395481745183,0.0,31.6696619117149,0.0,24.38
5165,1,386,Algeria:Government,830,109,Government of Algeria,539,AQIM,615,Algeria,Africa,"Agence France Presse,   27 March 2009 Algerian president takes election campaign to Kabylie",2009,2009-03-26,2009-03-26,1,0,0,0,1,1,1,28.0,3,1,1,None/Unknown,disrupt,Security forces,,1,Rebel group,,0,2,6,2,1,ALG-2009-1-4-9997,1,0,0,1,0,0,0,0,0,0,0,0,0,0,0,0,0,0,0,0,0,0,0,0,0,0,0,0,0,0,0,0,0,0,0,0,0,0,0,0,0,0,0,0,0,0,0,0,0,0,0,0,0,0,0,0,0,0,0,0,0,0,0,0,0,0,0,0,0,0,0,0,0,0,0,0,0,0,0,0,0,1,0,0,0,0,0,1,0,1,0,0,0,0,1,0,0,0,0,0,0,0,0,0,0,1,0,0,0,0,0,0,0,1,0,0,1,0,0,0,0,0,0,0,0,0,0,0,0,0,0,0,0,0,0,0,0,0,0,0,0,0,0,0,0,0,0,0,0,0,1,0,0,0,0,1,0,0,0,0,0,0,0,0,0,0,1,0,0,0,0,0,0,0,0,1,0,0,0,Algeria,Algeria,DZA,2009,DZA2009,Algeria,2009,DZA,136078288561.5132,1.5999999990051066,3866.295758284184,0.0,5.73706036145628,-1.19691348075867,10.16
5215,4,14005,Government of Algeria - Opponents of Benjedid,10575,109,Government of Algeria,1226,Opponents of Benjedid,615,Algeria,Africa,"Reuters, 2/8/1992 FRESH SHOOTING ERUPTS IN ALGIERS.",1992,1992-02-08,1992-02-08,0,0,0,8,8,8,8,36.763056,3.050556,1,2,None/Unknown,spell,Security forces,,1,Political supporters,,0,3,3;6,1,3,ALG-1992-4-10575-5.1,0,0,0,1,0,0,0,0,0,0,0,0,0,0,0,0,0,0,0,0,0,0,0,0,0,0,0,0,0,0,0,0,0,0,0,0,0,0,0,0,0,0,0,0,0,0,0,0,0,0,0,0,0,0,0,0,0,0,0,0,0,0,0,0,0,0,0,0,0,0,0,0,0,0,0,0,0,0,0,0,0,1,0,0,0,0,0,0,1,0,0,0,1,0,0,1,0,0,0,0,0,0,0,0,0,1,0,0,0,0,1,0,0,0,0,0,0,0,0,0,0,1,0,0,0,0,0,0,0,0,0,0,0,0,0,0,0,0,0,0,0,0,0,0,0,0,0,0,0,0,1,0,0,0,0,1,1,0,0,0,0,0,0,0,0,0,0,1,0,0,0,0,0,0,0,0,1,0,0,Algeria,Algeria,DZA,1992,DZA1992,Algeria,1992,DZA,80936073063.95511,1.8000023031884638,3025.8395481745183,0.0,31.6696619117149,0.0,24.38
5217,4,14005,Government of Algeria - Opponents of Benjedid,10575,109,Government of Algeria,1226,Opponents of Benjedid,615,Algeria,Africa,"Reuters, 2/7/1992 VIOLENCE SWEEPS ALGERIAN CITIES, NINE REPORTED DEAD.",1992,1992-02-07,1992-02-07,0,0,0,1,1,1,1,36.152811,5.690159,1,2,None/Unknown,spell,Security forces,,1,Political supporters,,0,3,3;6,1,3,ALG-1992-4-10575-4.1,0,0,0,1,0,0,0,0,0,0,0,0,0,0,0,0,0,0,0,0,0,0,0,0,0,0,0,0,0,0,0,0,0,0,0,0,0,0,0,0,0,0,0,0,0,0,0,0,0,0,0,0,0,0,0,0,0,0,0,0,0,0,0,0,0,0,0,0,0,0,0,0,0,0,0,0,0,0,0,0,0,1,0,0,0,0,0,0,1,0,0,0,1,0,0,1,0,0,0,0,0,0,0,0,0,1,0,0,0,0,1,0,0,0,0,0,0,0,0,0,0,1,0,0,0,0,0,0,0,0,0,0,0,0,0,0,0,0,0,0,0,0,0,0,0,0,0,0,0,0,1,0,0,0,0,1,1,0,0,0,0,0,0,0,0,0,0,1,0,0,0,0,0,0,0,0,1,0,0,Algeria,Algeria,DZA,1992,DZA1992,Algeria,1992,DZA,80936073063.95511,1.8000023031884638,3025.8395481745183,0.0,31.6696619117149,0.0,24.38
5255,1,386,Algeria:Government,829,109,Government of Algeria,538,GIA,615,Algeria,Africa,"Reuters, 11/12/1995 Five killed in Algerian car bombing.",1995,1995-11-11,1995-11-11,0,0,5,0,5,5,5,36.470039,2.827699,1,0,None/Unknown,preemptive violence,Security forces,,1,Civilians,,0,4,3,2,1,ALG-1995-1-3-172,1,0,0,1,0,0,0,0,0,0,0,0,0,0,0,0,0,0,0,0,0,0,0,0,0,0,0,0,0,0,0,0,0,0,0,0,0,0,0,0,0,0,0,0,0,0,0,0,0,0,0,0,0,0,0,0,0,0,0,0,0,0,0,0,0,0,0,0,0,0,0,0,0,0,0,0,0,0,0,0,0,1,0,0,0,0,1,0,0,1,0,0,0,0,0,0,1,0,0,0,0,0,0,0,0,1,0,1,0,0,0,0,0,0,0,0,0,0,0,0,0,0,0,0,0,0,1,0,0,0,0,0,0,0,0,0,0,0,0,0,0,0,0,0,0,0,0,0,0,0,1,0,0,0,0,0,1,0,0,0,0,0,0,0,0,0,1,0,0,0,0,0,0,0,0,1,0,0,0,Algeria,Algeria,DZA,1995,DZA1995,Algeria,1995,DZA,81507170839.1999,3.799994789840852,2862.1078682782077,35.3,29.7796264864999,0.0,31.84
5328,4,14005,Government of Algeria - Opponents of Benjedid,10575,109,Government of Algeria,1226,Opponents of Benjedid,615,Algeria,Africa,"Reuters, 2/8/1992 FRESH SHOOTING ERUPTS IN ALGIERS.",1992,1992-02-08,1992-02-08,0,0,0,7,7,7,7,36.728291,3.087845,1,2,None/Unknown,spell,Security forces,,1,Political supporters,,0,3,3;6,1,3,ALG-1992-4-10575-5.4,0,0,0,1,0,0,0,0,0,0,0,0,0,0,0,0,0,0,0,0,0,0,0,0,0,0,0,0,0,0,0,0,0,0,0,0,0,0,0,0,0,0,0,0,0,0,0,0,0,0,0,0,0,0,0,0,0,0,0,0,0,0,0,0,0,0,0,0,0,0,0,0,0,0,0,0,0,0,0,0,0,1,0,0,0,0,0,0,1,0,0,0,1,0,0,1,0,0,0,0,0,0,0,0,0,1,0,0,0,0,1,0,0,0,0,0,0,0,0,0,0,1,0,0,0,0,0,0,0,0,0,0,0,0,0,0,0,0,0,0,0,0,0,0,0,0,0,0,0,0,1,0,0,0,0,1,1,0,0,0,0,0,0,0,0,0,0,1,0,0,0,0,0,0,0,0,1,0,0,Algeria,Algeria,DZA,1992,DZA1992,Algeria,1992,DZA,80936073063.95511,1.8000023031884638,3025.8395481745183,0.0,31.6696619117149,0.0,24.38
5708,3,572,GIA - Civilians,1039,538,GIA,1,Civilians,615,Algeria,Africa,"Reuters News, 24 April 2002, ""Algeria official says suspected rebels kill 16 nomads.",2002,2002-04-23,2002-04-23,0,0,16,0,16,16,16,35.375833,1.313056,1,1,None/Unknown,disrupt,Rebel group,,0,Civilians,,0,1,3;9,1,1,ALG-2002-3-1390-20,1,0,0,1,0,0,0,0,0,0,0,0,0,0,0,0,0,0,0,0,0,0,0,0,0,0,0,0,0,0,0,0,0,0,0,0,0,0,0,0,0,0,0,0,0,0,0,0,0,0,0,0,0,0,0,0,0,0,0,0,0,0,0,0,0,0,0,0,0,0,0,0,0,0,0,0,0,0,0,0,0,1,0,0,0,0,0,1,0,0,0,1,0,1,0,0,0,0,0,0,0,0,0,0,1,0,0,1,0,0,0,0,0,0,0,0,1,0,0,0,0,0,0,0,0,0,0,0,0,0,0,0,0,0,0,0,0,0,0,0,0,0,0,0,0,0,0,0,0,0,1,0,0,0,0,0,1,0,0,0,1,0,0,0,0,0,0,1,0,0,0,0,0,0,0,1,0,0,0,Algeria,Algeria,DZA,2002,DZA2002,Algeria,2002,DZA,105045784407.4661,5.599999996130194,3321.637760801435,0.0,1.41830192345051,-1.63456511497498,25.9
5751,1,386,Algeria:Government,827,109,Government of Algeria,536,Takfir wa'l Hijra,615,Algeria,Africa,"Reuters, 11/29/1991 GUNMEN KILL THREE ALGERIAN BORDER, GUARDS DURING MANHUNT.",1991,1991-11-29,1991-11-29,3,0,0,0,3,3,3,33.333333,6.883333,1,1,"Sonkosi, Z. 1998. Scientia Militaria, South African Journal of Military Studies, Vol 28, Nr 2, 1998.",disrupt,Security forces,,1,Other,,0,2,6,1,1,ALG-1991-1-2-4,1,0,0,1,0,0,0,0,0,0,0,0,0,0,0,0,0,0,0,0,0,0,0,0,0,0,0,0,0,0,0,0,0,0,0,0,0,0,0,0,0,0,0,0,0,0,0,0,0,0,0,0,0,0,0,0,0,0,0,0,0,0,0,0,0,0,0,0,0,0,0,0,0,0,0,0,0,0,0,0,0,1,0,0,0,0,0,1,0,1,0,0,0,0,1,0,0,0,0,0,0,0,0,0,0,1,0,0,0,1,0,0,0,0,0,0,1,0,0,0,0,0,0,0,0,0,0,0,0,0,0,0,0,0,0,0,0,0,0,0,0,0,0,0,0,0,0,0,0,0,1,0,0,0,0,1,0,0,0,0,0,0,0,0,0,0,0,1,0,0,0,0,0,0,0,1,0,0,0,Algeria,Algeria,DZA,1991,DZA1991,Algeria,1991,DZA,79504981564.64198,-1.2000005855168183,3042.215909357671,0.0,25.8863869348513,0.0,20.6
5875,1,386,Algeria:Government,830,109,Government of Algeria,539,AQIM,615,Algeria,Africa,"BBC Monitoring Middle East, 20 March 2004, ""Algeria: Armed terrorists kill senior militia leader in Jijel",2004,2004-03-17,2004-03-17,1,0,0,0,1,1,1,36.8,5.766667,1,0,None/Unknown,eliminate opponent,Milita,,1,Rebel group,,0,2,7,2,1,ALG-2004-1-4-174173,1,0,0,1,0,0,0,0,0,0,0,0,0,0,0,0,0,0,0,0,0,0,0,0,0,0,0,0,0,0,0,0,0,0,0,0,0,0,0,0,0,0,0,0,0,0,0,0,0,0,0,0,0,0,0,0,0,0,0,0,0,0,0,0,0,0,0,0,0,0,0,0,0,0,0,0,0,0,0,0,0,1,0,0,0,0,1,0,0,1,0,0,0,0,1,0,0,0,0,1,0,0,0,0,0,0,0,0,0,0,0,0,0,1,0,0,0,0,0,0,0,0,1,0,0,0,0,0,0,0,0,0,0,0,0,0,0,0,0,0,0,0,0,0,0,0,0,0,0,0,1,0,0,0,0,0,0,0,0,0,0,1,0,0,0,0,1,0,0,0,0,0,0,0,0,1,0,0,0,Algeria,Algeria,DZA,2004,DZA2004,Algeria,2004,DZA,117451271364.13535,4.299999999769909,3612.7529803777607,0.0,3.96180030257187,-1.35918843746185,17.65
6073,1,386,Algeria:Government,830,109,Government of Algeria,539,AQIM,615,Algeria,Africa,"BBC Monitoring Middle East - Political, 28 May 2002, ""Two militia members killed in ambush.",2002,2002-05-27,2002-05-27,2,0,0,0,2,2,2,32.385332,-.842693,1,2,None/Unknown,spell,Security forces,,1,Rebel group,,0,2,6,1,1,ALG-2002-1-4-40,1,0,0,1,0,0,0,0,0,0,0,0,0,0,0,0,0,0,0,0,0,0,0,0,0,0,0,0,0,0,0,0,0,0,0,0,0,0,0,0,0,0,0,0,0,0,0,0,0,0,0,0,0,0,0,0,0,0,0,0,0,0,0,0,0,0,0,0,0,0,0,0,0,0,0,0,0,0,0,0,0,1,0,0,0,0,0,0,1,1,0,0,0,0,1,0,0,0,0,0,0,0,0,0,0,1,0,0,0,0,0,0,0,1,0,0,0,0,0,0,0,1,0,0,0,0,0,0,0,0,0,0,0,0,0,0,0,0,0,0,0,0,0,0,0,0,0,0,0,0,1,0,0,0,0,1,0,0,0,0,0,0,0,0,0,0,0,1,0,0,0,0,0,0,0,1,0,0,0,Algeria,Algeria,DZA,2002,DZA2002,Algeria,2002,DZA,105045784407.4661,5.599999996130194,3321.637760801435,0.0,1.41830192345051,-1.63456511497498,25.9
6077,1,386,Algeria:Government,829,109,Government of Algeria,538,GIA,615,Algeria,Africa,"Reuters, 6/7/1997 Algerian exiles say 20 died in pre-poll massacre.",1997,1997-06-06,1997-06-06,17,3,0,0,20,20,20,34.878333,-1.315,1,1,None/Unknown,unclear,Security forces,,1,Rebel group,,0,4,6;7,1,1,ALG-1997-1-3-41,1,0,0,1,0,0,0,0,0,0,0,0,0,0,0,0,0,0,0,0,0,0,0,0,0,0,0,0,0,0,0,0,0,0,0,0,0,0,0,0,0,0,0,0,0,0,0,0,0,0,0,0,0,0,0,0,0,0,0,0,0,0,0,0,0,0,0,0,0,0,0,0,0,0,0,0,0,0,0,0,0,1,0,0,0,0,0,1,0,1,0,0,0,0,0,0,1,0,0,0,0,0,0,0,0,1,0,0,0,0,0,0,0,1,0,0,0,0,0,0,1,0,0,0,0,0,0,0,0,0,0,0,0,0,0,0,0,0,0,0,0,0,0,0,0,0,0,0,0,0,1,0,0,0,0,1,0,0,0,0,0,1,0,0,0,0,0,1,0,0,0,0,0,0,0,1,0,0,0,Algeria,Algeria,DZA,1997,DZA1997,Algeria,1997,DZA,85782302144.57027,1.099999939308077,2910.239243016479,0.0,5.73352275357187,0.0,25.43
6210,3,573,AQIM - Civilians,1040,539,AQIM,1,Civilians,615,Algeria,Africa,"BBC Monitoring Middle East, 16 March 2009, Five people said killed in ""terrorist"" attack east of Algiers           Agence France Presse,   16 March 2009 , Islamists kill five people in Algeria: reports        BBC Monitoring Middle East, 16 March 2009, Paper says five civilians killed by ""terrorists"" in eastern Algeria         HRW, Algeria Events of 2009 http://www.hrw.org/en/node/87706",2009,2009-03-14,2009-03-14,0,0,1,0,1,1,1,35.404167,8.124167,1,1,None/Unknown,disrupt,Rebel group,,0,Civilians,,0,1,3;9,2,1,ALG-2009-3-1391-4,1,0,0,1,0,0,0,0,0,0,0,0,0,0,0,0,0,0,0,0,0,0,0,0,0,0,0,0,0,0,0,0,0,0,0,0,0,0,0,0,0,0,0,0,0,0,0,0,0,0,0,0,0,0,0,0,0,0,0,0,0,0,0,0,0,0,0,0,0,0,0,0,0,0,0,0,0,0,0,0,0,1,0,0,0,0,0,1,0,0,0,1,0,1,0,0,0,0,0,0,0,0,0,0,1,0,0,1,0,0,0,0,0,0,0,0,1,0,0,0,0,0,0,0,0,0,0,0,0,0,0,0,0,0,0,0,0,0,0,0,0,0,0,0,0,0,0,0,0,0,1,0,0,0,0,0,1,0,0,0,1,0,0,0,0,0,1,0,0,0,0,0,0,0,0,1,0,0,0,Algeria,Algeria,DZA,2009,DZA2009,Algeria,2009,DZA,136078288561.5132,1.5999999990051066,3866.295758284184,0.0,5.73706036145628,-1.19691348075867,10.16
6287,4,14005,Government of Algeria - Opponents of Benjedid,10575,109,Government of Algeria,1226,Opponents of Benjedid,615,Algeria,Africa,"Reuters, 6/26/1991 EIGHT KILLED IN ALGERIAN UNREST, ARMY CLAMPS GRIP ON CAPITAL.",1991,1991-06-25,1991-06-26,0,0,1,6,7,7,7,36.763056,3.050556,1,1,"Sonkosi, Z. 1998. Scientia Militaria, South African Journal of Military Studies, Vol 28, Nr 2, 1998.",crack down on protest and/or riot,Security forces,,1,Political supporters,,0,1,5,1,1,ALG-1991-4-10575-5,0,0,0,1,0,0,0,0,0,0,0,0,0,0,0,0,0,0,0,0,0,0,0,0,0,0,0,0,0,0,0,0,0,0,0,0,0,0,0,0,0,0,0,0,0,0,0,0,0,0,0,0,0,0,0,0,0,0,0,0,0,0,0,0,0,0,0,0,0,0,0,0,0,0,0,0,0,0,0,0,0,1,0,0,0,0,0,1,0,0,0,0,1,1,0,0,0,0,0,0,0,0,0,0,0,1,0,0,0,0,1,0,0,0,0,0,0,0,1,0,0,0,0,0,0,0,0,0,0,0,0,0,0,0,0,0,0,0,0,0,0,0,0,0,0,0,0,0,0,0,1,0,0,0,0,0,0,1,0,0,0,0,0,0,0,0,0,1,0,0,0,0,0,0,0,1,0,0,0,Algeria,Algeria,DZA,1991,DZA1991,Algeria,1991,DZA,79504981564.64198,-1.2000005855168183,3042.215909357671,0.0,25.8863869348513,0.0,20.6
6363,1,386,Algeria:Government,829,109,Government of Algeria,538,GIA,615,Algeria,Africa,"BBC 1/18/1999 Three people killed in Bouira Province in ""terrorist attacks El Watan' web site, Algiers, in French 16 Jan 99",1999,1999-01-13,1999-01-13,1,0,0,0,1,1,1,36.25,3.916667,1,1,None/Unknown,eliminate opponent,Politicians,,0,Rebel group,,0,2,1,3,3,ALG-1999-1-3-22,1,0,0,1,0,0,0,0,0,0,0,0,0,0,0,0,0,0,0,0,0,0,0,0,0,0,0,0,0,0,0,0,0,0,0,0,0,0,0,0,0,0,0,0,0,0,0,0,0,0,0,0,0,0,0,0,0,0,0,0,0,0,0,0,0,0,0,0,0,0,0,0,0,0,0,0,0,0,0,0,0,1,0,0,0,0,0,1,0,1,0,0,0,0,1,0,0,0,0,0,0,0,1,0,0,0,0,0,0,0,0,0,0,1,0,0,0,0,0,0,0,0,1,0,0,0,0,0,0,0,0,0,0,0,0,0,0,0,0,0,0,0,0,0,0,0,0,0,0,0,1,0,0,0,0,0,0,0,0,1,0,0,0,0,0,0,0,0,1,0,0,0,0,0,0,0,1,0,0,Algeria,Algeria,DZA,1999,DZA1999,Algeria,1999,DZA,93042234535.43634,3.200001553706059,3066.037700333066,0.0,2.64551113392799,0.0,28.542
6425,1,386,Algeria:Government,829,109,Government of Algeria,538,GIA,615,Algeria,Africa,"Reuters, 11/13/1995 Suicide bomber destroys Algerian police station.",1995,1995-11-12,1995-11-12,0,1,0,0,1,1,1,36.7441,3.9005,1,1,None/Unknown,disrupt,Security forces,,1,Rebel group,,0,4,6,2,1,ALG-1995-1-3-173,1,0,0,1,0,0,0,0,0,0,0,0,0,0,0,0,0,0,0,0,0,0,0,0,0,0,0,0,0,0,0,0,0,0,0,0,0,0,0,0,0,0,0,0,0,0,0,0,0,0,0,0,0,0,0,0,0,0,0,0,0,0,0,0,0,0,0,0,0,0,0,0,0,0,0,0,0,0,0,0,0,1,0,0,0,0,0,1,0,1,0,0,0,0,0,0,1,0,0,0,0,0,0,0,0,1,0,0,0,0,0,0,0,1,0,0,1,0,0,0,0,0,0,0,0,0,0,0,0,0,0,0,0,0,0,0,0,0,0,0,0,0,0,0,0,0,0,0,0,0,1,0,0,0,0,1,0,0,0,0,0,0,0,0,0,0,1,0,0,0,0,0,0,0,0,1,0,0,0,Algeria,Algeria,DZA,1995,DZA1995,Algeria,1995,DZA,81507170839.1999,3.799994789840852,2862.1078682782077,35.3,29.7796264864999,0.0,31.84
6485,1,386,Algeria:Government,830,109,Government of Algeria,539,AQIM,615,Algeria,Africa,worldwide indcidents tracking systemhttps://wits.nctc.gov/FederalDiscoverWITS/index.do?R=88433&Rcv=Incident&nav=No%3D75%26Nrc%3Did%2B8063%2Bdynrank%2Bdisabled%26N%3D0%26Rd%3DICRegion%257C4294955815%257CAfrica%257C%257CCountry%257C4294955648%257CAlgeria,2009,2009-04-09,2009-04-09,1,0,0,0,1,1,1,36.716667,3.666667,1,0,None/Unknown,disrupt,Security forces,,1,Rebel group,,0,2,10,2,2,ALG-2009-1-4-48,1,0,0,1,0,0,0,0,0,0,0,0,0,0,0,0,0,0,0,0,0,0,0,0,0,0,0,0,0,0,0,0,0,0,0,0,0,0,0,0,0,0,0,0,0,0,0,0,0,0,0,0,0,0,0,0,0,0,0,0,0,0,0,0,0,0,0,0,0,0,0,0,0,0,0,0,0,0,0,0,0,1,0,0,0,0,1,0,0,1,0,0,0,0,1,0,0,0,0,0,0,0,0,0,0,1,0,0,0,0,0,0,0,1,0,0,1,0,0,0,0,0,0,0,0,0,0,0,0,0,0,0,0,0,0,0,0,0,0,0,0,0,0,0,0,0,0,0,0,0,1,0,0,0,0,0,0,0,1,1,0,0,0,0,0,0,1,0,0,0,0,0,0,0,1,0,0,0,0,Algeria,Algeria,DZA,2009,DZA2009,Algeria,2009,DZA,136078288561.5132,1.5999999990051066,3866.295758284184,0.0,5.73706036145628,-1.19691348075867,10.16
6502,3,572,GIA - Civilians,1039,538,GIA,1,Civilians,615,Algeria,Africa,"Reuters News, 21 May 2002, ""UPDATE 1-Seven die in Algerian pre-election violence.",2002,2002-05-20,2002-05-20,0,0,3,0,3,3,3,36.066286,1.126022,1,2,None/Unknown,spell,Rebel group,,0,Civilians,,0,1,9,1,1,ALG-2002-3-1390-29,1,0,0,1,0,0,0,0,0,0,0,0,0,0,0,0,0,0,0,0,0,0,0,0,0,0,0,0,0,0,0,0,0,0,0,0,0,0,0,0,0,0,0,0,0,0,0,0,0,0,0,0,0,0,0,0,0,0,0,0,0,0,0,0,0,0,0,0,0,0,0,0,0,0,0,0,0,0,0,0,0,1,0,0,0,0,0,0,1,0,0,1,0,1,0,0,0,0,0,0,0,0,0,0,1,0,0,1,0,0,0,0,0,0,0,0,0,0,0,0,0,1,0,0,0,0,0,0,0,0,0,0,0,0,0,0,0,0,0,0,0,0,0,0,0,0,0,0,0,0,1,0,0,0,0,0,0,0,0,0,1,0,0,0,0,0,0,1,0,0,0,0,0,0,0,1,0,0,0,Algeria,Algeria,DZA,2002,DZA2002,Algeria,2002,DZA,105045784407.4661,5.599999996130194,3321.637760801435,0.0,1.41830192345051,-1.63456511497498,25.9
6554,4,14005,Government of Algeria - Opponents of Benjedid,10575,109,Government of Algeria,1226,Opponents of Benjedid,615,Algeria,Africa,"Reuters, 2/14/1992 MARCH THWARTED AS ALGIERS HELD IN SECURITY VICE.",1992,1992-02-14,1992-02-14,0,0,0,5,5,5,5,36.763056,3.050556,1,2,None/Unknown,spell,Security forces,,1,Political supporters,,0,3,3;6,1,3,ALG-1992-4-10575-6,0,0,0,1,0,0,0,0,0,0,0,0,0,0,0,0,0,0,0,0,0,0,0,0,0,0,0,0,0,0,0,0,0,0,0,0,0,0,0,0,0,0,0,0,0,0,0,0,0,0,0,0,0,0,0,0,0,0,0,0,0,0,0,0,0,0,0,0,0,0,0,0,0,0,0,0,0,0,0,0,0,1,0,0,0,0,0,0,1,0,0,0,1,0,0,1,0,0,0,0,0,0,0,0,0,1,0,0,0,0,1,0,0,0,0,0,0,0,0,0,0,1,0,0,0,0,0,0,0,0,0,0,0,0,0,0,0,0,0,0,0,0,0,0,0,0,0,0,0,0,1,0,0,0,0,1,1,0,0,0,0,0,0,0,0,0,0,1,0,0,0,0,0,0,0,0,1,0,0,Algeria,Algeria,DZA,1992,DZA1992,Algeria,1992,DZA,80936073063.95511,1.8000023031884638,3025.8395481745183,0.0,31.6696619117149,0.0,24.38
6570,3,927,FLN  - Civilians,1398,403,FLN,1,Civilians,615,Algeria,Africa,"Reuters, 1997-11-05",1997,1997-11-03,1997-11-03,0,0,1,0,1,1,1,36.876174,6.909208,1,0,None/Unknown,divergent affiliations,Political supporters,,0,Political supporters,,1,1,3,3,3,ALG-1997-3-1248-1,0,0,0,1,0,0,0,0,0,0,0,0,0,0,0,0,0,0,0,0,0,0,0,0,0,0,0,0,0,0,0,0,0,0,0,0,0,0,0,0,0,0,0,0,0,0,0,0,0,0,0,0,0,0,0,0,0,0,0,0,0,0,0,0,0,0,0,0,0,0,0,0,0,0,0,0,0,0,0,0,0,1,0,0,0,0,1,0,0,0,0,1,0,1,0,0,0,0,0,0,0,1,0,0,0,0,0,0,0,0,1,0,0,0,0,0,0,1,0,0,0,0,0,0,0,0,0,0,0,0,0,0,0,0,0,0,0,0,0,0,0,0,0,0,0,0,0,0,0,0,1,0,0,0,0,0,1,0,0,0,0,0,0,0,0,0,0,0,1,0,0,0,0,0,0,0,1,0,0,Algeria,Algeria,DZA,1997,DZA1997,Algeria,1997,DZA,85782302144.57027,1.099999939308077,2910.239243016479,0.0,5.73352275357187,0.0,25.43
6571,4,14005,Government of Algeria - Opponents of Benjedid,10575,109,Government of Algeria,1226,Opponents of Benjedid,615,Algeria,Africa,"Reuters, 6/30/1991 TWO KILLED IN ALGIERS CLASH, POLICE OUTSIDE ISLAMIC PARTY HQ.",1991,1991-06-30,1991-06-30,0,2,0,0,2,2,2,36.763056,3.050556,1,0,"Sonkosi, Z. 1998. Scientia Militaria, South African Journal of Military Studies, Vol 28, Nr 2, 1998.",spell,Security forces,,1,Political supporters,,0,1,5,1,1,ALG-1991-4-10575-10,0,0,0,1,0,0,0,0,0,0,0,0,0,0,0,0,0,0,0,0,0,0,0,0,0,0,0,0,0,0,0,0,0,0,0,0,0,0,0,0,0,0,0,0,0,0,0,0,0,0,0,0,0,0,0,0,0,0,0,0,0,0,0,0,0,0,0,0,0,0,0,0,0,0,0,0,0,0,0,0,0,1,0,0,0,0,1,0,0,0,0,0,1,1,0,0,0,0,0,0,0,0,0,0,0,1,0,0,0,0,1,0,0,0,0,0,0,0,0,0,0,1,0,0,0,0,0,0,0,0,0,0,0,0,0,0,0,0,0,0,0,0,0,0,0,0,0,0,0,0,1,0,0,0,0,0,0,1,0,0,0,0,0,0,0,0,0,1,0,0,0,0,0,0,0,1,0,0,0,Algeria,Algeria,DZA,1991,DZA1991,Algeria,1991,DZA,79504981564.64198,-1.2000005855168183,3042.215909357671,0.0,25.8863869348513,0.0,20.6
6601,3,572,GIA - Civilians,1039,538,GIA,1,Civilians,615,Algeria,Africa,"Agence France-Presse, 2 May 2002, ""Algeria extremists kill 34 more civilians: security forces [Corrected 05/02/02]",2002,2002-05-01,2002-05-01,0,0,11,0,11,11,11,35.375833,1.313056,1,1,None/Unknown,disrupt,Rebel group,,0,Civilians,,0,1,9,1,1,ALG-2002-3-1390-22,1,0,0,1,0,0,0,0,0,0,0,0,0,0,0,0,0,0,0,0,0,0,0,0,0,0,0,0,0,0,0,0,0,0,0,0,0,0,0,0,0,0,0,0,0,0,0,0,0,0,0,0,0,0,0,0,0,0,0,0,0,0,0,0,0,0,0,0,0,0,0,0,0,0,0,0,0,0,0,0,0,1,0,0,0,0,0,1,0,0,0,1,0,1,0,0,0,0,0,0,0,0,0,0,1,0,0,1,0,0,0,0,0,0,0,0,1,0,0,0,0,0,0,0,0,0,0,0,0,0,0,0,0,0,0,0,0,0,0,0,0,0,0,0,0,0,0,0,0,0,1,0,0,0,0,0,0,0,0,0,1,0,0,0,0,0,0,1,0,0,0,0,0,0,0,1,0,0,0,Algeria,Algeria,DZA,2002,DZA2002,Algeria,2002,DZA,105045784407.4661,5.599999996130194,3321.637760801435,0.0,1.41830192345051,-1.63456511497498,25.9
6647,4,14005,Government of Algeria - Opponents of Benjedid,10575,109,Government of Algeria,1226,Opponents of Benjedid,615,Algeria,Africa,"Reuters, 7/3/1991 TWO DEAD IN LAST 36 HOURS OF ALGERIAN UNREST, 172 ARRESTED.",1991,1991-07-02,1991-07-02,0,0,1,0,1,1,1,36.083333,3,1,0,"Sonkosi, Z. 1998. Scientia Militaria, South African Journal of Military Studies, Vol 28, Nr 2, 1998.",crack down on protest and/or riot,Security forces,,1,Political supporters,,0,1,5,1,1,ALG-1991-4-10575-11.2,0,0,0,1,0,0,0,0,0,0,0,0,0,0,0,0,0,0,0,0,0,0,0,0,0,0,0,0,0,0,0,0,0,0,0,0,0,0,0,0,0,0,0,0,0,0,0,0,0,0,0,0,0,0,0,0,0,0,0,0,0,0,0,0,0,0,0,0,0,0,0,0,0,0,0,0,0,0,0,0,0,1,0,0,0,0,1,0,0,0,0,0,1,1,0,0,0,0,0,0,0,0,0,0,0,1,0,0,0,0,1,0,0,0,0,0,0,0,1,0,0,0,0,0,0,0,0,0,0,0,0,0,0,0,0,0,0,0,0,0,0,0,0,0,0,0,0,0,0,0,1,0,0,0,0,0,0,1,0,0,0,0,0,0,0,0,0,1,0,0,0,0,0,0,0,1,0,0,0,Algeria,Algeria,DZA,1991,DZA1991,Algeria,1991,DZA,79504981564.64198,-1.2000005855168183,3042.215909357671,0.0,25.8863869348513,0.0,20.6
6649,4,14005,Government of Algeria - Opponents of Benjedid,10575,109,Government of Algeria,1226,Opponents of Benjedid,615,Algeria,Africa,"Reuters, 1/29/1992 FIS SAYS TWO DEAD IN POLICE CLASH.",1992,1992-01-29,1992-01-29,0,0,1,1,2,2,2,36.763056,3.050556,1,0,"Sonkosi, Z. 1998. Scientia Militaria, South African Journal of Military Studies, Vol 28, Nr 2, 1998.",crack down on protest and/or riot,Security forces,,1,Political supporters,,0,1,5,1,3,ALG-1992-4-10575-8,0,0,0,1,0,0,0,0,0,0,0,0,0,0,0,0,0,0,0,0,0,0,0,0,0,0,0,0,0,0,0,0,0,0,0,0,0,0,0,0,0,0,0,0,0,0,0,0,0,0,0,0,0,0,0,0,0,0,0,0,0,0,0,0,0,0,0,0,0,0,0,0,0,0,0,0,0,0,0,0,0,1,0,0,0,0,1,0,0,0,0,0,1,1,0,0,0,0,0,0,0,0,0,0,0,1,0,0,0,0,1,0,0,0,0,0,0,0,1,0,0,0,0,0,0,0,0,0,0,0,0,0,0,0,0,0,0,0,0,0,0,0,0,0,0,0,0,0,0,0,1,0,0,0,0,0,0,1,0,0,0,0,0,0,0,0,0,1,0,0,0,0,0,0,0,0,1,0,0,Algeria,Algeria,DZA,1992,DZA1992,Algeria,1992,DZA,80936073063.95511,1.8000023031884638,3025.8395481745183,0.0,31.6696619117149,0.0,24.38
6676,1,386,Algeria:Government,830,109,Government of Algeria,539,AQIM,615,Algeria,Africa,"Associated Press Newswires, 14 May 2002, ""Two police officers reported killed in Algerian capital, five soldiers kidnapped",2002,2002-05-13,2002-05-13,2,0,0,0,2,2,2,36.763056,3.050556,1,1,None/Unknown,secure elections,Security forces,,1,Rebel group,,0,1,7,1,1,ALG-2002-1-4-35,1,0,0,1,0,0,0,0,0,0,0,0,0,0,0,0,0,0,0,0,0,0,0,0,0,0,0,0,0,0,0,0,0,0,0,0,0,0,0,0,0,0,0,0,0,0,0,0,0,0,0,0,0,0,0,0,0,0,0,0,0,0,0,0,0,0,0,0,0,0,0,0,0,0,0,0,0,0,0,0,0,1,0,0,0,0,0,1,0,1,0,0,0,1,0,0,0,0,0,0,0,0,0,0,0,1,0,0,0,0,0,0,0,1,0,0,0,0,0,0,0,0,0,0,0,1,0,0,0,0,0,0,0,0,0,0,0,0,0,0,0,0,0,0,1,0,0,0,0,0,1,0,0,0,0,0,0,0,0,0,0,1,0,0,0,0,0,1,0,0,0,0,0,0,0,1,0,0,0,Algeria,Algeria,DZA,2002,DZA2002,Algeria,2002,DZA,105045784407.4661,5.599999996130194,3321.637760801435,0.0,1.41830192345051,-1.63456511497498,25.9
6704,4,14005,Government of Algeria - Opponents of Benjedid,10575,109,Government of Algeria,1226,Opponents of Benjedid,615,Algeria,Africa,"Reuters, 2/5/1992 FIGHTING RESUMES IN ALGERIAN MOUNTAIN TOWN.",1992,1992-02-05,1992-02-05,0,0,0,8,8,15,8,35.555278,6.178611,1,2,None/Unknown,spell,Security forces,,1,Political supporters,,0,3,3;6,1,3,ALG-1992-4-10575-3,0,0,0,1,0,0,0,0,0,0,0,0,0,0,0,0,0,0,0,0,0,0,0,0,0,0,0,0,0,0,0,0,0,0,0,0,0,0,0,0,0,0,0,0,0,0,0,0,0,0,0,0,0,0,0,0,0,0,0,0,0,0,0,0,0,0,0,0,0,0,0,0,0,0,0,0,0,0,0,0,0,1,0,0,0,0,0,0,1,0,0,0,1,0,0,1,0,0,0,0,0,0,0,0,0,1,0,0,0,0,1,0,0,0,0,0,0,0,0,0,0,1,0,0,0,0,0,0,0,0,0,0,0,0,0,0,0,0,0,0,0,0,0,0,0,0,0,0,0,0,1,0,0,0,0,1,1,0,0,0,0,0,0,0,0,0,0,1,0,0,0,0,0,0,0,0,1,0,0,Algeria,Algeria,DZA,1992,DZA1992,Algeria,1992,DZA,80936073063.95511,1.8000023031884638,3025.8395481745183,0.0,31.6696619117149,0.0,24.38
6705,4,14005,Government of Algeria - Opponents of Benjedid,10575,109,Government of Algeria,1226,Opponents of Benjedid,615,Algeria,Africa,"Reuters, 6/27/1991 ALGERIAN MILITANTS STEP UP VIOLENCE, SLIT SECURITY MAN'S THROAT.",1991,1991-06-25,1991-06-26,0,0,0,3,3,3,3,36.470039,2.827699,1,2,"Sonkosi, Z. 1998. Scientia Militaria, South African Journal of Military Studies, Vol 28, Nr 2, 1998.",spell,Security forces,,1,Political supporters,,0,3,5;6,1,1,ALG-1991-4-10575-8,0,0,0,1,0,0,0,0,0,0,0,0,0,0,0,0,0,0,0,0,0,0,0,0,0,0,0,0,0,0,0,0,0,0,0,0,0,0,0,0,0,0,0,0,0,0,0,0,0,0,0,0,0,0,0,0,0,0,0,0,0,0,0,0,0,0,0,0,0,0,0,0,0,0,0,0,0,0,0,0,0,1,0,0,0,0,0,0,1,0,0,0,1,0,0,1,0,0,0,0,0,0,0,0,0,1,0,0,0,0,1,0,0,0,0,0,0,0,0,0,0,1,0,0,0,0,0,0,0,0,0,0,0,0,0,0,0,0,0,0,0,0,0,0,0,0,0,0,0,0,1,0,0,0,0,1,0,1,0,0,0,0,0,0,0,0,0,1,0,0,0,0,0,0,0,1,0,0,0,Algeria,Algeria,DZA,1991,DZA1991,Algeria,1991,DZA,79504981564.64198,-1.2000005855168183,3042.215909357671,0.0,25.8863869348513,0.0,20.6
